twid,tweep,twtext,fav,rt,url
575372722823262208,foxnews,Hillary Clinton says she provided roughly 55K pages of work-related emails to State Dept from her personal account after leaving office.,42,46,
575372251228323841,foxnews,"""Looking back, it would’ve been better if I had simply used a second email account and carried a second phone."" -@HillaryClinton",45,55,
575371760821907456,foxnews,"Hillary Clinton says she “opted for convenience” to use personal email account, as permitted by State Department. http://t.co/EKzG3JnvyK",31,54,http://bit.ly/1E9phv0
575370877555998721,foxnews,WATCH LIVE: Hillary Clinton speaks now to address private email controversy. http://t.co/EKzG3JnvyK http://t.co/u3CEDLAKU7,45,66,http://bit.ly/1E9phv0
575358309584138240,foxnews,SOON: @HillaryClinton to address private email controversy. Watch live on FNC &amp; Fox News Go: http://t.co/zb2w9RoeVH http://t.co/a7xzhtutWI,40,80,http://www.foxnewsgo.com/
575355761821290497,foxnews,BREAKING NEWS: ATF decides to shelve proposed ban on popular type of bullet. http://t.co/PiIYZlQ8WK,342,434,http://fxn.ws/1Go9Y1j
575354869252419584,FoxNewsLive,"She Said/He Said: #Madonna a dating hypocrite? Is this pregnant model too skinny? @dianafalzone
and @ckensler debate: http://t.co/VUZqjdyvPY",16,8,http://youtu.be/KXf04bs87dY
575352211397464065,foxnews,Shocking video shows truck pulverize New Hampshire toll booth. http://t.co/A19JPFuDAg,42,40,http://fxn.ws/1aZTXW0
575349598987780096,foxnews,WATCH LIVE: President Obama to speak about education at Georgia Tech. http://t.co/ZV5fabmRnL,14,35,http://bit.ly/1aZZYlJ
575348564060057601,foxnews,Paralyzed woman pilots F-35 fighter jet simulator using mind control. http://t.co/iKU8E5By5T http://t.co/imQUX0x7fH,253,224,http://fxn.ws/1FG5eEo
575344788364361729,foxnews,"Majority of congressional lawmakers warn of ammo ban, saying Second Amendment 'at risk'. http://t.co/EqN44gWO9Q",83,130,http://fxn.ws/1aZV08h
575340364992618496,fxnleisure,McHealthy? @McDonald's may add trendy leafy green to it's menu. http://t.co/t6wajURAoh,53,36,
575337097705316352,foxnews,Dog trained to lie down when he smells cancer. http://t.co/L1INLYB3bi http://t.co/e9QwgGSBgN,541,496,http://fxn.ws/1aZOezF
575333462774710272,foxnews,Ancient Chilean mummies now turning into black ooze: Here's why. http://t.co/DimFQvAyKe http://t.co/nSCailjPQF,110,84,http://fxn.ws/1aZNWbW
575329558234161154,foxnews,"Feds have 6.5M Social Security numbers for people 112 years old, and up. http://t.co/LzUUmlwgKu",79,208,http://fxn.ws/1aZNsCu
575325940630192128,foxnews,Boston Marathon bombing trial to focus on secret Twitter account. http://t.co/ip19bOi3dA http://t.co/yH9pETYigw,57,73,http://fxn.ws/1aZMXID
575321519997370368,foxnews,".@BarackObama on Clinton emails, IRS, VA, Fast and Furious: I heard about it on the news. http://t.co/4IVYlk5ZPU http://t.co/FVYPa0CFW9",211,405,http://fxn.ws/1E33qD1
575320540329574400,Fox411,"'Zoolander 2' stars Derek Zoolander, Hansel walk Valentino runway http://t.co/xBHlJKbj3E http://t.co/VDclwC6VsG",12,21,http://fxn.ws/1FFMqF9
575317814547910656,foxnews,Secret Service testing ways to intercept rogue #drones with late-night flights. http://t.co/EvPQigm15V,26,46,http://fxn.ws/1E338fp
575314024662880256,foxnews,Is the #AppleWatch a must-have? via @fxnscitech http://t.co/6arJPIRBsd http://t.co/7KHq9z0qN7,103,107,http://fxn.ws/1E2We9V
575310193233293312,Fox411,#TheBachelor: Chris hands out final rose; new Bachelorette format http://t.co/Pd8jpzfZlN @BachelorABC http://t.co/jM8uIE5vq7,30,16,http://fxn.ws/1FDKxJk
575306569354645504,foxnews,US military hopes to learn from victim of chimp attack. http://t.co/L3n32eLZ4s,25,38,http://fxn.ws/1wp0UcD
575302359187746817,foxnewspolitics,Clinton will meet the press on email controversy http://t.co/Wm5SR3Bxef,28,34,http://fxn.ws/1KQW12K
575298985398657025,foxnews,The @UofOklahoma sorority is 'cooperating' in probe of racist video. http://t.co/uMSEkb1ZME http://t.co/vNgw1OJLw6,59,61,http://fxn.ws/1wp8Dr3
575295320541679616,foxnews,DEVELOPING: @HillaryClinton to address email controversy after UN speech today per Dem source. http://t.co/IeIdGvzzet http://t.co/OyslrMk5H3,69,116,http://fxn.ws/R95hi1
575291354999205888,foxnews,Utah officers say mysterious voice called them to rescue baby trapped inside car. http://t.co/qdf3w5tLjC http://t.co/6aVV6LuivN,556,498,http://fxn.ws/1FFdhRY
575287563197415424,foxnews,French Olympic medalists filming reality show among 10 dead in Argentina helicopter crashes. http://t.co/jeaJAoB3Un,17,48,http://fxn.ws/1wp0umE
575283668115050496,foxnews,Firestorm erupts over GOP letter challenging Obama's power to approve Iran nuclear deal. http://t.co/GsRfIMl7hZ http://t.co/sruJUbsPxn,140,174,http://fxn.ws/1FEYRBe
575224637157572608,foxnewshealth,"More evidence breast cancer and prostate cancer cluster in families
 http://t.co/DbProOpu6t",42,70,http://ow.ly/K7fJz
575220431583506433,foxnews,Ragin' at reporters: Carville rips the media over Hillary's emails http://t.co/xiFD9agJY6 via @HowardKurtz @MediaBuzzFNC,38,35,http://fxn.ws/1CZ46hC
575213440085532672,foxnews,University of Oklahoma students at center of racist chant controversy face possible expulsion http://t.co/VGd4Qwm61H,71,94,http://fxn.ws/18xdUS4
575203651058167808,foxnews,Secret Service testing ways to intercept rogue drones with late-night flights over Washington http://t.co/dOXZF0lUdn,48,71,http://fxn.ws/1HshARL
575193543431483392,foxnews,"Boko Haram gains new power by aligning itself with ISIS, experts say http://t.co/gcIoldmusM http://t.co/kK7V6G7K19",70,177,http://fxn.ws/1CYK9r8
575186650399006720,foxnews,US ambassador to South Korea leaves hospital five days after being injured in knife attack http://t.co/bIccbnCHOi http://t.co/2OkfR9th08,142,189,http://fxn.ws/1BlEnxz
575183502871674880,foxnews,'The Bachelor' recap: Chris makes his choice; new 'Bachelorette' format announced http://t.co/hUWlbHPYDJ via @abbyforget @Fox411,26,19,http://fxn.ws/1Gm5Yyk
575174222634352640,foxnews,Documentary of deadly gang rape banned in India premieres in New York http://t.co/CapY6wh0ii,29,52,http://fxn.ws/1E7PIkK
575163488017911808,foxnews,Biden: GOP senators' letter to Iran leaders 'offends me as a matter of principle' http://t.co/VizhHZdaYZ via @foxnewspolitics,65,76,http://fxn.ws/1KOPup6
575151020231122944,foxnews,"2 French Olympians, including swimming champ Camille Muffat, die in Argentina helicopter crash http://t.co/qIS2Yq8nve http://t.co/5N6FnE7idI",112,265,http://fxn.ws/1HqZb7I
575141602076704768,foxnews,NFL stadium plan for downtown Los Angeles scrapped amid competition from neighboring cities http://t.co/ugOJWFjmZ3 http://t.co/0l1kb6FTfG,150,152,http://fxn.ws/1F5wApd
575136863112966144,foxnews,"Obama sanctions 7 Venezuelan officials, calls Caracas strife 'extraordinary threat' to US security http://t.co/LuDMJUlCtx via @foxnewslatino",47,106,http://bit.ly/1aXsVyx
575127813277159424,foxnews,8 French citizens filming reality show among 10 dead in Argentina helicopter crashes http://t.co/qIS2Yq8nve http://t.co/cQp9o267xu,52,129,http://fxn.ws/1HqZb7I
575096147930300416,megynkelly,TONIGHT: I talk to @TGowdySC on #KellyFile about what he says are “gaps” in #HillaryClinton emails. Tune in at 9p ET. http://t.co/mjKbmsxuJm,140,125,http://fxn.ws/1AapHg3
575078661323272192,foxnews,Utah officers say mysterious voice called them to rescue baby trapped inside car http://t.co/Pnh9bPCZPC,287,295,http://fxn.ws/1AaGjEi
575069940371193856,foxnews,"Exclusive: El-Sisi urges ‘Arab ready force’ to confront ISIS, questions if US ‘standing by’ Egypt http://t.co/E2OipHtUdB",91,171,http://fxn.ws/1BkyP6H
575058171397435392,foxnews,#Egypt’s Pres. el-Sisi: Egyptians have “real fear” of growing radical Islamic ideology in Middle East. Tune in to #SpecialReport. @BretBaier,80,178,
575056134207221761,foxnews,Pres. el-Sisi: “#Egypt now needs U.S. help – especially in the military field – more than ever.” #SpecialReport @BretBaier,108,146,
575055396731125760,foxnews,"“It is a threat to the stability and the security of the whole world,” says Egyptian pres. of #ISIS. #SpecialReport http://t.co/JJ4u57zgZT",202,288,
575055055260229632,foxnews,Sources: Clinton to address email controversy in next few days http://t.co/f6axKg7izs,22,47,http://fxn.ws/1C2PopT
575054944983629824,foxnews,STARNES: Former SEALs chaplain could be kicked out of Navy for Christian beliefs http://t.co/PvmtJJLvpt via @toddstarnes,71,200,http://fxn.ws/1NBH9Ei
575054893406269441,foxnews,TUNE IN to #FoxNews now for @BretBaier’s exclusive interview with Egypt’s president on #SpecialReport. http://t.co/7nq5rl0aT6,76,95,
575053253873811456,JamesRosenFNC,"At 6p on #specialreport @BretBaier, my update on the coalition battle against #ISIS incl. part of Bret's interview with President el-Sisi.",59,33,
575050364094803969,foxnews,Watch @BretBaier's exclusive interview with Egypt's president TONIGHT at 6p ET on Fox News Channel. #SpecialReport http://t.co/R64jhYOxcI,61,75,
575041726668111872,fxnopinion,.@toddStarnes Former SEALs chaplain could be kicked out of Navy for #Christian beliefs | http://t.co/taGn0marwU,44,129,http://fxn.ws/1FAzIYg
575038458931994624,foxnews,Don't forget! Today is the last day to enter in the Fox News College Challenge. Learn more: http://t.co/bmWxM9unyd http://t.co/foOKakIU8K,20,34,http://www.foxnews.com/collegechallenge
575034699355058176,foxnews,Why this moonshine made by a Marine vet is truly all-American. http://t.co/4lSzKgeAmT http://t.co/YcSw124YNr,206,151,http://fxn.ws/1GkyZdX
575030937454387200,foxnews,WATCH: Shocking 'train surfing' stunt caught on camera.  http://t.co/9AKTyF2iRS http://t.co/XuSzIYptBX,53,70,http://bit.ly/1wlJPQU
575026845675995138,FoxNewsLive,"ISIS on the run increases security risk for wider Middle East, experts say | http://t.co/b4URyNFbmw @JonathanHuntFNC http://t.co/dirhzISVAc",27,55,http://www.foxnews.com/world/2015/03/09/isis-on-run-increases-security-risk-for-wider-middle-east-experts-say/
575024096297115648,foxnews,ATF misfire? Guide indicates bullets at center of firestorm already banned; agency blames 'error' http://t.co/3GgVQvB6bc,48,94,http://fxn.ws/1wlyT5U
575019526938492929,foxnews,.@GovWalker signs bill making Wisconsin right-to-work state. http://t.co/QIkZ4Ctw36,225,133,http://fxn.ws/184Wpc1
575015869085954048,foxnews,Here is everything you need to know about the #AppleWatch from today's event via @jamesjrogers http://t.co/p8ugN0AeoI http://t.co/E8BPEh6YQp,84,120,http://fxn.ws/184SpIr
575014086322184193,Fox411,.@TheSimpsons co-creator @simonsam dies at 59 http://t.co/TJ92UhXP6V http://t.co/ddio0VNOPX,41,104,http://fxn.ws/1F4aROD
575011856718303233,fxnopinion,".@SarahPalinUSA: I faced tough questions over email, so should @HillaryClinton
 http://t.co/jT97c2jEB6",297,253,http://ow.ly/K7jFV
575008319225491457,foxnews,".@BarackObama to call for more training, hiring of high tech workers. http://t.co/33aFSpWYfw",27,25,http://fxn.ws/1wleGNn
575004442954571776,foxnews,Home surveillance shows Aaron Hernandez night of killing. http://t.co/ve69FWwnrs http://t.co/IaBilc1reD,62,74,http://fxn.ws/1aXlkA4
575000706647650304,foxnews,Carpenter fired after releasing raccoon that was trapped at a San Francisco job site. http://t.co/tnzepUIEMc,32,52,http://fxn.ws/1wl9PvI
574996880834220032,foxnews,Injuries reported after train collides with truck in North Carolina. http://t.co/0OFZlFueZ8,14,45,http://fxn.ws/1wl8tkx
574994202389573632,foxnews,Follow @fxnscitech for the latest updates on the new #AppleWatch http://t.co/qrLlwMSGab,61,56,
574993179335749632,foxnews,Ancient Celtic Prince's grave and chariot unearthed. http://t.co/F4tKcsOb4S http://t.co/7k2ICzWhwM,145,114,http://fxn.ws/1NAMETC
574989313726808064,foxnews,Single man's surrogate: his own mother. http://t.co/kvpkU6etMx http://t.co/7IqVQ1FyHr,28,52,http://fxn.ws/1NAMfR4
574988312647188480,fxnscitech,"#AppleEvent -- introducing the new MacBook -- ""thinnest,"" ""lightest"" MacBook",21,20,
574985644994244608,foxnews,Secrets revealed: How to interpret car sales speak. http://t.co/GGqppWfvZJ,68,38,http://fxn.ws/1x8NxbK
574981754966044672,foxnews,"Clinton silence on email controversy stoking tensions with Dems, White House. http://t.co/LXOWA7hFvY http://t.co/jsPxfAnvgq",124,184,http://fxn.ws/1NAK6VC
574977552583950336,fxnopinion,.@ToddStarnes: Does the #CatholicChurch answer to San Francisco? | http://t.co/zrZpnttRH8,26,26,http://ow.ly/K6ATD
574974242887860224,foxnews,"White House, NYT leave Bushes out of lead photos from Selma march. http://t.co/BTbuS8VYH3 http://t.co/rYZoNFCCt3",298,509,http://fxn.ws/1x8MMze
574970507121987584,foxnews,Idaho fugitive caught after posting his plans on Facebook. http://t.co/AdGg5srMF3,49,61,http://fxn.ws/1aXkdQM
574963014215958528,foxnews,Solar-powered plane takes off on around-the-world flight attempt. http://t.co/eOzb2qs48I http://t.co/8tnJ8KJas3,145,158,http://fxn.ws/18v2r5L
574961021573537792,foxnews,WATCH LIVE: President @BarackObama speaks at National League of Cities Conference. http://t.co/wK4V4puBkf,16,21,http://bit.ly/1aXkIKT
574959131469090816,foxnews,Supreme Court orders new look at @NotreDame birth control case. http://t.co/0oankSASDh,29,32,http://fxn.ws/18v2Chm
574955394646208512,foxnews,More gruesome testimony expected in #BostonMarathon bombing trial. http://t.co/itmIopzzjH,27,59,http://fxn.ws/1BYB541
574951535966203905,foxnews,Little Ricky from 'I Love Lucy' @ThibodeauxKeith says God keeps him going. http://t.co/XJyPZp58cM http://t.co/xQf9gy1wK6,234,121,http://fxn.ws/18uVktY
574947943523864576,foxnews,Former stripper takes on sex traffickers in North Dakota oil patch. http://t.co/52VxjaIEFP http://t.co/TXCzvXJLic,135,89,http://fxn.ws/1NAeOhs
574947281004314624,Fox411,Bill Cosby speaks to fans in new video message... in his PJs http://t.co/Fzt2NXUwZR http://t.co/MnhVEnNQdm,18,17,http://fxn.ws/1F37NSS
574944051364896768,foxnews,Pennsylvania teen who vanished after getting note sent home from school is found dead. http://t.co/Tjn0GFjxCB,63,76,http://fxn.ws/1E5NqCQ
574940288927469568,foxnews,Two American tourists were caught carving names into Rome's Colosseum via @FoxNewsTravel http://t.co/1rQEoxixSP http://t.co/7wmevfwukU,78,111,http://fxn.ws/1E5IDRS
574936604692774912,foxnews,EXCLUSIVE: Egypt's president on ISIS threat &amp; what US needs to do next. Watch @BretBaier tonight at 6 PM ET. http://t.co/NgD41Go1we,127,183,
574933199840636928,foxnews,Top Senate Democrat urges @HillaryClinton to address private email controversy. http://t.co/romxdQYUEC http://t.co/JYPZxNdITm,87,103,http://fxn.ws/1E5JDp5
574929391458779137,foxnews,"GOP Senate battles for Congress to have vote in Iran nuclear deal as talks resume, deadlines near. http://t.co/xkEBgYQxVn",50,57,http://fxn.ws/1E5JoKu
574925816825409536,foxnews,What to expect from today's #AppleWatch event via @jamesjrogers http://t.co/xmdrJyJ6uL http://t.co/MRmkmFx07z,127,147,http://fxn.ws/1E5IOws
574922622900772864,Fox411,.@SugeKnight due back in court as site posts graphic video of hit-and-run http://t.co/zMAeiFLbsm http://t.co/JtMoU2QSeG,49,59,http://fxn.ws/1F2DJ9T
574920087850721281,foxnews,University of Oklahoma frat closed after video showing racist chant by purported members posted. http://t.co/mjbr5fLHNm,81,167,http://fxn.ws/1BiWdBu
574916159235047424,foxnewspolitics,"Rep threatens to subpoena EPA if agency fails again to turn over texts, emails http://t.co/luEuYE0vV2",60,84,http://fxn.ws/1F2v0EN
574900451444813824,EricShawnonFox,I'm anchoring @AmericaNewsroom with @MarthaMaccallum at 9 am @Foxnews @Foxnewspolitics. Here's @AmbJohnBolton Iran:  http://t.co/tnzcW5UzYX,46,224,http://bit.ly/181Pnow
574881910079401984,foxnews,Syrian activists say German woman killed fighting alongside Kurds against ISIS http://t.co/Zjynvu35VU,55,71,http://fxn.ws/183aEhv
574862183131054080,foxnews,"Troops from Chad, Niger reportedly cross into Nigeria to battle Boko Haram http://t.co/3KK2pEjpYy",62,87,http://fxn.ws/18ueiAO
574859388084576257,foxnews,The latest media frenzy: What if Hillary doesn't run??? http://t.co/c21eUM8vxG via @HowardKurtz @MediaBuzzFNC http://t.co/0pDprSF3Kq,66,67,http://fxn.ws/1E5fKFd
574846206062395392,foxnews,Netanyahu says Israel won't cede land to Palestinians in current Mideast climate http://t.co/CLcZ7SobDq http://t.co/ZCtuEqNSfd,262,170,http://fxn.ws/1Mkd0Ww
574836873010409472,foxnews,Stabbing spree in rural Japan town kills 5 people http://t.co/avlAvFUkDG http://t.co/vOt52CY4gh,53,66,http://fxn.ws/1Mk73sM
574831532809977856,foxnews,"Vatican admits receiving ransom note for documents written by Michelangelo, stolen in 1997 http://t.co/XjtDZSEBDU http://t.co/nc8MN1uctT",86,130,http://fxn.ws/1GwTckk
574812855695867905,foxnews,Top Senate Democrat urges Hillary to 'step up' and address private email controversy http://t.co/gnFpaJxa3s via @foxnewspolitics,64,83,http://fxn.ws/1EuklU8
574796273368203264,foxnews,University of Oklahoma frat closed after video surfaces showing racist chant http://t.co/x9tqrf68Cd,143,179,http://fxn.ws/1Mm160i
574790546142535680,foxnews,Solar-powered plane takes off on around-the-world flight attempt http://t.co/lwoO8Stbtq http://t.co/h2al1CwnOA,262,249,http://fxn.ws/1NyZsK8
574780874186563584,foxnews,"Obama to call for more training, hiring of high tech workers http://t.co/kiLbdJFgmt",39,53,http://fxn.ws/1C16JQ7
574773162878988288,foxnews,"St. Lucia leader says island nation's police kept 'death lists', planted evidence at shooting sites http://t.co/EY4l1BS1MT",30,54,http://fxn.ws/1E0m3r8
574762420133982209,foxnews,2 American tourists caught attempting to carve names in stone of Colosseum http://t.co/Uq8rDJCnDm http://t.co/6Vb4er7iUO,233,312,http://fxn.ws/1Gwt8FT
574752546020962304,foxnews,Dempsey: Some Iraqi troops show up for training ill-prepared http://t.co/RW1qIpDymf,40,50,http://fxn.ws/1CSN5p3
574735999462326273,foxnews,"EXCLUSIVE: Egypt's president on ISIS threat &amp; what US needs to do next. Watch @BretBaier’s must-see intv, MON 6p ET http://t.co/iFrTMDKaHp",167,244,
574731346754437120,foxnews,Girl Scouts aim to boost cookie sales with a drive-thru http://t.co/m5VlSLjt1o,86,90,http://fxn.ws/1aW13uG
574721309063581697,foxnewsvideo,Thousands march for 50th anniversary of #BloodySunday @HARRISFAULKNER @jonathanserrie | http://t.co/3WtdLCtAkk,27,29,http://bit.ly/1Hjln3G
574721294928732161,foxnewsvideo,Missing #MalaysiaAirlinesFlight370: One year later @LelandVittert @ANHQDC | http://t.co/ZudbzhB3qM,17,23,http://bit.ly/1Gwf6nz
574720445590560769,FNReporting,Tonight 8pm ET Enemies of the State on @FoxNews Could you be an enemy of the state? @JonScottFNC http://t.co/3BjAJi9lMy,32,38,
574712706839674880,foxnews,Show highlights fashionable ways to safely conceal guns http://t.co/fj9iYBmzc0 http://t.co/xtka4eyx1J,148,111,http://fxn.ws/1BX5tvA
574708627035922432,foxnews,Jets running back Chris Johnson shot in Orlando http://t.co/cbgMtVMIGg http://t.co/EtBeJfu9Qx,131,299,http://fxn.ws/182bKds
574696722133204992,foxnews,"GOP Senate battle for Congress to have vote in Iran nuclear deal as talks resume, deadlines near http://t.co/bjpdUhvN0o",59,83,http://fxn.ws/1CS2NRr
574696517874806784,foxnewsvideo,#DaylightSavingTime health impact @drdavidsamadi @DrMarcSiegel @ArthelNeville @EricShawnonFox | http://t.co/WT854mUYZj,19,22,http://bit.ly/1Gw60Yf
574683222388314113,foxnewsvideo,#Unemployment numbers for February: Jobs up but wages still lag @MariaBartiromo | http://t.co/ZsAfedQLQi,17,34,http://bit.ly/1EtD8iy
574678672486985729,foxnews,"Suspicions of Turkey, Hamas alliance stoke fears in Israel http://t.co/wVHjTyiGQC http://t.co/UFot8fS9t1",86,180,http://fxn.ws/1KHBg9D
574664517025595392,foxnews,Toxicology tests to determine if dog was poisoned at UK show http://t.co/BchskwDH7X,26,64,http://fxn.ws/1BWDeNO
574655809277186049,foxnews,STARNES: UC Irvine reverses American flag ban http://t.co/UladDvoAA6 via @toddstarnes http://t.co/lF8CibCEoO,461,339,http://fxn.ws/1ASav77
574650336943546369,EricShawnonFox,Report on missing Malaysia Flight 370 is out. Details at 4 pm EST @Foxnews on @ANHQ. I anchor with @ArthelNeville after @Sundayhousecall.,16,23,
574649313873108992,foxnews,Citizens put in the crosshairs of their own government - how could this be happening in America? Watch TONIGHT 8p ET. http://t.co/FBXhAx6e1v,283,473,
574629601520918528,foxnews,Syracuse University track star found dead in Times Square hotel room http://t.co/5NNbFxWttw,81,168,http://fxn.ws/1GfBsX6
574616004933758976,foxnewsvideo,".@SenJohnBarrasso on nuke talks, #ClintonEmails, #ObamaCare @MariaBartiromo | http://t.co/Hp4HlFu27M",13,20,http://fxn.ws/1Gfp5KF
574612561502457856,FoxNewsSunday,"Former Governor Mike Huckabee (R-AR) weighs in on the Hillary Clinton email controversy: ""Once this shadow of... http://t.co/5iE4f015F8",30,24,http://fb.me/3oa98EKHW
574601391139778562,ShannonBream,TWEET BACK - may use answer 1p @FoxNews @ANHQDC - SecLew asks Congress to raise the debt ceiling by March 16th - Should they?  Will they?,18,27,
574594934059065344,foxnews,'I really want a family': Couple denied role as foster parents over permits to carry guns http://t.co/mw6RM1VToJ,104,192,http://fxn.ws/1DYCyE3
574591460646875136,foxnews,#Obama says he learned of @HillaryClinton using private email through news reports http://t.co/N1rKpvoJXC http://t.co/XsWduXuyZX,167,280,http://fxn.ws/1GvqSyL
574590407704608768,EricShawnonFox,#Iran and the bomb: The latest on the nuclear talks at 12 Noon EST @Foxnews @Foxnewspolitics @AmbJohnBolton Watch: http://t.co/ArAxPFcjzn,42,223,http://ow.ly/K4hjV
574588805451157504,foxnewsvideo,"What's next for #Iran nuke talks, #US-#Israel relationship? @MariaBartiromo | http://t.co/6MMvpALBQF",16,20,http://fxn.ws/1KGm0d9
574586432729153537,foxnews,"Where is flight 370? One year after tragedy, still no answers http://t.co/jSdaddEMJF #MH370 http://t.co/Q5pAfMQdmS",90,148,http://fxn.ws/18szMy4
574585450343456770,SundayFutures,".@marykissel: ""At least when @BarackObama's talking about #KeystoneXL you have to take everything with a big grain of salt"" @FoxNews",22,17,
574584457115537411,SundayFutures,".@JMfreespeech:""There's this sense that @HillaryClinton plays by different rules than the rest of us"" @FoxNews @MariaBartiromo #HillaryEmail",57,57,
574584426216079361,SundayFutures,".@EdRollins on #IranTalks ""#Kerry wants a deal so bad he can taste it"" @FoxNews @MariaBartiromo",19,31,
574580440234790912,foxnewsvideo,What happened to missing Malaysia Airlines flight? #FlightMH370 @foxandfriends | http://t.co/GYmlk9IF2f,42,46,http://bit.ly/1NwSEN9
574578889931948034,Fox411,"'Chappie' number one at box office
http://t.co/fWLjxPOLxM http://t.co/e2gHwZvJJi",78,59,http://fxn.ws/1wgfMtO
574578466114265088,SundayFutures,"Fmr Sen George Mitchell (D-ME): #NetanyahuSpeech ""Emboldened opponents to @BarackObama and #Congress"" #IranTalks @FoxNews",11,14,
574578404856475648,SundayFutures,"Fmr Sen George Mitchell (D-ME): ""Rejecting a reasonable agreement is more likely to produce a #nuclear #Iran than less likely"" @FoxNews",9,17,
574574310687289344,SundayFutures,".@SenJohnBarrasso on #HillaryEmail, #Hillary2016 ""There will always be that continuing doubt about--what is she hiding?"" @FoxNews",55,47,
574574283952816128,SundayFutures,".@SenJohnBarrasso: ""I believe #Hillary's whole email system was set up deliberately so she could hide things"" #HillaryEmail @FoxNews",113,91,
574574253254647809,SundayFutures,".@SenJohnBarrasso on #Obamacare: ""We want to protect the #people....if the Supreme Court rules against it"" @FoxNews @MariaBartiromo",9,15,
574572076419305472,SundayFutures,".@SenJohnBarrasso if #Iran gets #NuclearWeapons: ""Nuclear arms race will follow, significant escalation of nuclear arms worldwide"" @FoxNews",22,32,
574571946181967872,SundayFutures,".@SenJohnBarrasso on #IranTalks, #nuclear deal: ""We need to put #sanctions back if they don't hit this deadline"" @FoxNews @MariaBartiromo",17,25,
574570315512053760,FoxNewsSunday,"To commemorate #Selma50, our #FNS Power Player of the week is Civil Rights Leader and Selma Marcher @repjohnlewis http://t.co/m2OKai8Wju",51,58,
574565677656203264,FoxNewsSunday,".@SenRonJohnson on #Iran: Iranian Parliament will get to say yes or no on this, Congress should be given that choice #FNS",81,80,
574565610161508352,FoxNewsSunday,.@SenRonJohnson on #Iran: This negotiation was lost at the start when this administration allowed them to enrich uranium #FNS,104,140,
574562596575014915,FoxNewsSunday,.@georgewillf: The Clintons are the kind of people that can find a loophole in a stop sign #FNS,517,553,
574561609743384576,FoxNewsSunday,.@LannyDavis on Hillary Clinton’s emails: She didn’t do anything wrong or illegal #FNS,29,34,
574559799951560704,FoxNewsSunday,".@LannyDavis on a neutral party conducting review: I think it is a reasonable idea, if the @StateDept asks, she will say yes. #FNS",19,21,
574559775330934785,FoxNewsSunday,".@LannyDavis on Hillary Clinton’s emails:She, visiting 111 countries, as Sec of State might feel the need to use it  #FNS",26,29,
574557854876594176,FoxNewsSunday,".@GovMikeHuckabee on The Clintons: I look at it like Michael Corleone looked at his business; it’s not personal, it’s just business #FNS",71,50,
574557598252294144,FoxNewsSunday,".@GovMikeHuckabee on The Clintons: They know how to play politics, they play to win, use every tool at their disposal to win. #FNS",62,42,
574557561451515905,FoxNewsSunday,".@GovMikeHuckabee on Clinton emails: I think (shadow of doubt) is going to linger throughout a Pres campaign, should she decide to run. #FNS",42,29,
574557108261146624,FoxNewsSunday,".@GovMikeHuckabee on Clinton emails: there are people in the admin who are walking away from her on this, leaving her twisting in the wind",52,45,
574548068894306304,SundayFutures,"Fmr Labor Secy Elaine Chao joins @MariaBartiromo to talk #steelworkers #strike, #unions, #economy, &amp; #jobs on @FoxNews @SundayFutures",9,16,
