twid,tweep,twtext,fav,rt,url
571025691791073280,foxnews,Join @GretchenCarlson on The Real Story now. http://t.co/wEqrrxYVSz http://t.co/IBvJWDBCsM,37,16,http://fxn.ws/1eKpigr
571023114248724480,fxnscitech,"Gear to help you survive the first 24 hours after disaster strikes, by @allison_barrie | http://t.co/ZHjbAR6UsO",26,25,http://fxn.ws/1BhUPiF
571022011901685760,foxnews,Mortar shells land inside Somalia's presidential palace compound http://t.co/wiHjkjJVLP,19,32,http://fxn.ws/1DWTaPW
571018149023260672,foxnews,"#Food additives linked to weight gain, inflammation. http://t.co/GewiQt95gU http://t.co/WGlxgm1Z1k",119,151,http://fxn.ws/1GxHza0
571014402020745216,foxnews,"Is Apple planning the biggest, baddest #iPad yet? http://t.co/jcIW7JpnG9 http://t.co/BaLrvdvnRS",68,84,http://fxn.ws/1GxH9jG
571010608776159233,foxnews,Secret Service plans to fly #drones over Washington http://t.co/cFZ46V2mPn http://t.co/D1hMhCRgHL,71,115,http://fxn.ws/182gSOt
571009375675887617,foxnewspolitics,"FCC approves sweeping Internet regulation plan, in party-line vote  http://t.co/7QMqXcz830 #NetNeutrality",33,156,http://fxn.ws/1BhIA5S
571006943269007361,foxnews,"Susan Rice, Samantha Power to address #AIPAC meeting. http://t.co/qUVb4H1cqH",14,18,http://fxn.ws/1DWQFgx
571005470250397696,OutnumberedFNC,NEXT: House Speaker John Boehner halted floor proceedings yesterday to remind lawmakers how to dress. Details coming up! #Outnumbered,32,28,
571003091207655424,foxnews,"Stolen Chevrolet #Corvette found after 42 years, but could go away again. http://t.co/pXontNZi6a http://t.co/KOIPaJYuVc",166,130,http://fxn.ws/1GxGYVE
570999329361518593,foxnews,More evidence terrorists aren’t really ‘on the run’ via @GretchenCarlson http://t.co/hyFsJUmjXo http://t.co/KXGhrngIrK,71,85,http://fxn.ws/1Awb7UD
570996676971728898,foxnews,"MORE: Senate Panel OKs Loretta Lynch for AG, will go to full senate http://t.co/2rCi0Lf28Y http://t.co/PTLcsdQG4G",18,57,http://www.foxnews.com/politics/2015/02/26/senate-panel-ok-obama-attorney-general-pick/
570995495843209217,foxnews,#Madonna falls down stairs at the Brit Awards http://t.co/lgD4LhoJov http://t.co/WPAV7xAbAu,69,77,http://fxn.ws/1GxDBy7
570991801261125632,foxnews,Watch now @OutnumberedFNC on Fox News Channel. http://t.co/AC8msw2Vih http://t.co/YnkSIMvsw6,33,20,http://fxn.ws/1GxGEpV
570991027399495680,foxnewsalert,BREAKING NEWS: Senate committee approves AG nominee http://t.co/ZCwe3oy1mG,25,55,http://fxn.ws/2E9Swb
570988205090021376,JonScottFNC,Lacey Spears trial: Doting mom vs. calculated killer - Your thoughts? closing arguments today @AnahitaSeda @danschorr on @happeningnow 1ET,7,10,
570987957177290752,foxnews,"WATCH LIVE: GOP leaders, activists speak at #CPAC2015 http://t.co/k3ln4DsO2F",32,33,http://bit.ly/1GxGfUw
570984222757793792,foxnews,'Who kidnapped American Austin Tice?' via @CristinaCorbin http://t.co/N3kmswkahA http://t.co/AmA2LV12bH,28,51,http://fxn.ws/18poVWx
570981069991706624,Fox411,Playboy has Terry Richardson shoot entire issue despite past assault claims | http://t.co/VEwA0WRTre http://t.co/iVhm7AGzAD,21,24,http://fxn.ws/1Bh5lXA
570980430511353856,foxnews,Top intel official: 2014 deadliest year for #terror ever recorded http://t.co/ktxOJJOqnV,32,93,http://fxn.ws/18pm5Ro
570976773426405376,foxnews,Tune into @HappeningNow on Fox News. http://t.co/1KF9mrmX7V http://t.co/MJv8HeeWgt,19,16,http://fxn.ws/1JQnjpn
570972831359442944,foxnews,Vermont amnesty will allow ticket scofflaws to get driver's license returned. http://t.co/upzkm5FfBY,17,23,http://fxn.ws/1JQrUId
570969166787670018,foxnews,UPDATE: NJ drops gun charge against retired teacher over centuries-old flintlock gun. http://t.co/bHRValspZB http://t.co/TwAPe4ptFU,234,150,http://fxn.ws/1wjeh8M
570966631016370179,foxnewshealth,13 ways to stop drinking #soda for good http://t.co/ok61LLhziL,53,66,http://ow.ly/JGduh
570965274955902976,foxnews,What did the most notorious criminals request for their last meals? http://t.co/7wBcV83Fzp http://t.co/CJtjZAYfuA,89,81,http://fxn.ws/1JQmJIl
570961661806260226,foxnews,Ukraine to start pulling back heavy weapons in the east. http://t.co/rdDtopXVy2 http://t.co/abSzDVA3Mu,31,58,http://fxn.ws/1wjaMzt
570959661370732544,BretBaier,I'll join @marthamaccallum and @BillHemmer for @AmericaNewsroom coming up at 10amET on @FoxNews #FNPolitics,25,12,
570957740945776641,foxnews,"NO LAUGHING MATTER:
Algeria donation to #ClintonFoundation broke ethics deal. http://t.co/M14IrgdAiV http://t.co/hYZDXfPRmF",221,387,http://fxn.ws/1JQkx3z
570956443379044353,foxnewspolitics,Likely presidential candidates woo conservative base at CPAC http://t.co/TC5efdWYNH #CPAC2015,32,31,http://fxn.ws/1BAedcB
570954045793243137,foxnews,NASA's Dawn spacecraft releases images showing another bright spot on Ceres. http://t.co/Q1YShW3xKi http://t.co/szbiTyqksJ,201,228,http://fxn.ws/1JQjKzo
570950239764369408,foxnews,Tune into @AmericaNewsroom now on Fox News Channel. http://t.co/odSlF6Obc7 http://t.co/5ArUND5XeA,61,25,http://fxn.ws/Vv2beC
570946758504656898,foxnews,"‘Locked and Loaded’: FCC primed for vote on Internet regs, amid 11th-hour drama http://t.co/np1CNpPZew http://t.co/3RbBQo15w5",42,92,http://fxn.ws/1JQic8H
570909572325462016,foxnews,British authorities reportedly reveal identity of ISIS terrorist 'Jihadi John' http://t.co/ft4PHd5eoR http://t.co/b2WbOlsVN9,185,275,http://fxn.ws/181aXJm
570900291970666496,foxnews,"Authorities in northern Arizona probe vandalism that cut off Internet, phones for hours http://t.co/bzjUfejLiT http://t.co/m2miKoXwvf",31,61,http://fxn.ws/1Eu6dJp
570894263749185536,foxnews,"At least 220 Christians kidnapped in latest ISIS offensive, Syria activist groups say http://t.co/vkF7sSPdMS",96,368,http://fxn.ws/1zh6Sal
570887793208987650,foxnews,Caucus craziness: How much does Scott Walker's Iowa lead mean? http://t.co/8NEp4lzcaL via @HowardKurtz @MediaBuzzFNC http://t.co/88hHblvBW8,41,34,http://fxn.ws/1whZDin
570879824916381696,foxnews,Obama says illegal immigrants should prepare for courts to uphold executive action http://t.co/O5oqaTY3QZ,43,68,http://fxn.ws/1anMgc0
570868724695052288,foxnews,Turkish soldier killed in Kabul suicide attack http://t.co/YmokiAI7ym,19,38,http://fxn.ws/1A9I4RM
570863002141896704,foxnews,"Brooklyn men accused of plot to join ISIS wanted to 'strike fear in the hearts of infidels', feds say http://t.co/aMGahXiRBk",45,100,http://fxn.ws/1AN0LOW
570847713836670976,foxnews,Lawyer says truck driver in California train crash fled after stranding vehicle on tracks http://t.co/lYQjSBbetI http://t.co/ODjUufqO2D,38,60,http://fxn.ws/1FvSU9g
570842583368228864,foxnews,"Mexican man killed by Washington state police was not shot in back, official says http://t.co/Wc6d2Y2oqu http://t.co/I8EbjyH2H9",69,83,http://fxn.ws/1Bya2xL
570832140583239680,foxnews,4 children killed in Canada house fire despite parents' rescue attempt http://t.co/Mn0CW5iz4W http://t.co/F29ecmycO8,34,73,http://fxn.ws/1BxZzCu
570824517536256002,foxnews,"North Korean shipping company renamed its vessels to avoid sanctions, UN says http://t.co/cVF8nHOaRW http://t.co/y8HnaYxXO3",51,78,http://fxn.ws/17AkV4H
570821023207022593,foxnews,Rand Paul slams Jeb Bush for marijuana 'hypocrisy' http://t.co/h80ZfdiZ8f via @foxnewspolitics #HeardOnFox,78,80,http://fxn.ws/1DVB8xI
570813448667287552,foxnews,NASA's Dawn spacecraft releases images showing another bright spot on Ceres http://t.co/TTgI7bL247 http://t.co/XV9gS1GsY1,341,332,http://fxn.ws/18nzw4m
570805635714932736,foxnews,Las Vegas pet store owner gets 5-year sentence in arson case http://t.co/22lbYCfffp http://t.co/lSwzBNhM0O,64,75,http://fxn.ws/17AcVjZ
570802689648381953,foxnews,Missouri public safety chief resigns 6 months into job http://t.co/EGaypJ1xRe http://t.co/uy91TEUQnD,33,60,http://fxn.ws/1BXucky
570798014152904704,foxnews,Algerian gov't donation to Clinton Foundation while Hillary was Secretary of State reportedly violated ethics deal http://t.co/984UeJegT3,172,288,http://fxn.ws/1FY6dTy
570792899316551680,foxnews,1 dead as protesters clash with police outside Acapulco's airport http://t.co/vodkiwQTS4 http://t.co/UjkwuY7fkr,46,94,http://fxn.ws/1wgtpDW
570786769928454144,foxnews,"Schools shuttered, roads treacherous as winter storm slams southern US  http://t.co/eNnZxFYLk7",64,67,http://fxn.ws/17YCnQ4
570781076416638976,marthamaccallum,My thanks to @MarcusLuttrell for being with me tonight on #KellyFile - He and Chris Kyle - American Heroes - we owe them a lot.,604,186,
570770043505496064,foxnewsvideo,#BokoHaram teaming up with #ISIS? @greta | http://t.co/nh5iLG4CT0,25,81,http://fxn.ws/1DrVJIE
570761401087602688,foxnews,California Dems push to repeal 'welfare queen' law http://t.co/8Tjmslde6U http://t.co/U0nBJhrqwL,44,60,http://fxn.ws/1Bdfjck
570747998583435264,foxnews,".@WendellPierce brings back hope after Hurricane Katrina. @foxandfriends celebrates Black History Month, Fri 8:20a ET http://t.co/dVyKYoPCaR",59,40,
570747909110497280,foxnews,Jonathan Gruber fired from Mass. exchange board http://t.co/LLGQlmydRA,205,164,http://fxn.ws/1Be7inE
570745960969560065,greta,".@TGowdySC: You may benefit from the failure to execute the law today, but I don't like when either side plays games w/rule of law @FoxNews",113,91,
570745603056996352,greta,".@TuckerCarlson: The BIGGER government gets, the LESS sensitive they get to American people #IRS @FoxNews",148,133,
570745514448125952,greta,Former #IRS official #LoisLerner got $129K in bonuses from 2010-2013 @TuckerCarlson @FoxNews,63,118,
570738005364723713,greta,.@NileGardiner: We have a situation in Britain that's creating a hornet's nest of extremists #ISIS - it's a massive problem @FoxNews,60,105,
570736825087557632,greta,.@SenDanSullivan: We need a BROAD strategy against #ISIS &amp; we need Pres @BarackObama &amp; @WhiteHouse to level w/American people @FoxNews,99,75,
570736547806359552,greta,Terror arrests come as the world awaits the fate of as many as 100 Christians kidnapped by #ISIS in Syria- @SenDanSullivan joins us @FoxNews,70,139,
570734515775250432,foxnews,TONIGHT: @SenRandPaul gives an exclusive preview of his upcoming #CPAC2015 speech on #KellyFile. Tune in at 9p ET. http://t.co/Q26LaU8lYa,440,338,
570720069681938432,foxnews,Hundreds support Iranian mystic facing death sentence http://t.co/El9pfyK9oJ via @LisaDaftari http://t.co/K1Mn3E5MI9,33,41,http://fxn.ws/1A7LoNo
570719502737936385,foxnews,Boehner dresses down House members for not dressing up http://t.co/Iy9toDnsNT via @ChadPergram http://t.co/NesKeBVvKQ,119,62,http://fxn.ws/1wfeHNJ
570707407677952001,foxnews,House votes to expand college accounts Obama wanted to scrap http://t.co/zAMoOc1Ig0 via @foxnewspolitics,59,50,http://fxn.ws/1DWFLZW
570704966622388224,foxnews,Catch of the day: Italian fisherman hooks a 260-pound catfish. http://t.co/YTgXUv1xxu http://t.co/GpV358YFMc,924,917,http://bit.ly/1BW87mq
570702456323252225,foxnewspolitics,Senate bill to fund DHS advances after Reid signs onto McConnell plan; fate in House uncertain http://t.co/dQeqOp96aB #FNPolitics,12,48,http://fxn.ws/1DbwSWW
570699797692166144,foxnews,Why the upcoming show 'Sex Box' needs to be stopped via @fxnopinion http://t.co/b8DFDjLHxH,59,39,http://fxn.ws/1BW2pRr
570697355923566593,foxnews,The changing world of maraschino cherries via @fxnleisure http://t.co/AAdc21juy2 http://t.co/b2uwn9B68x,55,46,http://fxn.ws/1BW1BMy
570694759431286785,foxnews,"SIM company Gemalto says NSA, GCHQ, likely hacked its network via @jamesjrogers http://t.co/H13JCNKKSV",18,39,http://fxn.ws/1BVXWON
570690960302198784,foxnews,Pic of the Day: #Navy Lt. Gregory Campbell meets his daughter Bernadette for the 1st time after a 7-month deployment. http://t.co/d1n3XxfVYc,1641,836,
570689853563625472,foxnews,3 Al-Jazeera journalists have been arrested for illegally flying a drone over Paris. http://t.co/ZuLp7nxnoa,91,120,http://fxn.ws/1BVMHG7
570687245717360640,foxnews,So rare: Baby born while still inside amniotic sac. http://t.co/LNGc6NhZrc,115,87,http://fxn.ws/1BVSCe5
570684669534076928,Fox411,"Kelly Clarkson all for marijuana legalization, supports the Second Amendment http://t.co/gWwmFZBacz http://t.co/s6ZKmSimos",142,89,http://fxn.ws/1BcUCgP
570682289379651584,foxnews,This is the first Camaro ever built. http://t.co/lRx0TAtx9c http://t.co/PNeSk2Bpvt,508,279,http://fxn.ws/1BVIguI
570679704526544896,foxnews,NASA astronauts take second spacewalk in 5 days. http://t.co/fIb0fPscnQ http://t.co/6irOYkuQWC,91,82,http://fxn.ws/1BVFaad
570678445254033409,foxnewspolitics,"McConnell faces conservative backlash over compromise to fund DHS, Dems get on board http://t.co/XD3m6facoq",33,66,http://fxn.ws/1MSbP3P
570677173289234432,foxnews,Walking dead: This is the safest place to hide from zombies. http://t.co/mGj9NZR9fq http://t.co/yoM7NNPWO1,52,53,http://fxn.ws/1BVCPfj
570675205753823232,foxnews,'Reality for people living in Middle East' via @GretchenCarlson http://t.co/uK15TMIL71 http://t.co/MM8UvCT2Sk,39,39,http://fxn.ws/1BVyDw6
570672137385611264,foxnews,Elsa of #Disney's 'Frozen' arrested for terrible winter in town joke. http://t.co/IRuRIhMqP2 http://t.co/JnoXVY8nYC,397,310,http://bit.ly/1zfc7Ya
570669659134885889,foxnews,"Fiorina to Clinton: ‘Flying is an activity, not an accomplishment’ http://t.co/NzbSSxsD0U http://t.co/rKjAU82GK1",262,226,http://fxn.ws/1BVsnVg
570668247315582976,foxnews,"Taya Kyle wrote a heartfelt message in response to the verdict in the ""@AmericanSniper"" trial. http://t.co/tqGgmg9DmZ http://t.co/ytxXGtCjLQ",1028,507,http://on.fb.me/1EQG2ut
570667547114102785,foxnews,Florida deputy on restricted duty after dragging woman in courthouse. http://t.co/kctCwpQoaK,12,29,http://fxn.ws/1BVrzj8
570664587680296962,foxnews,Mississippi officers are now required to learn Spanish to better reach the community. http://t.co/tWnUGOpCT8,57,127,http://bit.ly/1zfaPwq
570660004468015104,FoxNewsLive,Can Kurds in Iraq and Syria keep up fight against ISIS? | http://t.co/07auHcPV0B @ktmcfarland http://t.co/4JsCJRPZft,48,63,http://www.foxnews.com/world/2015/02/25/kurdish-forces-in-iraq-are-reaching-their-limits-against-isis-experts-say/
570657043859648512,foxnews,Can you really be allergic to the cold? http://t.co/czH8CY13PN http://t.co/RDjhJxLdeM,76,95,http://fxn.ws/1zf7bT1
570654523519213569,foxnews,Congress investigating DC's move to legalize pot. http://t.co/1FCmklhCob,39,36,http://fxn.ws/1zf78Xj
570652083675738112,foxnews,WATCH: Here's your chance to view the inside of the world's only flying B-29 Superfortress. http://t.co/DNlsEUWXGX,88,54,http://bit.ly/1zf6XeL
570649580553019392,Fox411,Report: Former 'America's Next Top Model' contestant Mirjana Puhar killed in triple homicide http://t.co/gxY9ZNh9Nf http://t.co/v04UQS29Dq,45,121,http://fxn.ws/17XUXYL
570646976120938496,FoxNewsLive,Fake #Frozen arrest tape | http://t.co/KPEMUzFEfq @Fox411 http://t.co/J7T3QcdUU3,119,76,http://video.foxnews.com/v/4080147249001/fake-frozen-arrest-tape/?#sp=show-clips
570644626253590529,foxnews,"Lexus tops auto dependability survey, Fiat ranks last. http://t.co/BwYopiYzOp http://t.co/Qbb4HZ5jeH",126,107,http://fxn.ws/1ajZkz9
570641949180321793,foxnews,Drone-shot video captures two courting gray whales. http://t.co/8SEracmKNI http://t.co/sYQZ5yQdoc,118,68,http://fxn.ws/1ajW0DV
570641846155616256,foxnews,"BREAKING : Three NYC residents arrested, charged with trying to join #ISIS http://t.co/oWPeFZpDsD",150,285,http://www.foxnews.com/us/2015/02/25/3-arrested-in-brooklyn-for-allegedly-consipring-to-support-isis/
570639437605941248,foxnews,"‘Locked and Loaded’: FCC primed for vote on Internet regs, amid 11th-hour drama. http://t.co/KzJOL47C2i",26,77,http://fxn.ws/1ajVHZU
570636957065179137,foxnews,Tough men for hire: Ex-special forces in demand for war on terror http://t.co/YvT3WfdP6z http://t.co/oLMEKNcReK,161,141,http://fxn.ws/1ajTqxU
570634410317320192,foxnews,ICYMI: @greggutfeld explains why 'gun-free zone' is liberal for 'sitting duck' http://t.co/dep9ZgWlLk,73,84,http://bit.ly/1ajSA46
570631848205754368,foxnews,"Report: Defense cuts degrading military, US no longer able to fight 2 wars at same time. http://t.co/u7nLAoasVW http://t.co/fePa9LwSJB",107,245,http://fxn.ws/1ajPNIm
570631713883205633,OutnumberedFNC,.@PeteHegseth is #Outnumbered! TUNE IN to @FoxNews Channel NOW. http://t.co/Jg9Y97gfgd,34,16,
570629411269009409,foxnews,Calling all undergrads: Sign up for the 2015 Fox News College Challenge today! Go to: http://t.co/bmWxM9unyd http://t.co/fH504Qdng7,69,75,http://www.foxnews.com/collegechallenge
570628414723493890,fxnopinion,.@pmorici1 Five things you should know about #JanetYellen ’s plan for higher interest rates http://t.co/uRUE9dFrL8,10,22,http://ow.ly/JDJLO
570626855323070464,foxnews,Iran's Revolutionary Guard conducts military drill against replica US carrier. http://t.co/wCq8fwxZV6,34,84,http://fxn.ws/1ajPygd
570624319128100865,foxnews,"Ex-IRS official Lois Lerner received $129,000 in bonuses, records show. http://t.co/kDlx2A9JSq http://t.co/jALS5Yp7IF",85,311,http://fxn.ws/1FsNT19
570621832455286785,foxnews,"VA boss McDonald's special forces fib an 'integrity' issue, says stolen valor activist via @perrych http://t.co/7ooPghevkn",41,38,http://fxn.ws/1ajHCeW
570620638286598147,foxnewsvideo,#NYPD using 'Road House' to teach officers to 'be nice' @OutnumberedFNC | http://t.co/fS7sGrROgq http://t.co/v3m0Mm3ttW,88,81,http://fxn.ws/1zHOVDb
570619244955611136,foxnews,Israeli Prime Minister Benjamin Netanyahu turns down meeting with Senate Democrats. http://t.co/8DJmupgBNd,195,130,http://fxn.ws/1ajGyHX
570616777576546304,foxnews,.@AllianceDefends: Reinstate Fire Chief Kelvin Cochran. #FiredForFaith http://t.co/vjzCVrHyAI http://t.co/rQVJAx8x0i,204,188,http://fxn.ws/1ajE3p2
570614337007546368,foxnews,Tennessee girls high school basketball teams instructed to lose; teams barred from playoffs. http://t.co/aSO9VJe7Rj,52,73,http://fxn.ws/1FsE6bs
570611738489389057,foxnews,Suzanne Somers overcomes toxic mold to compete on 'Dancing with the Stars' http://t.co/2WK2kHaQDn http://t.co/o32K9HBF3I,88,39,http://fxn.ws/1FsCFK4
570609195218677760,foxnews,"Olive oil may prevent cancer, study finds via @foxnewshealth http://t.co/Ly3HWcKoNj",126,143,http://fxn.ws/1ajxrab
570606745640247297,foxnews,FTC cracks down on ‘deceptive’ skin cancer apps. http://t.co/uXVZxmsoSG,10,29,http://fxn.ws/1Fszoui
570604213832544256,foxnews,"ICYMI: Man gets bionic eye, sees his family for the first time in 10 years. http://t.co/eDRSg7JYfs http://t.co/EtRHi79QX2",1373,823,http://fxn.ws/1FsyTQW
570601664610115584,foxnews,Kelly Osbourne threatening to leave 'Fashion Police' show over 'racism' http://t.co/Q7eP8QZFVb http://t.co/dUPNSaFMeR,121,95,http://fxn.ws/1FsxDNR
570599725524750336,OliverNorthFNC,I will be on @FoxNews @AmericaNewsroom at 10:10a ET w/ @marthamaccallum talking about Armed Forces readiness and the threats we face today.,68,54,
570596597689556993,foxnews,Vatican seeks to quell Mexican anger over pope's drug comment. http://t.co/SP4O5Wd3Uo http://t.co/C16ga7NoOj,28,54,http://fxn.ws/1JLJf4W
570593910705266688,foxnewslatino,Police officer arrested in death of 14-year-old at Venezuela protest http://t.co/naBDGl6ck4,13,24,http://fxn.ws/1BbNukT
570591660649750528,foxnews,EXCLUSIVE: State Dept. official arrested in underage sex sting via @JamesRosenFNC http://t.co/Hh3BDUK3uv http://t.co/Ajon0EXGQz,61,192,http://fxn.ws/1vyC5ui
570590639932383232,AmericaNewsroom,"""What we are seeing now is an Islamist attempt to exterminate the last vestiges of Christian civilization in the Middle East."" Lt Col Peters",106,208,
570587854281134080,foxnews,Federal investigators say truck involved in California train crash wasn't stuck on tracks. http://t.co/X48zLpKz2l,16,55,http://fxn.ws/1FsjEHN
570583321362759681,foxnews,GUILTY: Ex-Marine gets life in jail for killing 'American Sniper' Chris Kyle. http://t.co/f176njramu http://t.co/VxsbyrHuA3,1117,1242,http://fxn.ws/1vyAPYb
570575268903067650,Fox411,'Parks and Recreation' ends after seven seasons http://t.co/4xY5VSj2Tr http://t.co/Bacl7rCWUr,70,52,http://fxn.ws/17X8OON
570562515765231617,foxnews,First 'bionic' men: 3 get hands they control with transplanted muscle http://t.co/Qzf0vzOmEp http://t.co/47FcSJydUd,224,212,http://fxn.ws/1MQY2KE
570545182057181184,foxnews,"Official says 20,000 Egyptians flee Libya after ISIS beheadings, airstrikes http://t.co/Le7NAu1UZz",70,139,http://fxn.ws/1wnEyIZ
570534229177532416,foxnews,Iran's Revolutionary Guard conducts military drill against replica US carrier http://t.co/TmzTdCBjj5 http://t.co/sRXPGX8IHV,85,238,http://fxn.ws/1EPJCVB
570532734776446976,foxnews,More cold temperatures and wintry mix expected across the US Wednesday http://t.co/zgdFyUOya3 http://t.co/pf7Djkxfz7,64,60,http://fxn.ws/1wccfav
570524345321140225,foxnews,Why the Beltway showdown over Homeland Security is a nothingburger http://t.co/lcMWHkn1PE via @HowardKurtz @MediaBuzzFNC,24,31,http://fxn.ws/1Ar5WFj
570516247730786304,foxnews,Investigators say truck involved in California train crash wasn't stuck on the tracks http://t.co/dSSi9mDm6R http://t.co/Yw2WAWMSPW,33,68,http://fxn.ws/17xkdFg
570512978639892480,foxnews,Treasury Department issues reprieve for ObamaCare tax errors http://t.co/kck98bhI2E,21,44,http://fxn.ws/18kaUJR
570496062525304834,foxnews,"One-third of detainees in Afghanistan conflict report being tortured, UN report says http://t.co/WFaMML1SIL",37,49,http://fxn.ws/1A5pLx8
570483366765719554,foxnews,California city approves plan to build NFL stadium backed by St. Louis Rams owner http://t.co/1KFNArjLDt http://t.co/KtuWRdlZop,160,226,http://fxn.ws/1DSQa7t
570481481648357379,foxnews,"Tenn. girls high school basketball teams reportedly tried to lose, kicked from playoffs http://t.co/e4V3q1sMBF",57,60,http://fxn.ws/1FWz62C
570480066066575361,foxnews,Chicago Mayor Rahm Emanuel forced into April runoff election http://t.co/AGhfKlJDXb http://t.co/oDJ0N9XkJA,76,67,http://fxn.ws/1JK4hB1
570467734036856832,foxnews,"New study claims gerbils, not rats, responsible for bringing plague to Europe http://t.co/cBMOMbMMCe",48,72,http://fxn.ws/1Fr8aUU
570455407056957440,foxnews,Southwest Airlines grounds 128 planes over missed inspections http://t.co/K9PgqnZnvX,71,122,http://fxn.ws/1GrUjie
570450433086332928,foxnews,NJ home explosion caught on camera injures 15 people http://t.co/DTzbaa8eWl http://t.co/SJBD5Yw2Tj,57,101,http://fxn.ws/1EP8NI1
570441703401730048,foxnews,California city mulling approval for LA-area NFL stadium http://t.co/QDaRzDn7Ki http://t.co/mIs1JkXiOh,106,89,http://fxn.ws/1DnDrs5
570440730574917634,foxnews,Israeli PM Netanyahu turns down meeting with Senate Democrats http://t.co/cmNmpigaxY http://t.co/b467QmgLzV,772,504,http://fxn.ws/1ah3mbw
570438592184496128,foxnewsvideo,'#AmericanSniper' defendant found guilty #ChrisKyle #ChadLittlefield #EddieRayRouth | http://t.co/z19qd9heVn,394,275,http://fxn.ws/1JJYifB
570429094367637504,foxnews,BREAKING: Former Marine found guilty in 'American Sniper' trial http://t.co/X5OQ2Pz8JU http://t.co/mgE4C5KPn7,2170,2257,http://fxn.ws/17wwhGD
570423416521510914,foxnews,BREAKING: Guilty verdict in 'American Sniper' trial http://t.co/XnYJAFQuEx,2504,3122,http://fxn.ws/1BazxDN
570421749394771971,foxnews,WATCH LIVE: Verdict reached in 'American Sniper' trial http://t.co/qAEe9qUZaC,186,192,http://bit.ly/1wmEJUX
570420847254458368,foxnews,BREAKING: Verdict reportedly reached in 'American Sniper' trial http://t.co/XnYJAFQuEx,364,422,http://fxn.ws/1BazxDN
570415985770889217,ainsleyearhardt,Wake up w/ us on @FoxFriendsFirst tomorrow morning at 5am ET! @HeatherChilders &amp; I will be there bright &amp; early with the headlines! #FoxNews,86,43,
570413829118521345,foxnews,EXCLUSIVE: Senior State Dept. official arrested for allegedly soliciting sex from a minor http://t.co/f0c62ovG9k via @JamesRosenFNC,73,244,http://fxn.ws/17VwR0x
570403021307322369,marthamaccallum,See you tonight on #KellyFile - in for @megynkelly,128,43,
570391291495755777,foxnews,Southeast slogs through rare winter storm as another arctic blast freezes northern US http://t.co/rU2K7cxE44,34,43,http://fxn.ws/1BalldN
570390308170510337,FoxNewsLive,Tea Leoni is divorced and loving it | http://t.co/Dxp69qjfPm @Fox411 http://t.co/2NRaMD2Qrx,87,17,http://video.foxnews.com/v/4078444295001/tea-leoni-is-divorced-and-loving-it/?#sp=show-clips
570365791499001857,finnygo,Scoop: @CarlyFiorina #SuperPac Launched (video) https://t.co/9AvoJK9zw5 #FoxNews,28,22,https://www.youtube.com/watch?v=3c1SyMPgGHY&feature=youtu.be
570361697921167360,foxnews,"Fiorina to Clinton: ‘Flying is an activity, not an accomplishment’ http://t.co/c0Q7eozv9n via @foxnewspolitics",122,134,http://fxn.ws/1EOmUNu
570343137865912321,TheFive,Tune in to @FoxNews Channel now! It’s time for #TheFive. http://t.co/WrDWqWqQu1,99,43,
570342501837451264,fxnscitech,'Fake' fossil is actually 189 million-year-old remains of undiscovered species http://t.co/PQ9Oop2m5d http://t.co/8oexhYdYgQ,110,77,http://fxn.ws/17UgNw2
570339969765486593,foxnews,Divorcing billionaire claims wife spends $1M per month. http://t.co/tWzWpUXYid,99,118,http://fxn.ws/1zdwYLB
570337451262083072,foxnews,California's plastic-bag ban put on hold by ballot referendum. http://t.co/hLTSuV3e4C http://t.co/Jfhgbor6CW,48,64,http://fxn.ws/1vwnm3f
570334991667736576,foxnews,ICYMI: Obama vetoed the #KeystoneXL pipeline bill. http://t.co/gNvesCfx0L http://t.co/qqTPlIMG9v,165,369,http://fxn.ws/1vwd1nG
570332416025300994,foxnews,"Mall of America doubles down on gun ban, in spite of terror threat via @toddstarnes http://t.co/5Yh2WT9qBU http://t.co/WegivA8nBy",96,180,http://bit.ly/1ApzQdf
570329864634368000,foxnews,Amber Alert issued for 3-year-old Delaware girl taken by father. http://t.co/MFIyVT6aXr,52,189,http://fxn.ws/1BlbX93
570327501869686786,foxnews,"Senate Majority Leader Mitch McConnell offers exit strategy for DHS funding impasse, bill’s fate uncertain. http://t.co/K1GlfnyjZR",17,41,http://fxn.ws/1vwaYjw
