twid,tweep,twtext,fav,rt,url
584357713238294528,foxnews,Kenya arrests 5 linked to school massacre http://t.co/mbC0CJULW2,38,37,http://fxn.ws/1HvnNfp
584351925761507328,foxnews,Video purportedly shows ISIS destroying ancient Iraq city that withstood Roman invasions dating back to AD 116 http://t.co/42m51VjFOs,41,90,http://fxn.ws/1D3eYd3
584345727456780288,fxnopinion,.@megynkelly: 'Just Disgusting' That @SenatorReid Doesn't Regret Romney Tax Claim http://t.co/vXT6FhQKse,65,55,http://ow.ly/Lc5G9
584326261234737152,foxnewspolitics,Emails reveal former Oregon governor's fiancee influenced staff members | http://t.co/RWLBPtSetf,31,27,http://ow.ly/Lc4iW
584325598203379712,foxnews,"VIDEO: Bill may stop food stamp recipients from buying chips, soda http://t.co/hYyLXW8TcJ",421,161,http://bit.ly/1MP7gcR
584322964998332419,foxnews,"'Price is Right' model Manuela Arbelaez keeps job after $21,960 error http://t.co/T5ZfRuZG8T http://t.co/E1AHkhdjo8",302,141,http://fxn.ws/1y618Xm
584322035549020161,foxnews,Man dies from self-inflicted gunshot wound at Universal Studios theme park http://t.co/pkoYiXd0RA,40,53,http://fxn.ws/19QLUJU
584298394924920833,foxnews,Video purportedly shows ISIS destroying ancient Iraq city http://t.co/42m51VjFOs http://t.co/NsUB5kMCJy,53,160,http://fxn.ws/1D3eYd3
584290692052062208,foxnews,"Ferguson releases racist emails from former city official, officers http://t.co/oCS1s5TgSM",28,40,http://fxn.ws/1J3VhCL
584269770939211776,foxnews,California court rules teaching yoga in schools not gateway to Hinduism http://t.co/d9lEv52Mbo http://t.co/Xg9nlIn4c7,143,145,http://fxn.ws/1EUSLzS
584267328755380224,foxnews,Al-Shabaab reportedly vows more attacks against Kenya after school massacre http://t.co/mbC0CJULW2 http://t.co/rXGfUVvsCn,52,114,http://fxn.ws/1HvnNfp
584251754289631232,foxnews,"2 missing as floods hamper South, Midwest http://t.co/XvvHxE9jfO http://t.co/0sAZ1Zomwx",30,53,http://fxn.ws/1CoSb6s
584243953035157504,foxnews,US geologist freed after serving 8 years in China prison http://t.co/TjJIykiMhK,77,65,http://fxn.ws/1CoLfWU
584230994397396994,foxnews,Judge orders Facebook to turn over documents after man flees criminal charges http://t.co/c0W2dorg54,47,48,http://fxn.ws/1atxm4k
584226819831758849,foxnews,Man dies from self-inflicted gunshot wound inside California theme park http://t.co/pkoYiXd0RA,37,55,http://fxn.ws/19QLUJU
584212425030762497,foxnews,Emails reveal former Oregon governor's fiancee influenced staff members http://t.co/cQZefcP1ZQ http://t.co/YWYwv3tIk9,55,67,http://fxn.ws/1EU7tHD
584193940225568768,foxnews,Blue Bell suspends operations at Oklahoma plant http://t.co/TgC8xoKAaQ http://t.co/O5Ux3Z725E,81,118,http://fxn.ws/1atcpGw
584190588368453633,foxnews,California 'revenge porn' site operator sentenced to 18 years http://t.co/J512FoNdyF,93,67,http://fxn.ws/1MNvkwW
584139228377784320,foxnewspolitics,State Department rejects call for Iran deal to affirm Israel's 'right to exist' http://t.co/wygwjOmtlR #IranTalks,58,144,http://fxn.ws/1Dw75Pt
584127452819034113,foxnews,Florida grandmother's self-penned obituary goes viral http://t.co/2t8jlKd56D via @Karl_de_Vries http://t.co/PG5Q7GUOt9,295,177,http://fxn.ws/1IwCUFu
584126437952589825,foxnews,"Sarah Brady, wife of former Reagan press secretary and gun control advocate, dies at 73  http://t.co/rGZmlF3RYW http://t.co/yZhZ5fh5Ae",68,84,http://fxn.ws/1xKlmFu
584122750979051520,LucasFoxNews,"Don’t be like Pontius Pilate and ignore Christian persecution, Vatican warns http://t.co/bqfw3Z0e5M with @JenGriffinFNC #GarissaAttack",188,147,http://fxn.ws/1J1Akbm
584098161955713024,foxnews,Remains of Japanese WWII soldiers found in sealed cave. http://t.co/0OyKaBgELE,80,95,http://fxn.ws/19PAl5H
584094301786779649,foxnews,Jindal/Robertson in 2016? Only if Willie takes 'huge pay cut' via @Fox411 http://t.co/e48szA7kVq http://t.co/GRNHqAY2rG,214,106,http://fxn.ws/1xJP6lR
584090604331610112,foxnews,"Secret Service accused of leaking info on GOP critic’s job rejection, DHS secretary apologizes via @foxnewspolitics http://t.co/mUVyDd3M66",40,79,http://fxn.ws/1xJN7y3
584087220539097088,foxnews,University cancels church’s #Easter service  http://t.co/5Xb6Qg3yR6 via @toddstarnes http://t.co/epNqu9Nuov,78,193,http://fxn.ws/1xIHYGq
584086804283826176,foxnews,'Bond between strangers': Vietnam POW bracelet to unite pair after decades via @CristinaCorbin http://t.co/sbRdbAYBU0 http://t.co/CbqxdPClsA,53,49,http://fxn.ws/1xJMTH7
584083155365203969,foxnews,Wow family and friends with some of these Easter dinner ideas via @fxnleisure http://t.co/HYNqZJpEag http://t.co/q32NN25C8z,66,43,http://fxn.ws/1xJLuAn
584079196852326400,foxnews,17-year-old girl living in ‘100-year-old body' dies via @foxnewshealth http://t.co/VY8Xt7o2Yp,49,54,http://fxn.ws/1xJHdgq
584075524181327872,foxnews,Planets like Tatooine from ‘Star Wars’ may exist via @fxnscitech http://t.co/Wfr5aqZMMF http://t.co/CBoAB6VLBV,178,107,http://fxn.ws/1ClE69Q
584071987422593024,fxnopinion,University cancels church’s Easter service via @toddstarnes http://t.co/0GwQwEtPSJ http://t.co/DAUI7UovDw,58,104,http://ow.ly/LaUJy
584067820872310784,foxnews,Don’t miss #KillingJesus TONIGHT on Fox News Channel at 8p ET. http://t.co/5yXs3CIThu http://t.co/IQWCXqNTv0,179,133,http://bit.ly/1EFVrBt
584064123782111232,foxnews,ROV industry fighting pending safety regulations it says could backfire via @garygastelu http://t.co/plscoDeozZ http://t.co/oi7FzuNAz6,36,34,http://fxn.ws/1CllSFk
584060430546444288,foxnews,"Selective outrage? Top companies rip Indiana, reap profits in brutal nations. http://t.co/JIIUVOD7dr",177,274,http://fxn.ws/1Clmx9R
584058201978478593,FoxNewsLive,Concern Obama's #Iran deal hurts US relationship with #Israel | @foxnewspolitics http://t.co/OmQmXQb1NY http://t.co/QsxbPK3nEy,62,85,http://video.foxnews.com/v/4151702186001/concern-obamas-iran-deal-hurts-us-relationship-with-israel-/?#sp=show-clips
584056563305877507,foxnews,"The Big Sell: Iran touts nuke deal terms, as US tries to claim win. http://t.co/KnU2PVIjCD http://t.co/5RhOXzFCr4",45,94,http://fxn.ws/1ClkhQ7
584052892522258432,foxnews,"Blind man completes Tough Mudder, vows to run in Boston Marathon via @foxnewshealth http://t.co/HQLhjy1wzU http://t.co/nijZh9AaQf",233,128,http://fxn.ws/1xJ7YBq
584049046035136512,Fox411,.@kelly_clarkson opens up on weight struggles http://t.co/skgP651yzP http://t.co/feFA4o5puY,68,19,http://fxn.ws/1CkAapZ
584046895980384256,FoxBusiness,"We wish @RichEdsonDC good luck on his move to @FoxNews! WATCH @Varneyco and Rich do impressions of each other.
https://t.co/RuPyMfdK61",37,24,https://amp.twimg.com/v/4ca7288f-91dc-409e-9081-10cefb83178b
584045262307368961,foxnews,WATCH: 'Zombie' dog left for dead reappears after being buried. http://t.co/msEUESZUTC,58,59,http://bit.ly/1xJ6hUE
584041492898951170,foxnews,Judge orders California to pay for inmate's sex change. http://t.co/OjNZeHTsgz,52,86,http://fxn.ws/1xJ1UZP
584037789185867776,foxnews,"Arson threat targeting Christian pizzeria just a 'mean tweet,' says Indiana news exec. http://t.co/wSnYHIWCyZ http://t.co/CGpnx5HzMi",76,125,http://fxn.ws/1xJ1sec
584033911459614720,foxnews,Kansas to allow residents to carry concealed guns without permit. http://t.co/Jeg2M30cXB,364,291,http://fxn.ws/1xIZdrb
584030173336477696,foxnews,"Pope Francis told to lay off pasta, pizza after noticeable weight gain via @foxnewslatino http://t.co/yZAi4QkouH http://t.co/YOa7RK2vmh",175,166,http://bit.ly/1J01SxS
584026370583330817,foxnewshealth,The curious story of the man who 'laid an egg' http://t.co/L0w9TVdQAN via @EditorNicoleK http://t.co/v3Xcur09JX,67,71,http://ow.ly/Laior
584022747312824321,foxnews,Photo with Snoop Dogg lands Texas state trooper in hot water. http://t.co/lW48QyfFF9 http://t.co/eWLcRJHqbB,38,55,http://fxn.ws/1EQUJkS
584018824481017857,foxnews,Feds nab Philadelphia woman who allegedly planned to become #ISIS martyr. http://t.co/HohqkCFM0b,53,84,http://fxn.ws/1J03WpB
584015083996520449,foxnews,Texas cops use '21 Jump Street' tactics to bust high school drug ring. http://t.co/5R8rkhRNtx,366,312,http://fxn.ws/1NGx8mm
584012512716173315,foxnews,More families feel worse than better as a result of #ObamaCare via @foxnewspoll http://t.co/vn4jJxzbZm,119,92,http://fxn.ws/1NGy8ag
584011308682485760,foxnews,Watch the Fox News Channel premiere of #KillingJesus TONIGHT at 8p ET. http://t.co/5yXs3CIThu http://t.co/KvvPB5CvtB,279,195,http://bit.ly/1EFVrBt
584007537273372672,foxnewspolitics,".@netanyahu : Iran nuke plan poses ‘grave danger’ to region, Israeli Cabinet ‘strongly’ opposed http://t.co/ZChYE08ZyL #IranTalks",64,65,http://fxn.ws/1EQBh81
584003732620214273,foxnews,Super species: Animals with extreme powers invade museum. http://t.co/cTms2Sh8vS http://t.co/btZDeCCkFL,63,51,http://fxn.ws/1NGxKbH
583999939895660546,Fox411,"Golfer @Lexi Thompson poses topless in @GolfDigest, shares secret to her physique http://t.co/vrDFlU5H0k http://t.co/HGeYD25xRo",70,25,http://fxn.ws/1xIc2SI
583996147351453696,foxnews,Watch how this 'Price is Right' model accidentally reveals answer via @Fox411 http://t.co/iSFHvP7dSJ http://t.co/jnx3UpyZTl,154,107,http://fxn.ws/1y5kkob
583992539641851905,foxnews,Miracle at sea: SC sailor rescued after 66 days adrift in the Atlantic. http://t.co/wWBx2FbkcD http://t.co/m9XlrjlFoS,249,160,http://fxn.ws/1y5kg7T
583988594026524674,foxnews,"Indiana, Arkansas pass revised religious objection laws. http://t.co/11wzprzU1v",42,45,http://fxn.ws/1y5kdJk
583984897787723776,foxnews,US reportedly backed down on initial goals in #IranTalks http://t.co/b6bv6hJi7P http://t.co/KHEix9hRM9,69,154,http://fxn.ws/1y5jY0D
583981143919165440,foxnews,North Korea reportedly recruiting women to join 'pleasure squad' for Kim Jong Un. http://t.co/1kte97pY06 http://t.co/LQSfDQKvRE,227,287,http://fxn.ws/1HryPSP
583975621274906624,foxandfriends,"BREAKING: Fire at GE Appliance Park in Louisville, KY. No injuries reported
https://t.co/iJNFk3CF6v",52,98,https://amp.twimg.com/v/210674fd-7d04-40da-b017-a0b57c58cf8a
583972240934350848,foxnews,"US creates just 126,000 jobs in March, big miss http://t.co/L0UIf3tJm5 by @FoxBusiness",35,52,http://fxn.ws/1DuyVeP
583967738185420800,foxnewspolitics,Iran accuses US of lying about new nuke agreement http://t.co/dzBLzYFOJC #IranTalks,77,127,http://fxn.ws/1BXzIyQ
583967666974498817,foxnews,VIDEO: Indiana pizza place at center of religious freedom outrage http://t.co/PM10Q0tAii,38,46,http://bit.ly/1y5fcQK
583965213994549249,johnrobertsFox,Today's quiz. What city is this? http://t.co/cksUvl4JZV,26,22,
583963382908190721,AmericaNewsroom,"TODAY ON #AmericasNewsroom: The White House responds to the nuclear deal with Iran, @PressSec joins @BillHemmer at 9AM ET on #FoxNews.",12,9,
583961237446238208,foxnewsvideo,Exposing a #Playboy hoax @oreillyfactor | http://t.co/Ew90KyUwRG http://t.co/LxL2piVpEB,21,15,http://bit.ly/1CgYFEt
583961053618274304,foxnews,Miracle at Sea: SC sailor missing since January rescued after surviving at sea on fish and rainwater http://t.co/rnOC29wDwD,226,190,http://fxn.ws/1BUPBVW
583945149731844097,foxnews,Kansas to allow residents to carry concealed guns without permit http://t.co/xWnS4wMFA3,426,325,http://fxn.ws/1FpcLbm
583932316344459266,foxnews,"Germanwings co-pilot accelerated plane on descent, French investigators say http://t.co/rSCZ5xNPzL",33,61,http://fxn.ws/1G8Jp3O
583924168787238912,foxnews,France foreign minister admits skepticism over Iran deal framework amid report of multiple US concessions http://t.co/a1WRzawvbR,69,102,http://fxn.ws/1P4wqD6
583917967051587584,foxnews,Why Robert Menendez was indicted for bribery -- and it's not partisan politics http://t.co/VIWg84dg9L via @HowardKurtz @MediaBuzzFNC,21,20,http://fxn.ws/1IuVE8t
583912829800947712,foxnews,Mass killings of dogs stuns Mexican city http://t.co/rAxleuBBZU http://t.co/OmMwzV5vfh,46,58,http://fxn.ws/1EPmbj8
583909891149959168,foxnews,Malaysia charges cartoonist with 9 counts of sedition over critical tweets http://t.co/qqYhMXnZZW,20,43,http://fxn.ws/1BX8V5M
583896875398369280,foxnews,Russian forces shift from fighting alongside Ukraine rebels to training them http://t.co/7NVbM9mVk1 http://t.co/pvlfxP3QaN,48,78,http://fxn.ws/1EP7Xib
583882559333015553,foxnews,Women's group says North Korea grants them permission to walk across the DMZ http://t.co/EosTveiCP9,28,31,http://fxn.ws/1Hq4vrP
583870875054825473,foxnews,North Korea reportedly recruiting women to join 'pleasure squad' for Kim Jong Un http://t.co/qsj6Jegmfm http://t.co/PNmySdIcJP,257,339,http://fxn.ws/1DtvkgZ
583861637280587777,foxnews,Court documents say woman admitted stabbing DC lawyer in robbery gone wrong at upscale hotel http://t.co/ueZTfRvWa5 http://t.co/Qircy0oECm,36,55,http://fxn.ws/1bTadsr
583851718066249728,foxnews,"Johns Hopkins faces $1B lawsuit over Guatemala venereal disease study from 1940s, 1950s http://t.co/wUcHlOS1Pv",73,80,http://fxn.ws/1I9l3Yw
583843099098611712,foxnews,Photo with Snoop Dogg lands Texas state trooper in hot water http://t.co/f8mQeLwHUc http://t.co/p2AigiH4Yy,88,75,http://fxn.ws/19Q02Ds
583831538858614786,foxnews,New Hampshire town shelves annual Pumpkin Festival after last year's riot http://t.co/AHgkL6kmIh,28,57,http://fxn.ws/19POsIE
583824741049507840,foxnews,Alabama to release inmate held on death row for 30 years http://t.co/R2haJ6iuU5 http://t.co/RRdWj1TY7W,92,120,http://fxn.ws/1IuoCoP
583816170593214464,foxnews,Christian pizzeria slammed by ‘modern-day fascists'  http://t.co/GaTaBmm6K5 via @toddstarnes,157,194,http://fxn.ws/1CeZFsz
583806025326702592,foxnews,Seattle minimum wage increase takes effect and eating out gets more expensive  http://t.co/XGqPsqipKY,126,176,http://fxn.ws/1CfBt9u
583778915925098496,foxnewspolitics,Could @SenatorMenendez case undermine Capitol Hill push to check Iran deal? http://t.co/OR0h0EDdLZ #IranTalks,31,28,http://fxn.ws/1Gl2vlO
583772075841622016,foxnews,Netanyahu could be on collision course with allies in wake of #Iran deal framework  http://t.co/CQwMseea9x,89,140,http://fxn.ws/1xFCOuY
583756451451047936,foxnews,Fox News Poll: More families feel worse than better as a result of ObamaCare http://t.co/J5R6FHdvul via @foxnewspoll,213,203,http://fxn.ws/1IVCFou
583755683624910848,foxnews,"FOX NEWS POLL: Walker jumps to top of GOP field, Clinton emails 'bad judgment' http://t.co/i0Ed5qygIz via @foxnewspoll",77,74,http://fxn.ws/1BSuFyQ
583750937996496897,foxnews,"Republicans uneasy over Iran nuke 'deal,' lawmakers demand say on any final agreement http://t.co/fmtCoefxsN via @foxnewspolitics",78,94,http://fxn.ws/1NLlNU3
583741516880814080,foxnews,"Just in time for #Easter... take a trip to @Lucascandies on the next 'My America,' Friday at 8:20a ET. @foxandfriends http://t.co/HNFHaaVPzx",67,37,
583739356197720064,FoxNewsLive,Dad creates beeping #Easter egg for blind daughter | @ashleydvo http://t.co/fAjjcL6Kbb http://t.co/G2RKR3XVw9,1023,609,http://video.foxnews.com/v/4149306660001/dad-creates-beeping-easter-egg-for-blind-daughter/?#sp=show-clips
583735779857342464,foxnews,"Menendez pleads not guilty to federal corruption, bribery charges. http://t.co/9eKDyfs2sg http://t.co/CFhxETFa1V",31,43,http://fxn.ws/1BUfNkc
583732396547153920,foxnews,Take a look behind the scenes of #KillingJesus and catch the Fox News Channel premiere Friday at 8p ET. http://t.co/gHftVMuBhO,137,80,
583731947081375744,foxnews,Super sticky sweet ways to enjoy #NationalPeanutButterAndJellyDay via @fxnleisure http://t.co/lBt4Tz8Goz http://t.co/YZTaPhWWbC,177,149,http://fxn.ws/1IVJpT5
583728186157961216,foxnews,Navy test flies a drone that can operate both in the air and underwater via @fxnscitech  http://t.co/dDCGCSjvfy http://t.co/y1f991BYhH,206,163,http://fxn.ws/1I8dgKA
583725359205482496,foxnews,Christian pizzeria slammed by ‘modern-day fascists'  http://t.co/GaTaBm4vlv via @toddstarnes,126,191,http://fxn.ws/1CeZFsz
583724356355796992,Fox411,'A.D. The Bible Continues' creators searched around the world for cast http://t.co/emMQXzyKkn http://t.co/Cxr4IHymkb,86,48,http://fxn.ws/1CfiuvD
583720813699829760,foxnews,Three times the charm: Brazilian triplets have joint wedding via @foxnewslatino http://t.co/g2cymerYBM http://t.co/Bwdhjbgpdi,182,94,http://bit.ly/1I8c1uU
583716864515158016,foxnews,How your smartphone could become a ‘Star Trek’–style Tricorder via @allison_barrie http://t.co/u6ilw3WISe http://t.co/ZRzREqk7Gl,66,52,http://fxn.ws/1I8965s
583715369421905920,FoxNewsLive,Robert #Schuller's impact on #Christianity in America | http://t.co/lZtN5k6VJ8 http://t.co/re64r6VcNV,57,45,http://video.foxnews.com/v/4149908691001/robert-schullers-impact-on-christianity-in-america/?#sp=show-clips
583713118078902273,foxnews,Family wants answers after photo of beaten Georgia inmate goes viral. http://t.co/KXcCG9j735,27,37,http://fxn.ws/1I7WI5f
583709310640754688,foxnews,Arizona first in nation to require patients be informed of abortion-reversal option via @AaliaShaheed http://t.co/EQt3VOeTYL,72,55,http://fxn.ws/1BUtVKz
583705427210174464,foxnews,"""I have always insisted that I will do what is necessary to prevent Iran from acquiring a nuclear weapon and I will."" - Obama #IranTalks",45,64,
583703761853390848,foxnews,"""If Iran violates the deal, sanctions can be snapped back into place."" - President Obama on #IranTalks",48,56,
583703331966554112,foxnews,"""If Iran cheats, the world will know it."" - President Obama on #IranTalks http://t.co/stvZQIihbl",80,97,
583702919528067072,foxnews,"""This deal provides the best possible defense against Iran's ability to pursue a nuclear weapon covertly."" - Pres. Obama on #IranTalks",25,29,
583702412369666049,foxnews,"""This deal shuts down Iran's path to a bomb using enriched uranium."" - President Obama on #IranTalks http://t.co/EfFZLJq8g4",66,58,
583701581708660737,foxnews,"""Iran will not build a new heavy-water reactor and Iran will not reprocess fuel from its existing reactors, ever."" - Pres. Obama #IranTalks",45,50,
583700902332145664,foxnews,"""Iran will not be able to pursue a bomb using plutonium because it will not develop weapons-grade plutonium."" - President Obama #IranTalks",37,63,
583700262994382848,foxnews,"""This deal is not based on trust. It's based on unprecedented verification."" - President Obama on #IranTalks http://t.co/Foc1K1veu0",71,128,
583699677175910400,foxnews,"""Iran has also agreed to the most robust and intrusive inspections and transparency regime ever negotiated..."" - Pres. Obama #IranTalks",29,42,
583699192779907072,foxnews,"""We have achieved the framework for that deal. And it is a good deal."" - President Obama on #IranTalks http://t.co/9SB26WyKX5",34,62,
583698701933154304,foxnews,"""Iran has met all of its obligations. It eliminated its stockpile of dangerous nuclear material."" - Obama #IranTalks http://t.co/b75Cr5sWy8",46,69,
583698170527391744,JenGriffinFNC,"POTUS: ""historic"" agreement with #Iran re: nuke program,""if fully implemented, will prevent it from obtaining nuclear weapon."" @foxnews",15,20,
583697992063918080,foxnews,"""Sanctions alone could not stop Iran's nuclear program, but they did help bring Iran to the negotiating table."" - Pres. Obama #IranTalks",17,32,
583697578086146050,foxnews,“The US…has reached a historic understanding w/ Iran...if fully implemented will prevent it from obtaining a nuclear weapon.” - Pres. Obama,44,70,
583696383242153985,foxnews,President @BarackObama to deliver statement on #IranTalks  http://t.co/QYG3JTfUjl,24,29,http://bit.ly/1I83jwN
583689885661335553,foxnews,WATCH LIVE: Announcement on preliminary agreement reached in nuclear #IranTalks http://t.co/j5JN4zjHSv,19,50,http://bit.ly/1I7ZN5i
583683254558986240,foxnewspolitics,"DEVELOPING: Negotiators say preliminary agreement reached at Iran talks, press conference coming up http://t.co/D3jtffXhW6",22,37,http://fxn.ws/1DryKRA
583682875112861696,foxnews,WATCH: Mainstream media attack Indiana pizza shop owners who support religious freedom law.  http://t.co/MKoqQRgS8w,45,83,http://bit.ly/1ELho1T
583679086041509889,foxnews,Indictment claims @SenatorMenendez helped Florida doc's foreign girlfriends get visas. http://t.co/9eKDyfs2sg http://t.co/cOjqgzPnzr,27,48,http://fxn.ws/1BUfNkc
583674067531632640,foxnews,DEVELOPING: Two women arrested in alleged terrorist bomb plot targeting New York. http://t.co/vbKcvRSKIr,72,159,http://fxn.ws/1DrDyX0
583671506133098498,foxnews,Oil workers strike...woolly mammoth skeleton. http://t.co/HcDeA8JUCU http://t.co/47DCzkyVub,93,77,http://fxn.ws/1BUeNN0
583667805230272512,foxnews,The #NYIAS begins tomorrow. Follow @FoxCarReport for full coverage on the latest rides. http://t.co/wXn8CiKzNW http://t.co/UhTWICB7FE,17,17,http://fxn.ws/1IUxFQI
583663960659857408,foxnewsalert,BREAKING NEWS: More than 70 dead in Kenya college attack http://t.co/ZCwe3oy1mG,52,200,http://fxn.ws/2E9Swb
583661415854022656,fxnleisure,Pizza Hut’s revamped ‘Flavor of Now’ menu not boosting sales | http://t.co/tRaQTub8sn http://t.co/rIYXEs9HYA,16,19,http://fxn.ws/1IUfF99
583658889129795585,foxnews,Preliminary agreement reportedly reached in Iran nuke talks. http://t.co/Md22CTIt3M,25,60,http://fxn.ws/1ELcy4N
583656408714874880,foxnews,Pregnant woman walks to hospital to give birth after ambulance carrying her crashes via @foxnewshealth http://t.co/Mx8jyLcZG9,119,121,http://fxn.ws/1IUxapP
583652718897537024,foxnews,Duke University investigates noose found hanging from tree on campus. http://t.co/vSmDxTdUZX http://t.co/jte1zCElqe,55,105,http://fxn.ws/1IUtYuD
583649138794831872,foxnewspolitics,Indiana lawmakers unveil changes to religious freedom law http://t.co/H9CFkimkbc #RFRA,19,42,http://fxn.ws/1GPbYmc
583645187219431425,foxnews,Dem retirements touch off head-spinning leadership shuffle via @ChadPergram http://t.co/5Vg9kiUtEC http://t.co/pFP1kQZyY0,21,22,http://fxn.ws/1bQSkKE
583643450114875394,foxnews,"BREAKING NEWS: Robert Schuller, Crystal Cathedral megachurch founder, dies at 88. http://t.co/vbdKccWX1I http://t.co/1pMevQW6gP",123,291,http://fxn.ws/1bR0nXZ
583641374668369923,foxnews,"F-35 pilots to wear $400,000 helmets that are straight out of a sci-fi movie via @fxnscitech http://t.co/FsHZiyPngW http://t.co/71KhtQDDx1",222,224,http://fxn.ws/1bQU1I3
583637612117663745,foxnews,"Prosecutors: Co-pilot in #Germanwings crash researched suicide methods, cockpit security. http://t.co/JBSRg5Zjj2 http://t.co/0x9RtXqXzJ",34,72,http://fxn.ws/1bQUXwb
583633795246493697,foxnews,"Iran talks enter double overtime, White House repeats 'walk away' threat via @foxnewspolitics http://t.co/TLXVMMnwUK",20,40,http://fxn.ws/1bQS7ar
583630086277996545,foxnews,ICYMI: 3-D print technology provides 'robohand' to 7-year-old girl. http://t.co/dPM4O6EBJU,48,34,http://bit.ly/1ITW5tO
583626196048486400,foxnews,Arkansas man's kidney failure stemmed from too much iced tea. http://t.co/cD1WZB1lEO,67,128,http://fxn.ws/1bQK1yB
583622765866950656,Fox411,.@rihanna pulls off great April Fools' prank on @jimmykimmel http://t.co/eWJaOpp0bJ http://t.co/sn7tLFPVTq,122,76,http://fxn.ws/1CebZcy
583618678022733824,foxnews,Portland International Airport carpet creates buzz with locals and visitors. http://t.co/gWTEmTREJp http://t.co/cadKSYsK1B,52,48,http://fxn.ws/1bQDLXx
583616773733257219,foxandfriends,"We unveiled the 2016 @Chevrolet Malibu and its 'Teen Driver' technology. Check it out! @ehasselbeck
https://t.co/YG17sEa75x",131,82,https://amp.twimg.com/v/ae5da0c1-6e51-47c8-8fb7-08b62c7dfb34
583614992739500033,foxnews,At least 56 dead after Russian fishing trawler sinks with 132 on board. http://t.co/76E7DJYjFZ http://t.co/IADZVtCMBl,44,81,http://fxn.ws/1bQDDrb
583611103394930690,foxnews,Al-Shabaab reportedly claims responsibility for deadly attack on Kenyan college. http://t.co/nn7JyUReP2,22,103,http://fxn.ws/1bQDrYV
583607384938917890,foxnews,Feds won't pursue contempt charges against Lerner for not testifying before House. http://t.co/3u5nnz4A6m http://t.co/fEAYG2Jwfj,64,196,http://fxn.ws/1CAXlzG
583604923738136576,foxandfriends,.@oreillyfactor's 'Killing Jesus' airs tomorrow on @FoxNews. RETWEET if you plan to watch! http://t.co/9dUWyzcEPL,195,256,
583570549248393217,foxnews,"MORE: At least 15 reported dead, 60 reported injured in Kenya college attack http://t.co/BmrzSYWsjp  #GarissaAttack http://t.co/eOn1MA7xXt",55,199,http://fxn.ws/1GiwaMw
583557263614312448,foxnews,BREAKING: Mortuary attendant tells AP at least 15 dead in Kenya university attack,23,88,
583555588556066816,foxnews,'Daily Show' disaster: How Trevor Noah picks on the powerless http://t.co/BEOtsAZlmJ via @HowardKurtz @MediaBuzzFNC http://t.co/msv0FgxzE1,68,88,http://fxn.ws/19LTxRU
583549036814151680,foxnews,"#GarissaAttack update: At least 2 dead, dozens injured as gunmen attack university in Kenya http://t.co/ni4qCqgR0B http://t.co/m3dhYZa0DL",30,74,http://fxn.ws/1F5AKtE
583547036315725824,foxnews,UPDATE: At least 54 dead after Russian trawler sinks with 132 crew on board http://t.co/yfWDHetsCK http://t.co/V1RNwXvgnM,57,122,http://fxn.ws/1FkkR50
583533419163885568,foxnews,Portland International Airport carpet reaches celebrity status http://t.co/TNuXZc6UqT http://t.co/rGab8rQgix,92,90,http://fxn.ws/1DqSxRc
583530501601792001,foxnews,Hawaii art museum returns seven artifacts found to be smuggled from India http://t.co/vJFVirEV5V http://t.co/ZhU7rgC05H,67,102,http://fxn.ws/1EIQJCR
583518849020006400,foxnews,"UPDATE: At least 2 dead, 4 injured as gunmen attack university in Kenya, police say http://t.co/BmrzSYWsjp",21,51,http://fxn.ws/1GiwaMw
583513663354449921,foxnews,Nigeria president-elect vows to 'spare no effort' to defeat Boko Haram http://t.co/c1uoIu50qq via @LucasFoxNews http://t.co/MzfvMB0E0X,122,116,http://fxn.ws/1DxXMgg
583510280002351104,foxnews,Arkansas man's kidney failure stemmed from too much iced tea http://t.co/MwIJ6ooCAe http://t.co/4cQuDRLWTN,172,246,http://fxn.ws/1bQjNMD
