twid,tweep,twtext,fav,rt,url
603509960987779072,NBCNews,VIDEO: #FIFA spokesman says organization's investigation had limits  http://t.co/G8eJSci1Am http://t.co/IoJ0gFSwfI,14,33,http://nbcnews.to/1J4PK07
603502917321129984,NBCNews,"Data breaches cost an average of $3.8m each, new study says. @julpepitone reports http://t.co/zTHhPozdVt http://t.co/yBCkPa2gyk",26,52,http://nbcnews.to/1HvPe7d
603499101825675264,NBCNews,VIDEO: Mother and son lucky to survive Oklahoma floods http://t.co/4g4rmENjF2 http://t.co/s0UIy8HcSc,27,37,http://nbcnews.to/1PMJz6p
603496394654093312,NBCNews,"Loretta Lynch: ""Undisclosed and illegal payments, kickbacks, and bribes became a way of doing business at FIFA"" http://t.co/rYcv3AhQtu",36,66,http://nbcnews.to/1GCVmi5
603494689359134720,NBCNews,"WATCH LIVE: FIFA holds news conference following raids, arrests http://t.co/ycBROmSF8r http://t.co/UfHM2p3bA0",12,37,http://nbcnews.to/1HKVsCM
603492694158143488,AlexSmithNBC,Full @TheJusticeDept statement on its 47-count indictment against nine FIFA officials and five corporate executives http://t.co/TI7VQZdPjd,13,25,http://www.justice.gov/opa/pr/nine-fifa-officials-and-five-corporate-executives-indicted-racketeering-conspiracy-and
603492650734477312,NBCNews,US DOJ: 9 #FIFA officials and 5 corporate executives indicted for racketeering conspiracy and corruption http://t.co/MdYoG4ADFq,13,33,http://nbcnews.to/1Q9IAbA
603492318746976256,BillNeelyNBC,"Jeffrey Webb &amp; Jack Warner,current &amp; former presidents of #FIFA's US-Caribbean-LatinAm region charged with racketeering and bribery offenses",9,25,
603492176799080448,NBCNews,"LIVE: FIFA addresses arrests, probe into World Cup corruption http://t.co/q1EN2Z8LLP",11,26,http://nbcnews.to/1AxunTP
603489128722862081,NBCNews,Gaza has highest unemployment rate: World Bank report http://t.co/x4YS7WWHc0 http://t.co/T18inANB6h,21,45,http://nbcnews.to/1GCSAt6
603487364258889728,NBCNews,"FIFA officials held over alleged corruption; 2018, 2022 World Cups also probed http://t.co/L3TyPp1JRf http://t.co/cgcbYjqF3d",23,47,http://nbcnews.to/1BoDG3E
603485189868802049,AlexSmithNBC,Full statement on separate investigation by Swiss attorney general's office looking at the 2018 and 2022 World Cups https://t.co/8X7YgarmnC,15,21,https://www.admin.ch/gov/en/start/documentation/media-releases.msg-id-57391.html
603484844409102336,NBCNews,"Swiss authorities launch criminal probe over bribes linked to 2018, 2022 World Cups http://t.co/vW4HkACvBx  #FIFA http://t.co/f4msWVm2Z2",17,46,http://nbcnews.to/1cibtEQ
603482885832757248,NBCNews,Josh Duggar's politico dad advocated death for rapists during run for Senate http://t.co/4fmqStspSh http://t.co/nqa6aAUGqh,29,33,http://nbcnews.to/1HvJMBk
603482253847601152,NBCNews,COMING UP: FIFA to hold press conference after officials arrested over corruption. Live stream here: http://t.co/OkhQsFsbG7,12,35,http://nbcnews.to/1Atfgv2
603478748885884928,NBCNews,"Documents have reportedly been seized at #FIFA headquarters, after officials arrested http://t.co/mANnkV9jxt http://t.co/cZ1mupnnAT",32,64,http://nbcnews.to/1EwR8Co
603477528540553216,NBCNews,"63-year-old knocked out with one punch and robbed of $1, via @nbcwashington http://t.co/JbQ7lFp5Fu",21,28,http://nbcnews.to/1KzdYl9
603472084233224193,NBCNews,Tornado touches down and tosses cars in Ohio http://t.co/leGkacfDPO http://t.co/ZqCS6dsr7L,40,84,http://nbcnews.to/1FXjWeH
603469763541639168,NBCNews,Penn State suspends KDR fraternity for three years http://t.co/MN8MgNeRQU http://t.co/kHmqn0S6Ov,26,30,http://nbcnews.to/1FOepoG
603467510692864000,NBCNews,"B.B. King poisoning claims are 'baseless and unfounded,' lawyer says http://t.co/oZQ5p3KEv2 http://t.co/cSUBkqGMqQ",21,25,http://nbcnews.to/1KnbuTO
603463544110190592,NBCNews,"UPDATED: FIFA officials held over alleged corruption, face charges in U.S. http://t.co/yrMSe7Jeed http://t.co/I1S6Cl6lmr",28,64,http://nbcnews.to/1eum0Pb
603446539957178368,NBCNews,Six international soccer officials arrested in Zurich as part of US probe into FIFA corruption http://t.co/xZxAzNLR3G http://t.co/mSiqLy2rJd,42,88,http://nbcnews.to/1PMp7mk
603423625413337088,NBCNews,"Top FIFA officials to be charged with fraud, bribery over host country selection http://t.co/tednlU2ROp http://t.co/2NEGMcGWOA",161,328,http://nbcnews.to/1Bol1Vw
603417859654610945,NBCNews,"Tornado touches down and topples cars in suburb of Dayton, Ohio http://t.co/AewNmbnHSO http://t.co/c2UxLlq1b2",48,125,http://nbcnews.to/1AsVOhL
603385618085851137,NBCNews,Israel launches airstrike on Gaza after rocket attack http://t.co/9FWoSRU4ve http://t.co/PIsnWt5mXN,46,148,http://nbcnews.to/1LFgSSJ
603378079684284417,NBCNews,FBI investigating report of threat against plane at LAX http://t.co/8eIC5GgMQh,19,168,http://nbcnews.to/1HK9x3m
603374303770517504,NBCNews,"Internet will have 3.2 billion users by end of this year, report says http://t.co/tR0eR2YeO1 http://t.co/OH9K0oBGzz",96,132,http://nbcnews.to/1etrLwt
603363207814709249,NBCNews,"Josh Duggar's dad, of '19 Kids' fame, once advocated death for rapists http://t.co/sXnkrfIQ8F http://t.co/xied43H6ZQ",94,99,http://nbcnews.to/1GC5gAp
603356611315372032,NBCNews,'God sent us angels': Syrian migrant recounts rescue by Greek coast guard http://t.co/qagUtkYGuW http://t.co/CxGhUmKxyF,48,44,http://nbcnews.to/1AsCG3G
603351357102358529,NBCNews,"Sam Shepard, playwright and actor, arrested on drunken driving charge http://t.co/8vfQXroxLJ http://t.co/HMtWmxF7MN",55,64,http://nbcnews.to/1GC0oLF
603347927587758080,NBCNews,Vox Media buys tech news website Re/code http://t.co/tT6jXr4GYh,14,15,http://nbcnews.to/1FVZrin
603339946745851905,NBCNews,Bernie Sanders on 2016  presidential run: Campaign will be 'a movement of millions' http://t.co/xQorWYaau4 http://t.co/Zx1UgQFuFz,92,67,http://nbcnews.to/1dvXOf8
603338451266580480,NBCNews,Death toll jumps to 18 after relentless rain and strong storms in Texas and Oklahoma http://t.co/XVbuFQvFAM http://t.co/OQelzgtCge,38,113,http://nbcnews.to/1PLAxXk
603332753808093184,NBCNews,LAPD officer wanted on murder charge arrested in Mexico http://t.co/vSdclV4fnq http://t.co/sGOkgdysrS,54,76,http://nbcnews.to/1HJQMgo
603331505230864384,NBCNews,Can cutting your baby's umbilical cord later make your kid smarter? http://t.co/7w271e8Up4 http://t.co/iuwZyJbtDW,49,45,http://nbcnews.to/1FVOwW7
603326709442699264,NBCInvestigates,"A Georgia jail is getting a ""top-to-bottom"" look from outside consultants. Here's why: http://t.co/AvEMKj80Ot http://t.co/GpZp5XwwOj",18,25,http://www.nbcnews.com/health/mental-health/mathew-ajibades-death-sparks-chatham-county-jail-shakeup-n364976
603311002516660226,NBCNews,Court: Obama's immigration programs to remain on hold http://t.co/srLAqXnK9C http://t.co/Wudlxc63fG,14,33,http://nbcnews.to/1BnOdvL
603307311910772736,NBCNews,Drinking may be bad for the elderly heart  http://t.co/ODH2RaY6SX http://t.co/8SgXMveTcV,21,33,http://nbcnews.to/1LEc2oK
603302312111640579,NBCNews,Gunman in deadly North Dakota Wal-Mart shooting identified as airman from Grand Forks Air Force Base http://t.co/88e1cvyPKf,17,60,http://nbcnews.to/1F91mJL
603301425603567617,NBCNews,WATCH LIVE: Bernie Sanders officially launches his 2016 campaign http://t.co/I5eSKNWaCa http://t.co/KJVboFZ4ne,100,101,http://nbcnews.to/1Fettbu
603301021268443136,NBCNews,Texas flooding death toll continues to climb http://t.co/HMVqzwYUmm http://t.co/2xSxGNd6mR,45,107,http://nbcnews.to/1PLdUm3
603297037417902080,NBCNews,"IRS says thieves stole tax info from 100,000 taxpayers http://t.co/xD3XzMTCMQ",20,53,http://nbcnews.to/1BnKQFc
603295889906630657,NBCNews,An 11-year protest inside a Catholic church could be near its moment of reckoning http://t.co/Z8wTzIHG13 http://t.co/fHe2qSEp3R,22,21,http://nbcnews.to/1Kly6UK
603293564542517249,NBCNews,"Google Doodle honors Sally Ride, the first American woman in space http://t.co/3uyd0qGqo7 http://t.co/HvUgELozDw",137,82,http://nbcnews.to/1J3iera
603289632810397698,NBCNews,5 'dumb' phone alternatives to simplify your mobile life http://t.co/QV6H9A3s8f http://t.co/KIJ7TFUPRV,40,27,http://nbcnews.to/1BnIru4
603287269752070145,NBCNews,10 devastating photos of the widespread flooding in Texas http://t.co/jRRNoDcjSC http://t.co/F5EE6YLGvh,58,141,http://nbcnews.to/1FVd5lU
603286748135870465,NBCLatino,"Homecoming Queen, star athlete, cheerleader, student council president, dies in Texas floods
http://t.co/VsOJCSGX7o http://t.co/ptTLlMgvOn",33,49,http://nbcnews.to/1JTQ3vw
603283785438879746,NBCNews,Active-duty soldiers among the ranks of nation's most violent outlaw motorcycle gangs http://t.co/Dv7202774E http://t.co/uAjI2sm2Tf,198,577,http://nbcnews.to/1F8SqUI
603280991311003648,NBCNightlyNews,Google commits $20 million to fund assistive technologies for people with disabilities http://t.co/ehpPHaFsQt http://t.co/1TnLmVwgrW,104,115,http://nbcnews.to/1FNlMNg
603279621719752704,NBCNews,Video: Revelers gored at festival bullfights in Peru http://t.co/WKRCV616IP http://t.co/1MLf8nChCm,31,18,http://nbcnews.to/1JUZN91
603275115191734272,NBCNews,How to get through the retirement 'danger zone' http://t.co/mQu2VSgQ66 http://t.co/wMHGqXA7cs,16,11,http://nbcnews.to/1JUWz5f
603269036131115008,NBCNews,Paralyzed college student walks across stage at graduation http://t.co/Suu3zkteAA http://t.co/0FK9daVzpx,353,202,http://nbcnews.to/1FedfPE
603268033235308544,NBCNews,Cleveland agrees to broad set of police reforms http://t.co/b51wZDuICf,21,25,http://nbcnews.to/1JUTz99
603264626176950272,NBCNews,Palmyra's ancient ruins unharmed for now http://t.co/1abAvNlblg http://t.co/hLCMyRsgLR,65,70,http://nbcnews.to/1RlbVSB
603243098567737344,NBCNews,"The world has moved on, but Nepal's youth are just getting started http://t.co/z4CFeJwgCQ via @NBCAsianAmerica http://t.co/VoNiWC6yGr",37,49,http://nbcnews.to/1RkQJfJ
603241854784708610,NBCNews,Amtrak says it will add 'inward-facing' cameras to trains http://t.co/7NlWRMHhZh http://t.co/DvOXnCNVhp,38,45,http://nbcnews.to/1ArNZJb
603239349371727873,NBCNews,U.S. returns smuggled antique artifacts to Italy http://t.co/pKyCZfVVKY http://t.co/inTEZDz44o,43,37,http://nbcnews.to/1ArNVt7
603237485800509440,NBCNews,Air France jet triggered cockpit warning after flying too close to mountain http://t.co/4zv9QtwKi0 http://t.co/jVBjwWQBgW,36,31,http://nbcnews.to/1SAql35
603235549239980033,NBCNews,Supreme Court to hear case on drawing voting districts http://t.co/onDqlwyt0x http://t.co/wkm6mm652C,38,39,http://nbcnews.to/1FdLvKW
603234341624348672,NBCNews,"2 dead, 1 hurt in North Dakota shooting at Wal-Mart http://t.co/E6XbwdyhaV",18,42,http://nbcnews.to/1LFMhoD
603231861054296064,NBCNews,Top Dem Senate recruit Ann Kirkpatrick to challenge John McCain http://t.co/177XZqfndP http://t.co/DBW2Opdgde,34,32,http://nbcnews.to/1LFAyGx
603228043381997568,NBCNews,Bones found in canyon matched to student who vanished in '82 http://t.co/0bDFAwvzOT,26,42,http://nbcnews.to/1HIWj6U
603225878408142849,NBCNews,Radio host kills rabbit live on air before cooking it http://t.co/dDDrdH4pTj http://t.co/6IMnArvwTj,38,65,http://nbcnews.to/1BnkAe8
603222952105136128,NBCNews,State Department will announce timetable for Clinton email release today http://t.co/DC9LZllnIs http://t.co/WVUMDBi7Hf,20,31,http://nbcnews.to/1JUlu8V
603219348254269440,NBCNews,WATCH LIVE: Funeral for Omaha cop gunned down hours before maternity leave http://t.co/k32kCfKMAI http://t.co/xlbs5s2Go0,65,68,http://nbcnews.to/1F8nILE
603218049899098113,NBCNews,"He's in, but Vermont's delegation isn't ready for Bernie Sanders http://t.co/LoPx7muKkB http://t.co/Bqw2muGXiH",14,13,http://nbcnews.to/1KxnIwp
603210464198287360,NBCNews,8 people missing after vacation home ripped off ground in Texas floods http://t.co/VlvFdeC0Rz http://t.co/OTRVQc29wP,35,69,http://nbcnews.to/1LFqkGc
603208290206654464,NBCNightlyNews,Runway closed at Dallas-Fort Worth Int'l Airport after sinkhole opens up near a runway http://t.co/Hp4fgXgM0P @NBCDFW http://t.co/BqtyHxkRol,77,191,http://nbcnews.to/1AvJM76
603202947745521664,NBCNews,Taco Bell and Pizza Hut chuck artificial ingredients http://t.co/RyK1iRNmVo http://t.co/lzoeDIlmIQ,112,120,http://nbcnews.to/1cgbmtI
603196565109514240,NBCNews,"Flooding strands Houston Rockets fans, Dwight Howard in arena overnight http://t.co/QMU4o3859c http://t.co/MZrjRwEJ0Q",61,113,http://nbcnews.to/1IXSRsl
603189396796514304,NBCNews,The 2016 race is about to get even more crowded http://t.co/SSyJNo6Yk6 http://t.co/q56eOLbytU,23,19,http://nbcnews.to/1GAuSgY
603180101853945856,NBCNews,VIDEO: Man covered in 240 pounds of bees sets new world record http://t.co/oe2I3DWOWk http://t.co/w7VFkJRbvk,91,110,http://nbcnews.to/1cXFo62
603177375392731136,NBCNews,.@SenSanders asks if the American economy is 'moral' http://t.co/MIMR5dJ1HM http://t.co/K28FpTmK1f,44,42,http://nbcnews.to/1cXEINU
603170582214086656,NBCNews,#Knowitall Tuesday: The day's top seven news stories http://t.co/D2iKF6yXZM http://t.co/B5RlxfjuV7,40,26,http://nbcnews.to/1LCq2zb
603154914345394176,NBCNews,"Afghan peace envoy and Taliban hold talks in China, source tells @NBCNews http://t.co/EILzZGPOKA http://t.co/fRNdGBRRQ7",20,35,http://nbcnews.to/1duvb1R
603152245929222145,NBCNews,Burundi showdown: Protesters' stones against police bullets http://t.co/eklhKGs9Pz http://t.co/WaH9uPxQnb,23,38,http://nbcnews.to/1LEKJeu
603147963976839168,NBCNews,Homecoming queen dies in Texas floods on way home from prom  http://t.co/SzpDuoU5gT http://t.co/JGWDMTXY1E,61,148,http://nbcnews.to/1Q86vrM
603146539922563072,NBCNews,#BREAKING: Charter agrees to buy Time Warner for $55 billion http://t.co/Q1DGWxiOsA http://t.co/1Gb9QQd6HY,42,114,http://nbcnews.to/1RjPqh2
603142612267204608,NBCNews,VIDEO: Woman recalls heartbreaking last words to sister swept away with kids in flooding http://t.co/kfHx68wNfD http://t.co/VMfdkRn9oV,32,37,http://nbcnews.to/1AvhR7a
603137738829864960,NBCNews,'Literally no way out' of flood-ravaged Houston mall http://t.co/4bycvGiZoE #houstonflood http://t.co/HYzDz3iQgZ,41,95,http://nbcnews.to/1KjLrNq
603135516196917248,NBCNews,"Nine brains found next to train tracks in NY, via @NBCNewYork http://t.co/oT3sBWw3Ei",65,96,
603132608621486080,NBCNews,UPDATED: 30 million told to brace for dangerous storms as Houston hit by record floods http://t.co/1dGRNEFlnA http://t.co/M76Ybrq637,31,102,http://nbcnews.to/1KjISLe
603131736113979392,NBCNews,"Watch live coverage of the record flooding in Houston, via NBC affiliate @KPRC2  http://t.co/g3fareMj4m",16,36,http://nbcnews.to/1SzPU43
603128166438346753,NBCNews,Iraq launches operation to drive ISIS out of Anbar http://t.co/A0p3BxsBKG http://t.co/vic9hGw72x,26,43,http://nbcnews.to/1RjF7JN
603127169406107649,NBCNews,Pope Francis says he hasn't watched TV since 1990 http://t.co/ARoKhzIm2W http://t.co/RBRT1WXVJz,85,78,http://nbcnews.to/1KjFLTq
603125157255901185,NBCNews,IT chief at Bangladesh Coca-Cola unit arrested as ISIS suspect http://t.co/WTGPmAd0q2,25,34,http://nbcnews.to/1LEsRAl
603123302220091392,NBCNews,Houston submerged by unprecedented flooding; warnings issued across eight states http://t.co/hlsbmjontx http://t.co/RRfBxWOqQt,19,51,http://nbcnews.to/1cfGo4I
603122910568521728,NBCNews,VIDEO: Dozens killed when fire sweeps through Chinese nursing home  http://t.co/7n5b8rFN94 http://t.co/I6mQvUHyKF,16,21,http://nbcnews.to/1J1MJ0E
603118067011493889,NBCNews,"Mexico border city tornado leaves 13 dead, 230 injured http://t.co/bUZUMDVkds http://t.co/eh2ujP8Eel",21,51,http://nbcnews.to/1Q7ZPtQ
603113118399635457,NBCNews,"Al Shabab gunmen, landmines kill 25 cops in Kenya http://t.co/pz2HTVyfgt",6,16,http://nbcnews.to/1FAGu1s
603111581359153152,NBCNews,"Stranded couple tried to survive on rainwater, oranges http://t.co/XFb9mYzpZC http://t.co/1QGqVvUC7Z",21,17,http://nbcnews.to/1HHx5sG
603107864803160064,NBCNews,VIDEO: Thunderstorms in Houston drop historic rainfall http://t.co/5iGynRXz4P http://t.co/9CebFgLbjF,53,123,http://nbcnews.to/1KwEADl
603104941650108416,NBCNews,#GOTscience: Reality check on gruesome twists in 'Game of Thrones' http://t.co/BeOM7TJaU1 http://t.co/Zu5bEeEuPS,25,20,http://nbcnews.to/1JSXTWc
603100855542374400,NBCNews,Man diagnosed with rare Lassa fever dies in U.S. after Liberia trip http://t.co/12aOD1oDwP http://t.co/U8gtfpCg4W,22,53,http://nbcnews.to/1FACvC1
603070998401908736,NBCNews,"At least 38 killed, 6 injured after fire decimates Chinese nursing home http://t.co/pHWWQEoid2 http://t.co/A4GGq03cbY",25,60,http://nbcnews.to/1eroSfH
603057429253922816,NBCNews,"Pope Francis: I haven't watched TV since July 15, 1990 http://t.co/Xro2cji5NB http://t.co/1QC42rjT9g",200,188,http://nbcnews.to/1Eucgcz
603025816130289664,NBCNews,Will this guy be enough to scare off the hoards of sea lions at Oregon's Port of Astoria? http://t.co/joSH8hvTZ8 http://t.co/6hSGzvOOMo,63,46,http://nbcnews.to/1KwaKyZ
603017867139936256,NBCNews,IT chief at Bangladesh Coca-Cola unit arrested as ISIS suspect http://t.co/Q69YO4hwHm http://t.co/9H7NClZNbR,52,143,http://nbcnews.to/1J15Qb3
602997589957554176,NBCNews,Cleveland reaches deal with DOJ on pattern of unjust policing: report http://t.co/YweoJ5axIS http://t.co/HdwBIE2km4,67,133,http://nbcnews.to/1BmkD9Y
602978792332754945,NBCNews,Coroner examining B.B. King's body following daughters' allegations of foul play http://t.co/xblawJs1OO http://t.co/hIDbHr1iNk,73,139,http://nbcnews.to/1eqRc1R
602968267272093696,NBCNews,Homecoming queen dies in Texas floods on way home from prom http://t.co/wO0XoxB058 http://t.co/aPMywu4L8j,123,197,http://nbcnews.to/1RiswXi
602965757819949057,NBCNews,"72,000 ladybugs released in high school senior prank http://t.co/uzDPqPxJLV http://t.co/6sg2VLzE8q",251,276,http://nbcnews.to/1Ht1plg
602957570056257537,NBCNews,Grandfather holds out hopes that family swept in Texas floods will be found http://t.co/sV0h4r7t4j http://t.co/uF5s364MFR,52,64,http://nbcnews.to/1HGuuz4
602947253523902466,NBCNews,Woman hanging on Shell ship since Friday ends drill protest http://t.co/7Ju7rPITMo http://t.co/xbiqjPDpoE,53,77,http://nbcnews.to/1FbMR99
602933777711689728,NBCNews,"Climate change means more ragweed (and allergies) for Europe, study says
http://t.co/jmsvTRl9PQ http://t.co/95byvWY6sO",37,58,http://nbcnews.to/1Auc7KX
602929364032999425,NBCNews,America's fallen honored across nation for Memorial Day http://t.co/9yimUzS4fO http://t.co/7yT3ngi1ZI,140,93,http://nbcnews.to/1JRoxyW
602920107438952449,NBCNews,Twister kills 13 in Mexico border city http://t.co/grYfM9O8WL http://t.co/m2fi5GWuVA,37,87,http://nbcnews.to/1HGXZhw
602910438360272896,NBCNews,"Dozens arraigned after protests over acquittal of Cleveland Officer Michael Brelo
http://t.co/FmZao1EmzI http://t.co/NXhiGME52x",25,54,http://nbcnews.to/1cWBR84
602895938282205185,NBCNews,Charter nears $55 billion deal for Time Warner Cable: Source http://t.co/XQXWmBVWnR http://t.co/sgGqnhM0UJ,26,47,http://nbcnews.to/1GyBdJW
602891976296538115,NBCNews,FBI looking into chemical weapons threat against planes http://t.co/opy1vs2A3N http://t.co/8Miizou0F3,73,126,http://nbcnews.to/1JR9W6o
602883049374777347,NBCNews,Obama says in Memorial Day speech that U.S. 'can never fully repay' debt to the fallen http://t.co/Xof5Xxz1R9 http://t.co/cEuGFKJ71C,160,123,http://nbcnews.to/1cWv5iG
602880138309705729,NBCNews,"Michael Ryan, convicted in 1985 torture killings in Nebraska, dies in prison
http://t.co/I9xKupc5hD http://t.co/hzsYrljcX0",38,42,http://nbcnews.to/1FbnnbS
602868031916769280,NBCNews,This anti-austerity protester is new mayor of Barcelona http://t.co/qMxXIk6dEW http://t.co/588vYtMhTZ,50,70,http://nbcnews.to/1RhtJhy
602859634492362753,NBCNews,China complains of 'provocative' U.S. spy plane http://t.co/xxO5EfcLWw http://t.co/RY9dEndRiz,30,53,http://nbcnews.to/1dt3VAR
602854718357004288,NBCNews,Holy profit: Vatican bank rebounds from past scandals http://t.co/gLWfj7L3sc,20,29,http://nbcnews.to/1HGnSOo
602852471996813314,NBCNews,"WATCH LIVE: President Obama lays wreath, delivers remarks at Arlington National Cemetery http://t.co/rXdLFVXMKJ http://t.co/aI4WkelMhP",158,99,http://nbcnews.to/1IZHX3H
602836793596256256,NBCNews,Scene of 'cruelty': 139 graves found at migrant camps http://t.co/W2lfIhUKGL http://t.co/F38KnzUl60,21,37,http://nbcnews.to/1EsZyut
602828612690149377,NBCNews,More airport security badges missing as pols demand answers http://t.co/GBB8RCrogu http://t.co/gHHtGbXkE7,22,42,http://nbcnews.to/1IVg7XP
602815533378056193,TODAYshow,Toddler throws tantrum at the White House in front of the President: http://t.co/X5Dy4l6tdc #WhatsTrendingTODAY http://t.co/5TkfQVcB4h,465,282,http://on.today.com/1Fz2Hgw
602812262332669952,NBCNews,Iraqi military vows to recapture Ramadi 'within days' after stinging U.S. criticism http://t.co/iDuoZK5mQl http://t.co/tPvugEvskA,31,36,http://nbcnews.to/1Fb08yO
602798780677750784,TODAYshow,"An awe-inspiring sight: 37,000 American flags on the Boston Common (via @GettyImages) #MemorialDay http://t.co/8thVbDN3AO",1046,735,
602793396680392704,NBCNews,They're just like us! Senators sound off on favorite TV shows http://t.co/SnX3KvYhKH http://t.co/8GhJ47uaNI,14,19,http://nbcnews.to/1Q5ZA2h
602790724602572800,NBCNews,Here's everything you didn't know about Common Core http://t.co/wyv5oWt8iT http://t.co/fJOtQPDZek,58,55,http://nbcnews.to/1cW1jdJ
602783647956082688,NBCNews,Texas and Oklahoma floods: 8 people are missing as more rain forecast http://t.co/nSegD8Wk0m http://t.co/0N5CGV804k,39,60,http://nbcnews.to/1EsHpx5
602768893942374400,NBCNews,Where you live probably says says something about how you're spending Memorial Day http://t.co/1QHMhVnC2U http://t.co/OJwrcQvie4,55,53,http://nbcnews.to/1PH7LHv
602755404490235904,NBCNews,"Hospitals slash free baby formula giveaways, new survey shows http://t.co/1Oo78FOWJF http://t.co/0WrIeArMlk",24,27,http://nbcnews.to/1EszCPJ
602747954810789889,NBCNews,Watch: Texas floods sweep away man trapped in SUV http://t.co/AcO6kaowbJ http://t.co/2U6kZYTbTO,25,49,http://nbcnews.to/1JPnPCa
602744033719496704,NBCNews,Former Israeli Prime Minister Ehud Olmert sentenced to 8 months in jail for corruption http://t.co/bb29mSDZsM  e http://t.co/2yGw6gHTDn,20,54,http://nbcnews.to/1IYVUyQ
602739430164692992,NBCNews,This 19-year-old is lead plaintiff in a class action over concussions in high school football http://t.co/U4U8JPL2GA http://t.co/B9gxKtEd0F,39,31,http://nbcnews.to/1Gy56dc
602696890002579457,NBCNewYork,Forensic scientist says Hudson River body ID'ed as missing kayaker http://t.co/BE05iJWFzD,20,26,http://4.nbcny.com/nnoN1F7
602693490645008384,NBCNews,"Three confirmed dead, eight missing after devastating floods in Oklahoma and Texas http://t.co/uw0GDzV0Wp http://t.co/Rp0deVJQYs",52,109,http://nbcnews.to/1BkWnFg
602600652813037569,NBCNews,'We will be everywhere': Hezbollah says group will step up presence in Syria as needed http://t.co/QmvfH6Y5xP http://t.co/WgLA5QxPMy,19,31,http://nbcnews.to/1KfKvtk
602590755878735874,NBCNews,"Gay marriages in Ireland by Christmas, new law to be drafted this week http://t.co/kR1zais5Ay http://t.co/bUVkja7sri",209,102,http://nbcnews.to/1Bkvi51
602574068609642496,NBCNews,"Actress and comedian Anne Meara, mom of Ben Stiller, dies at 85 http://t.co/R3tCv11Lsv http://t.co/Ytq0zGlwiG",194,260,http://nbcnews.to/1ITu6gX
602566863143440384,NBCNews,"Carrying The Load: A Veteran reminds us what not to forget on Memorial Day
http://t.co/NiEU0tHF9B http://t.co/wIZrPlLhrA",235,172,http://nbcnews.to/1HqTZyO
602561767823269891,NBCSports,MORE: Montoya comes back from 30th to win 2nd career Indianapolis 500 --&gt; http://t.co/W4fwukRtRD,90,61,http://tw.nbcsports.com/O8q
602559638140235776,NBCSports,"Juan Pablo Montoya wins the 99th running of the Indianapolis 500, making a late move to beat out Will Power. #Indy500",129,119,
602555872804495361,NBCNews,Disappointing weekend for 'Tomorrowland' at box office http://t.co/RYYPvZmRaZ http://t.co/Px6tRg7Rql,29,29,http://nbcnews.to/1AnNC2u
602541036032892930,NBCNews,New Orleans police officer shot dead in patrol car http://t.co/o7NBvRZNW9,23,112,http://nbcnews.to/1KffYMn
602523189680480257,NBCNews,Bird flu spreading as scientists look everywhere for clues http://t.co/27wbi9vjt2 http://t.co/5KnzJBen2w,42,66,http://nbcnews.to/1FIWCPY
602497336749727744,NBCNews,Territory near Ramadi seized from ISIS — as Pentagon criticizes Iraq's 'will to fight' http://t.co/KdvlECvZL2 http://t.co/gqsvtgyEG4,51,64,http://nbcnews.to/1SxcEle
602491918786887680,NBCNews,"Gloria Steinem, female activists cross DMZ between North and South Korea by bus http://t.co/uCiXMFF99S http://t.co/HXjimCDibX",74,69,http://nbcnews.to/1HDU5pn
602482808280522752,NBCNews,"John Nash, Nobel Prize winner and subject of 'A Beautiful Mind,' killed in car crash http://t.co/YCHW7B4vo0 http://t.co/xuNnzSF72h",122,335,http://nbcnews.to/1RezNat
602481980786274305,NBCNews,Turkey poised to elect 1st openly-gay lawmaker despite rising tide of conservatism http://t.co/tXfnDux8gU http://t.co/MZ3coRxfP4,73,80,http://nbcnews.to/1KegHgD
602478064342294528,NBCNews,Traveling noir: Walking in the footsteps of black Americans in Paris http://t.co/HNam7okkQ8  (via @NBCBLK) http://t.co/cQRP9FR68n,39,37,http://nbcnews.to/1KeECws
602476225945313280,NBCNews,Cleveland officials: 71 people arrested in protests over #BreloVerdict http://t.co/Fo2e1bAGwp http://t.co/bD7lw3RIZM,41,97,http://nbcnews.to/1Fx8DGB
602474769720705024,NBCNews,WATCH LIVE: Texas officials discuss response to historic flooding http://t.co/vzY5N2hu6v,10,23,http://nbcnews.to/1Fx6lYf
602467932996804608,NBCNews,A $15 minimum wage once seemed like a pipe dream — but now the movement is gaining steam http://t.co/pkIRLmgbrZ http://t.co/cCjV4h0U7E,89,84,http://nbcnews.to/1ArX04N
602464634671648768,NBCNews,WATCH LIVE: Cleveland officials hold news conference after protests over cop's acquittal http://t.co/ynKh2e4CQN http://t.co/ymHrTV0g0z,24,42,http://nbcnews.to/1Rer3kG
602464180092940290,NBCNews,The world's oldest person has celebrated the big 1-1-6 http://t.co/QFANBllCcF http://t.co/oqcqrxKZgZ,181,161,http://nbcnews.to/1enLYUo
