twid,tweep,twtext,fav,rt,url
598427119627182080,NBCNews,Almost one-in-three Russians fear U.S. invasion: poll  http://t.co/LGTLt2JMH8 http://t.co/M4JIdfalDP,43,62,http://nbcnews.to/1cvZlAB
598418611112411136,NBCNews,Search expanded for missing U.S. chopper in #Nepal http://t.co/1suxshwemo http://t.co/sSkrJOPhkO,36,53,http://nbcnews.to/1KIbY6I
598414037521670145,NBCNews,VIDEO: Prince Harry takes part in traditional Maori war dance in New Zealand http://t.co/ooofREK7PA http://t.co/bOoJdKa99S,63,42,http://nbcnews.to/1QIAjNG
598410444693450752,NBCNews,Jeb Bush says he misinterpreted question about Iraq War http://t.co/q3IXiNiSnV http://t.co/cdKxnGS7Ni,17,24,http://nbcnews.to/1zZBPY2
598409759721664512,NBCNews,Three times more Americans spending $100k-plus on drugs http://t.co/7L2soLSfld http://t.co/usOA8p1e2t,37,43,http://nbcnews.to/1cRSVwq
598409378388156416,NBCNews,Harriet Tubman wins vote to be on $20 bill http://t.co/GEfaFZJAbf http://t.co/JHNAEJ2grj,427,757,http://nbcnews.to/1K5PUq2
598407416812797954,NBCNews,"5 dead, dozens hurt in #Amtrak derailment north of Philadelphia   http://t.co/wwyOnUTZRe http://t.co/Cya9aEIA52",53,120,http://nbcnews.to/1cvOoPq
598389484158394369,NBCNews,'Terrorists' massacre 43 aboard bus in Pakistan http://t.co/UHqHaWBHuM,10,41,http://nbcnews.to/1H2JoKt
598361844412260352,NBCNews,"Five people found shot dead in Tuscon, Arizona home http://t.co/AIulrYEJlu",36,54,http://nbcnews.to/1G58pIP
598343066940936193,NBCNewsPictures,PHOTOS: See the most dramatic images of Amtrak train crash in Philly http://t.co/dPVMUOfZIg Pic @joekaczmarek http://t.co/HjeF3nPqgr,50,136,http://nbcnews.to/1cQWuDl
598333686145220608,NBCNews,"UPDATE: At least 5 people killed in #Amtrak derailment, Philadelphia Mayor Nutter confirms http://t.co/NHGDiOPY5Q http://t.co/H6ZCTKTvQ9",22,158,http://nbcnews.to/1L11ZKF
598329163133689856,NBCNews,"Several people feared dead in #Amtrak crash, senior rail official tells NBC News http://t.co/QTtuyrp9By http://t.co/6PZjOsAEfm",48,222,http://nbcnews.to/1e0rkcO
598320788610097152,NBCNews,WATCH LIVE: Coverage of #Amtrak crash in Philadelphia that injured at least 50 http://t.co/Q0Bgjlqm30 http://t.co/0L50nZ2QcV,40,104,http://nbcnews.to/1PhJFTo
598313875788984322,NBCNews,50 reported hurt as NY-bound #Amtrak passenger train w/ 240 aboard derails http://t.co/O0lDv7awMZ http://t.co/Wk6xF7Eoa2,93,295,http://nbcnews.to/1F61GMK
598304227308371968,NBCPhiladelphia,BREAKING: @PhillyFireDept says 8-10 cars derailed in Amtrak crash. Multiple injuries. MORE: http://t.co/1hyHuX5IFf http://t.co/uxMmxeIjbF,203,1050,http://on.nbc10.com/amyazlO
598281573449015296,NBCNews,"Texas executes Derrick Charles, triple killer who claimed incompetence http://t.co/KYUqN1uJCH http://t.co/yE1kmJpgce",38,48,http://nbcnews.to/1E4oVmk
598275135683076097,NBCNews,First Nebraska cases of bird flu confirmed in flock of 1.7 million chickens http://t.co/4uKpJQzj7Q http://t.co/RnfFKG2InB,38,100,http://nbcnews.to/1PFzpPM
598264021805047808,NBCNews,Sen. Marco Rubio to unveil foreign policy 'doctrine' in speech  http://t.co/TSppS4CuC7 http://t.co/uHneqth3xo,27,28,http://nbcnews.to/1RBlKgh
598251326800297984,NBCNews,Jeb Bush says he misinterpreted question about Iraq War http://t.co/o6Cnbs1d4Q http://t.co/fHOGpWAcfb,15,25,http://nbcnews.to/1e05zd2
598248397087309825,NBCNews,"Eric Harris was on meth when Tulsa deputy Robert Bates shot him, autopsy shows http://t.co/nWUeRpW0nf http://t.co/pVZWyrIcPr",38,53,http://nbcnews.to/1bNwlDG
598237555486756865,NBCNews,6 things that should go in Chicago's Obama museum http://t.co/19pmvMnG3n http://t.co/jH4ykPCfZy,54,44,http://nbcnews.to/1zYHIVo
598233822140956673,NBCNews,Arkansas couple died trying to shield daughter from tornado http://t.co/wXn27YygKC http://t.co/5y8xSCZMyW,94,98,http://nbcnews.to/1G44tI5
598231690964815872,NBCNews,Colorado man accused of killing future mother-in-law http://t.co/eOjF5G6Fx7 http://t.co/GM7ivL9o7k,13,21,http://nbcnews.to/1bNk4PF
598227566013587456,NBCNews,"Texas set to execute Derrick Charles, triple killer who claims incompetence, tonight http://t.co/NX7dmt0uOg http://t.co/1s3JplFX4r",28,25,http://nbcnews.to/1EBcO0I
598223936179085313,NBCNews,U.S. monitoring another Iranian ship headed towards Yemen http://t.co/nCX0BqB30R http://t.co/hseRkYowiR,20,26,http://nbcnews.to/1H1PP0f
598223174367629313,NBCNews,No charges for Wisconsin cop who shot and killed unarmed teenager Tony Robinson Jr. http://t.co/cL5vrEEwX2 http://t.co/9rHLY1NrpH,47,150,http://nbcnews.to/1ctTN9W
598220034348023809,NBCNews,Deflate-Gate lawyer: I wasn't out to get Brady http://t.co/Jkua6LA1bt http://t.co/GamjIOS2Mp,21,26,http://nbcnews.to/1G3QgLo
598212490036641793,NBCNews,Obama's trade agenda fails key test from Senate Democrats http://t.co/7HAb7IioXY http://t.co/NmbTR8ZKi3,46,56,http://nbcnews.to/1PgZU2Z
598208604571832321,NBCNews,Georgia man's hanging ruled a suicide http://t.co/Rn2gCyz6Yc http://t.co/rKFiWwUByf,29,51,http://nbcnews.to/1RACLHv
598202427217674240,NBCNews,25% of cars on road produce more than 90% of pollution http://t.co/YO8NzL6X2Y http://t.co/spLDTRkFAM,32,66,http://nbcnews.to/1QG72TS
598194796289732608,NBCNews,Watch: Fast food worker's kind act captured on video http://t.co/Y90ulgKT1W http://t.co/lqyB3lqCvx,180,153,http://nbcnews.to/1G3rAm8
598188707481542656,NBCNews,Tom Brady merchandise flying off the shelves since news of his suspension http://t.co/6AwJ0NaD9N http://t.co/6iQneKRGq3,92,84,http://nbcnews.to/1zWNpTh
598183524429074433,NBCNews,BREAKING: U.S. Marine helicopter missing in Nepal http://t.co/ZgK8ihb9iA,31,116,http://nbcnews.to/1FbPNGl
598182862429519873,NBCNews,UVA dean sues Rolling Stone for $7.85M over rape story http://t.co/zEiClJYvM9,25,45,http://nbcnews.to/1F58n1v
598176289099489280,NBCNews,"5 things to know about Jimmy Garoppolo,Tom Brady's substitute http://t.co/6kui3xLADN http://t.co/ILQZL8Skre",94,53,http://nbcnews.to/1L01K2u
598173470472667136,NBCNews,Why Verizon bought AOL to achieve domination http://t.co/tFlIB1KPAl http://t.co/fHeFFdOrdn,21,21,http://nbcnews.to/1bMLw00
598167178324639745,NBCNews,Listen to 911 call from George Zimmerman shooting http://t.co/oL7ZZm0k0Q http://t.co/ROl5f0vQVn,16,39,http://nbcnews.to/1zY590W
598163771115347970,NBCNews,Believe it or not: America is becoming less Christian http://t.co/BEbw3UF6Aw http://t.co/165eXkt0sO,113,139,http://nbcnews.to/1G3gaPp
598160453496365056,NBCNews,NYC's Baruch College hit with $25M suit in fraternity hazing death http://t.co/o3GISdpQJo http://t.co/OXC4z0wZmd,18,24,http://nbcnews.to/1FbEQ7I
598156510414311425,NBCNews,This European city is getting gay-themed traffic lights http://t.co/BW6liRKiZz http://t.co/MF6jxgUcRL,123,146,http://nbcnews.to/1K4oBwe
598141981165002752,NBCNews,4 tips for getting a good deal on a new car http://t.co/xNlI24tLni http://t.co/i9ooRfAMmW,50,27,http://nbcnews.to/1JEUkRo
598137521772560384,NBCNews,Should parched California ban bottled water? http://t.co/LT4NqW6RbE http://t.co/9mlGuvILYi,50,46,http://nbcnews.to/1KF8YIl
598120886521229312,NBCNews,Why China's army has banned smartwatches http://t.co/tYM3A5AcEt http://t.co/QWOa2mxrcZ,36,57,http://nbcnews.to/1HeG6cn
598117630441082880,NBCNews,Is Jeb Bush trapped on Iraq? http://t.co/5phU0I0DSr http://t.co/zkKPtDhByJ,14,17,http://nbcnews.to/1PEnnGj
598112338433146880,NBCNews,How geology gives rise repeatedly to monster #earthquakes in #Nepal http://t.co/uhKFGf0XfC http://t.co/vJU9WnfYOF,39,61,http://nbcnews.to/1E3DwOR
598108041087688704,NBCNews,Dozens killed as big #earthquake rocks devastated #Nepal http://t.co/M2pFxyB4Ly http://t.co/d8IZZnaLFv,29,69,http://nbcnews.to/1dZ46Uu
598103516872314880,NBCNews,"Liberia is Ebola-free but not out of the woods yet, writes @maggiemfox http://t.co/0fQw8wlO4k http://t.co/zOegckTzL0",29,36,http://nbcnews.to/1JEz3au
598102453201010688,NBCNews,"#Nepal quake turns ancient temple into 'clouds of dust,' reports @AlexSmithNBC http://t.co/OkUIptiMPz http://t.co/fGvjLOnyrK",22,61,http://nbcnews.to/1dZ36Qa
598096734301065216,NBCNews,Access all of @NBCNews' coverage of the #Nepal earthquakes here: http://t.co/VtJDWHgC5d http://t.co/jwe8OofiDh,42,60,http://nbcnews.to/1bMdNE1
598088672915955712,NBCNews,"#BREAKING: Dozens dead, more than 1,000 injured after big quake hits #Nepal, official says",52,147,
598084614045990913,NBCNews,#BREAKING: Verizon to buy AOL in $4.4 billion deal  http://t.co/Ye4LkjR0zp,53,125,http://nbcnews.to/1JEmxaT
598081085352861696,NBCNews,"Climbers not likely caught on Everest during #Nepal earthquake, expert says http://t.co/aBrjskfpbU http://t.co/UdObhDXNPE",45,64,http://nbcnews.to/1JEkFPe
598080594921283584,NBCNews,Second deadly tremor brings new devastation to #quake-struck #Nepal http://t.co/meFS1hZPNo http://t.co/CINldixvAi,40,109,http://nbcnews.to/1IvGZ0k
598077023609729024,NBCNews,UPDATE: At least 16 dead and hundreds injured as 7.3 magnitude #earthquake hits #Nepal http://t.co/dFNnOzlzZ2 http://t.co/wTvCLkDiU4,45,152,http://nbcnews.to/1QEYU6f
598074623184470017,NBCNews,Ex-UN ambassador injured as cement truck crushes car http://t.co/iKYXulzSF2 http://t.co/yxqJddhvkV,26,35,http://nbcnews.to/1K3Slt6
598074200671297537,NBCNews,#BREAKING: At least 16 dead after 7.3-magnitude #earthquake hits #Nepal: officials,56,207,
598067926348992512,NBCNews,Girl raped by stepdad barred from getting abortion http://t.co/6SVBjsbHu3 http://t.co/W3UGgzY48K,43,90,http://nbcnews.to/1KDWsJd
598067091619590144,NBCNews,Rise in Latino and black high school graduation rates boosts national numbers http://t.co/IUcZUjojWF http://t.co/7vVBliQ2WO,86,80,http://nbcnews.to/1PfQWDn
598058539211448321,NBCNewYork,This video shows a bolt bus from NYC to Boston explode in flames http://t.co/2ZZHd9C1rk http://t.co/SAZALB8peT,39,69,http://4.nbcny.com/CQ4KPri
598057504568942592,NBCNews,".@JohnKerry flies to Russia for talks with Putin on Iran, ISIS and Yemen http://t.co/VNSXZyatgr http://t.co/WJPkauHXd5",29,43,http://nbcnews.to/1ATxdNZ
598053036376858624,NBCNews,"Putin embarks on 'bromance' with African leader, via @GlobalPost http://t.co/sdsVaVuBby http://t.co/0n5QoZ4QLL",23,31,http://nbcnews.to/1RyyNPC
598052755752787970,NBCNews,"Change of tune: D.C. mayor saying 'Redskins' again, via @nbcwashington http://t.co/ipyAM3XzbN http://t.co/S156sKj9Ih",9,21,http://nbcnews.to/1JE9qX5
598051092853850112,NBCNews,"UPDATED: Deadly 7.3-magnitude quake hits #Nepal, @AlexSmithNBC and @BrinleyBruton report http://t.co/7Rf9o8P3h0 http://t.co/3PF4iM8NfG",86,253,http://nbcnews.to/1zX4FIt
598042830737670144,NBCNews,#BREAKING: At least two dead after 7.4-magnitude earthquake hits #Nepal: Red Cross,23,148,
598039886659231744,NBCNews,First images are emerging out of #Nepal after 7.4-magnitude #earthquake. Story here: http://t.co/USx5mMAjpZ http://t.co/x4t0yZQevu,29,114,http://nbcnews.to/1G2aTrr
598039270968918017,AlexSmithNBC,"New Nepal quake big enough to ""scare the living daylights out of everybody"" aid worker tells @NBCNews. Damage unclear http://t.co/UKr6d59z1Z",16,38,http://www.nbcnews.com/storyline/nepal-earthquake/huge-earthquake-hits-ravaged-nepal-n357481
598039204505985024,NBCNews,Nepal hit by 7.4-magnitude earthquake; panic reported in Kathmandu  http://t.co/65G1xzQkD9 http://t.co/fZIRsKKwyr,30,113,http://nbcnews.to/1ATrAiD
598035001263976448,NBCNews,This image from the @USGS shows where the latest #Nepal quake struck. Story here:  http://t.co/yPv4pmlGQ8 http://t.co/0B44PyHfG8,33,74,http://nbcnews.to/1G27nNG
598033023108567040,NBCNews,The #Nepal quake's epicenter was close to Everest Base Camp and about 51 miles east of #Kathmandu http://t.co/yjVmxrcsoV,27,71,http://nbcnews.to/1F3TegZ
598029775802912769,NBCNews,STORY: #Nepal hit by 7.4-magnitude earthquake; panic reported in #Kathmandu http://t.co/b39Puhpmqm,63,228,http://nbcnews.to/1Fhs5dw
598026745233711105,NBCNews,#BREAKING: Magnitude 7.4 earthquake hits Nepal at a depth of 18 kilometers: USGS,98,472,
598000029111099392,NBCNews,"NASA: No, we're not on the verge of developing a warp drive http://t.co/LndgPcFxAJ http://t.co/4I5z3BTiM0",63,65,http://nbcnews.to/1cLLlDG
597985465468362752,NBCNews,Five-month-old conjoined twins separated in Florida hospital http://t.co/bm322oK1wP http://t.co/Q1NusmdS0y,120,88,http://nbcnews.to/1KD3Ap7
597967386617208832,NBCNews,Tech giants unite behind limits on NSA surveillance http://t.co/bjakgvjBV2 http://t.co/wjolSMLIrj,49,50,http://nbcnews.to/1Hb6sJw
597938833011924993,NBCNews,"At least seven victims now linked to Connecticut serial killer, police say http://t.co/V6psEQ0SQK http://t.co/B7OInz1cM3",38,104,http://nbcnews.to/1EuVrPW
597915169600237568,NBCNews,$179 million Picasso sets record for art at auction http://t.co/4OqpOe9edp http://t.co/vR603xy3Fq,113,149,http://nbcnews.to/1JD5SEt
597898689114431488,NBCNews,"Ex-Bernie Madoff aide, Frank DiPascali, dies weeks before sentencing http://t.co/ixJVO8EYCz http://t.co/mdWU7oplMy",15,38,http://nbcnews.to/1K31vpI
597884621771124736,NBCInvestigates,US sources: Pakistanis knew where Bin Laden was http://t.co/eev0K9Hdlk via @matthewacole @REspositoNBC @rwindrem http://t.co/XH1KDHUdaE,81,152,http://nbcnews.to/1JCNXxI
597878462779625472,NBCNews,#BREAKING: Tom Brady suspended for four games following ‘Deflate-gate’ investigation http://t.co/r28R5w4dfB http://t.co/mHamYBWAKr,289,370,http://nbcnews.to/1F9E4Ib
597871731013988352,NBCNews,White House sees no snub in Arab leaders skipping summit http://t.co/OiLA7ePU7T http://t.co/Lm69GXlcoY,20,34,http://nbcnews.to/1E2yKkI
597868332621111296,NBCNews,"TNT Academy director who singled out black people says she's not a racist
http://t.co/PoIJc1xDOo",12,18,http://nbcnews.to/1E2xNsz
597864270509035520,NBCNews,"Black man found hanged from tree in Greensboro, Georgia http://t.co/QfxA7ObxqP",46,206,http://nbcnews.to/1zTNtTW
597863001908187137,NBCNews,"Diet that helps you live longer may keep your mind sound, too http://t.co/RwCfkwLS4w http://t.co/GR5RdPKSuP",63,44,http://nbcnews.to/1dY47rC
597860857029271554,NBCNews,"Restaurant expands 'White Appreciation' to give discount to all customers
http://t.co/v7ahoBj7OG http://t.co/rYVtHeB4dl",46,51,http://nbcnews.to/1GZpfVs
597859359801143296,NBCNews,Police dog found after going missing in mountains for a week http://t.co/JGWpMZnhj1 http://t.co/byynuudHM0,201,78,http://nbcnews.to/1QCLibq
597843305603440640,NBCNews,"Yes, you have to pay for birth control, feds tell insurers http://t.co/7EyMinZ1Xl http://t.co/WRz3SbyRLT",90,91,http://nbcnews.to/1PesGl1
597828804992757760,NBCNews,#BREAKING: George Zimmerman suffers gunshot wound in Florida: Police http://t.co/knIW50mbkq http://t.co/bYXQ9jwlgJ,132,307,http://nbcnews.to/1KXVlF1
597823022897201152,NBCNews,WATCH LIVE: Vigil for fallen Mississippi officers http://t.co/41lsnqCVrK http://t.co/hii7eFfUY6,65,66,http://nbcnews.to/1zW40ab
597821863180500992,NBCNews,Police: We had no warning of 'Draw Muhammad' attack http://t.co/TBSDkJ8YJE http://t.co/HiIzqZJRrV,23,27,http://nbcnews.to/1IxcS7d
597820674363764736,NBCNews,The $9 computer crushing Kickstarter right now http://t.co/Qwub1Cw0rI http://t.co/t10bzmyAxr,70,62,http://nbcnews.to/1QCcTJV
597814948232896512,NBCNews,Baby on board! Airline passenger gives birth over Pacific http://t.co/9StnnEYUQl,32,45,http://nbcnews.to/1F9cjQb
597808185051881472,NBCNews,Two inmates dead after Nebraska regains control of prison http://t.co/xqKuTRcqRt http://t.co/zCpk8rhfHM,26,42,http://nbcnews.to/1zVYtQO
597797777561759744,NBCNews,"At least two killed in tornado in Van, Texas, officials say http://t.co/Eq2xrhJMjG http://t.co/nA5ZcYgpHh",20,33,http://nbcnews.to/1IwV6B6
597794393031081985,NBCNews,This Facebook search feature could have Google worried http://t.co/vXaJxn7FOU http://t.co/YcKPVRrORW,30,37,http://nbcnews.to/1FZYMuS
597791432628396032,NBCNews,Nun testifies at Boston bombing trial: Tsarnaev 'genuinely sorry' http://t.co/GH3goV0TGg http://t.co/xVqM65kIXT,13,21,http://nbcnews.to/1Pe1UJq
597781522947637248,NBCNews,Tornado threat moves north: Which places are at risk http://t.co/d6VbwQCOrE http://t.co/TIs5Ei4Bvh,20,67,http://nbcnews.to/1bKkUwz
597779573019963392,NBCNews,Postal workers resort to bribery with man's best friend http://t.co/MNoWB7m4XF http://t.co/8Tgph7wgu1,79,40,http://nbcnews.to/1EwDLm6
597779187995381760,NBCNews,WATCH LIVE: Aurora movie theater shooting trial http://t.co/1vEhTv5Phv http://t.co/JAw5jSkjpR,21,32,http://nbcnews.to/1Rvmp35
597776203777466369,NBCNews,'Torn apart': Killer storms wreak havoc across heartland http://t.co/t1RKeGXJB2 http://t.co/YXg7rFVT9q,27,38,http://nbcnews.to/1dXdzLO
597774091848921088,NBCNews,'They took away my baby': Mom mourns slain cop son Liquori Tate http://t.co/DqI6PojllH http://t.co/hwVZe6hruj,57,55,http://nbcnews.to/1zSKCdH
597771763917918208,NBCNews,"New York Governor Cuomo cracks down on nail salons after abuse exposed
http://t.co/rQZ9wZLQTt http://t.co/1I3oMuAf4T",38,36,http://nbcnews.to/1F23uGu
597765750993063936,NBCNews,"'American Idol' will end its run after 15 seasons, Fox says http://t.co/4sLeyQR1Em http://t.co/Eo6tRQK1d9",114,101,http://nbcnews.to/1dX7sHB
597761871001853952,NBCNews,Self-driving cars getting dinged in California http://t.co/C1qXbas2aB http://t.co/4j0a3BDcf0,30,39,http://nbcnews.to/1QBstp8
597757620062179329,NBCNews,First Read: GOP hopefuls keep focus on foreign policy http://t.co/mYPmbj1WWW http://t.co/aAve8Qaqcv,8,11,http://nbcnews.to/1dX4mDi
597746727827931136,NBCNews,VIDEO: Wild boar tears through children's shop http://t.co/OdRCX65iGv,15,18,http://nbcnews.to/1PdEEv7
597744967784734722,NBCNews,"Veteran cop, son found shot to death in home: report http://t.co/GNwO2jcMt9 http://t.co/T8Y1QCsJ0w",17,28,http://nbcnews.to/1F8MuQa
597731464285917185,NBCNews,#BREAKING: Texas tornado leaves 10 unaccounted for as severe weather kills three http://t.co/CASilHwale http://t.co/hGP0xcCH0B,42,116,http://nbcnews.to/1dWT16e
597728936152408064,NBCNews,"Chinese billionaire gives France vacation to 6,400 workers http://t.co/ZPGl5xR4ZQ http://t.co/oqGgB9VR1j",123,150,http://nbcnews.to/1FZnVpw
597728020573585409,NBCNews,#Knowitall Monday: Today's top seven news stories http://t.co/7N4winw1pn http://t.co/2g5VkmnvGo,13,26,http://nbcnews.to/1GYHb2t
597727080231641088,NBCNews,"Severe weather, twisters destroy homes and kill three http://t.co/qDH9AWq3Yw http://t.co/lyp0Ja0oEr",21,41,http://nbcnews.to/1bJSXVL
597725728155774977,NBCNews,Two dead as typhoon lashes Philippines; Japan next in the firing line http://t.co/zdR2Db7BBT http://t.co/o5gFwXej4l,21,60,http://nbcnews.to/1cp6UJm
597719659396386817,NBCNews,"At least 26 people hospitalized after tornado rips through #Van, Texas http://t.co/YHMyMu7IgR http://t.co/wqYzQhezt1",26,72,http://nbcnews.to/1KWWn49
597708432184102912,JeffSmithNBC5,Dozens of Van homes damaged; many destroyed. The elementary school has significant damage; windows blown out @NBCDFW http://t.co/AJzUDTgSR9,13,25,
597708313267150848,JeffSmithNBC5,Stay tuned to @NBCDFW all morning long; I'll be giving live updates &amp; interviews from Van tornado http://t.co/NvNNloJ5NZ,6,10,
597708136817029120,NBCNews,Up to 50 million Americans from Texas to Michigan brace for severe weather after suspected twisters kill two http://t.co/CioykPRwnc,16,56,http://nbcnews.to/1H9l2Bj
597706036707987457,NBCNews,Suspected tornadoes kill two in Arkansas http://t.co/xENxlhOLnF http://t.co/uOTDEgyaJX,21,39,http://nbcnews.to/1QAPMj0
597696709196677120,NBCNews,Boko Haram survivors now face battle against hunger http://t.co/05AyYs5Co4 http://t.co/jAeSOG3gbB,12,43,http://nbcnews.to/1RugoU2
597691158966337537,NBCNews,"Prince Harry reveals he'd 'love to have kids right now,' @AlexSmithNBC reports http://t.co/mO8sSfSzvb http://t.co/UpwR59obdY",60,43,http://nbcnews.to/1EvzTBS
597689069175492608,NBCNews,S. Korea wary after Kim Jong Un fires missile from sub http://t.co/tRhXeIJvKq http://t.co/1Tf2FXKPsp,31,63,http://nbcnews.to/1Evyxa5
597680895567503360,NBCNewYork,"1 dead, 3 injured after shots ring out near biker event in New Jersey: police http://t.co/s02XVgGXCz http://t.co/2RbLL89bsH",16,44,http://4.nbcny.com/IhNUMJW
597680864454189056,NBCNews,"Homes 'destroyed,' dozens hospitalized as tornado hits Texas city, #Van http://t.co/ydeMTiAnZp http://t.co/JXvLjY8K9r",11,51,http://nbcnews.to/1Evt0R8
597676413249007616,NBCNews,"Tornado damage in #Van said to range from ""completely destroyed homes ... to trees and power lines down"" http://t.co/mHqlpZmkmg",8,25,http://nbcnews.to/1IvVO1C
597674481398763521,NBCNews,"#BREAKING: Homes 'destroyed,' 26 hurt as tornado hits #Van, Texas  http://t.co/YbY387rfU4",14,51,http://nbcnews.to/1Hc1tuY
597666292812906497,NBCNews,"Bad vaccines kill two babies, sicken 29 in Mexico http://t.co/2mn0NWtdbI",28,81,http://nbcnews.to/1FZ1roK
597661902383271936,NBCNews,"Asia’s skin-whitening industrial complex never stops innovating, via @GlobalPost http://t.co/342nSjhaXr",18,20,http://nbcnews.to/1GYuu7Z
597657461106024448,NBCNews,Saudi Arabia's King Salman to skip Arab leaders summit in Washington http://t.co/gMOEg317ja http://t.co/yqFV3O8sSz,30,38,http://nbcnews.to/1AQCYMa
597631317061324800,NBCSports,"All the Ducks are in a row!

@AnaheimDucks finish @NHLFlames in OT, advance to face @NHLBlackhawks in West finals! http://t.co/GpXQF25Evj",160,142,
597610265962803200,NBCNews,Sen. Feinstein wants telecom companies to store communication data instead of the NSA  http://t.co/2AUJbhlt2x http://t.co/ebhO82vxtO,31,50,http://nbcnews.to/1J49Yrc
597566053473001472,NBCNews,Enormous brawl breaks out on Massachuestts' Revere Beach http://t.co/bEK1xQZn5P http://t.co/OKcFci0EzD,43,76,http://nbcnews.to/1Iv7CRD
597564243802718210,NBCNews,"Pennsylvania man dies from injuries suffered in car accident 35 years ago, coroner says http://t.co/tiCmJEYX64",35,42,http://nbcnews.to/1Iv6T2N
597553698982727680,NBCSports,Rickie Fowler just won The Players Championship by beating Kevin Kisner in sudden death. http://t.co/65p1CMqFF8 http://t.co/JK1wUSIjBK,290,202,http://tw.nbcsports.com/a5d
597524170537345024,NBCNews,"Family kicked off flight after daughter with autism deemed 'disruptive'
http://t.co/DUXCcPqZNK http://t.co/N3GNUNu5pA",57,75,http://nbcnews.to/1Euj0ri
597519051024441345,NBCNews,Baby kangaroo stolen from mother's pouch at Wisconsin zoo http://t.co/WIVCrDw3Bn http://t.co/cYcJ5iK6X0,79,139,http://nbcnews.to/1EqK23v
597518811793862659,NBCNews,Mother-daughter photo project inspires http://t.co/Knadece2Qe http://t.co/CC61lubM6z,74,45,http://nbcnews.to/1Is3EL4
597516670492647424,NBCNews,Prosecutor will deliver decision in Tony Robinson shooting Tuesday http://t.co/bk1nDurzic http://t.co/Hb70lD4ppK,33,47,http://nbcnews.to/1FehHDj
597514461323370496,NBCNews,President Obama gives moms call for Mother's Day http://t.co/yQL6R2JSUf http://t.co/gl1k6oHb0p,145,85,http://nbcnews.to/1PbYSVZ
597505076039671808,NBCNews,"After meeting Pope, Cuban president says he may return to Catholic church http://t.co/55hORviF6u http://t.co/ZUtDnCYG0E",158,150,http://nbcnews.to/1KyCJdZ
597496235881299969,NBCNews,"At Tuskagee, Michelle Obama recalls 'name calling, doubting' http://t.co/KTjoeA1DDR http://t.co/EQQInkAhQa",101,66,http://nbcnews.to/1zUGjPu
597490768945750016,NBCNews,"Ailing Jimmy Carter leaves Guyana early, was to monitor election http://t.co/Oz2upMyKNQ http://t.co/UU0pkhIojN",37,48,http://nbcnews.to/1IuG6nk
597470375044378624,NBCNews,Lady killers: Meet the women fighting the Taliban in Pakistan http://t.co/mSOfNO3zIQ http://t.co/s2CY7B9qJP,223,196,http://nbcnews.to/1GXKk2H
597457411734171649,NBCNews,Background check: Why was Carly Fiorina fired from HP? http://t.co/BFAQn7iwn3 http://t.co/zTZEO4n53B,43,50,http://nbcnews.to/1EZVwO8
597440218795507712,NBCNews,Three suspects charged after two cops fatally shot http://t.co/hwjJe42jXC http://t.co/3qaiQKbgOM,53,98,http://nbcnews.to/1bI6wF8
597434875508084737,NBCNews,Happy Mother's Day! Read the mother of all infographics http://t.co/TK4EArB080 http://t.co/0pkedb6XHW,51,36,http://nbcnews.to/1EtAQKP
597422750760861696,NBCNews,Next stop Oz?: Watch as rainbow meets tornado in Colorado http://t.co/LDjPTeGkc9 http://t.co/S7wdGeu8L6,279,300,http://nbcnews.to/1FdPA7t
597401845510864897,NBCNews,Houthis accept Saudi offer of five-day truce in Yemen http://t.co/qTatUEpesV http://t.co/zH4S9Jczq2,28,45,http://nbcnews.to/1Ir9axD
597366610144448512,NBCNews,Home-cooked meals and Netflix on Mars? It's possible  http://t.co/fuJbkbD3b1 http://t.co/2qPpnRZf7v,56,58,http://nbcnews.to/1IqKNA5
597350429522010112,NBCNews,Suspects arrested after cops fatally shot: report http://t.co/61oszJXMmK http://t.co/kZR8sZ1h1Y,61,121,http://nbcnews.to/1zPCMSe
597340875002355713,NBCNews,Raul Castro meets Pope Francis ahead of U.S.-Cuba trip http://t.co/XmOLFBpg6h http://t.co/dPPPGfrgld,59,60,http://nbcnews.to/1cDvJCb
597311229988831232,NBCNews,Several dead in shooting in Switzerland http://t.co/HM8860SWAi http://t.co/rdFmDKmZnI,24,42,http://nbcnews.to/1cle7ds
597280508280713216,NBCNews,Manhunt underway for suspects after 2 Mississippi police officers shot and killed http://t.co/VCmwdiS74a http://t.co/xg24uHRDAm,48,118,http://nbcnews.to/1KwQrOm
597265636105068544,NBCNews,Listen to Prince's new protest song 'Baltimore' http://t.co/p3NsTRJLr5 http://t.co/YZPGVBmIOH,144,158,http://nbcnews.to/1Fd5UVY
597257873702400001,NBCNews,Two Mississippi police officers die after being shot http://t.co/tHxpiEnvCK,36,128,http://nbcnews.to/1JXTKkS
597243451567124481,NBCNews,5 police officers killed in clash with armed group in Macedonia http://t.co/smTgiTDPYw http://t.co/0osbNt7Mdq,34,73,http://nbcnews.to/1EYIEYo
597224630034763778,NBCNews,"1 dead as tornadoes, floods and hail batter the Plains http://t.co/1kNfc4HhRh http://t.co/ty3kjXCDiZ",87,155,http://nbcnews.to/1cknRVh
597215135078440961,NBCNews,Colorado restaurant gets bomb threats for planning 'White Appreciation Day' http://t.co/z6JCdZg1Zf http://t.co/UIyf2LUQzc,88,113,http://nbcnews.to/1Enej3k
