twid,tweep,twtext,fav,rt,url
591931896529068032,NBCNews,'Please pray for everyone': Nepal earthquake triggers deadly Mount Everest avalanche http://t.co/rR1AxBfH0z,203,467,http://nbcnews.to/1Dv33Bv
591925901216063488,NBCNews,California drought drives longer and 'explosive' wildfire season  http://t.co/8pHWAGYm1J http://t.co/ixXSikKpbs,32,67,http://nbcnews.to/1I84k6X
591924658741628928,NBCNews,More on Nepal earthquake: Death toll reportedly hits triple figures http://t.co/PKEXB9HpL4 http://t.co/QcYdcX8d5I,69,213,http://nbcnews.to/1IULkag
591906683212996609,NBCNews,New violence spurs fears ISIS will spread far beyond Syria and Iraq http://t.co/5F3ZGfV3Za http://t.co/V9spIs0zOE,39,74,http://nbcnews.to/1DuL3ah
591891993439109120,NBCNews,Japanese police arrest man who claims to have landed radioactive at prime minister's office http://t.co/sHIDwtvq0o http://t.co/spGW966QBW,30,47,http://nbcnews.to/1QscryW
591888638058848256,NBCNews,Nepal earthquake: Reports coming in that mountaineers on Everest hit by at least one avalanche http://t.co/K5Ehjg37wv http://t.co/8yDvboDZQL,46,158,http://nbcnews.to/1Gsilue
591865841123196928,NBCNews,"BREAKING: 7.9-magnitude quake rocks Nepal, heavy damage expected http://t.co/CvcyqhGR2D http://t.co/yyKjK2obaB",87,221,http://nbcnews.to/1Qs2H7J
591855496426070016,NBCNews,'Pressurization issue' forces Southwest flight to divert to Denver http://t.co/SpVQ7PSx9T http://t.co/OgN0gcVPc3,20,22,http://nbcnews.to/1GttFcf
591850841780420608,NBCNews,Starbucks stores give out free drinks during widespread register outage http://t.co/g8UgGXBfu4 http://t.co/31habWY0Ce,93,71,http://nbcnews.to/1E2hnnv
591839108705689600,NBCNews,DA wants investigation into Tulsa County sheriff's office after Eric Harris shooting http://t.co/b08BP8n0hg http://t.co/YbOZidw4Rt,42,71,http://nbcnews.to/1DJ7FDk
591831574288695296,NBCNews,Staffer for Senator Thad Cochran arrested on drug charges http://t.co/2s6ifhFzDJ http://t.co/gmYLAZuOCG,21,34,http://nbcnews.to/1FlaVua
591821442846699520,NBCNews,How family members and others reacted to Bruce Jenner interview http://t.co/XGFCFlfWcF http://t.co/svU8NyVtUT,72,29,http://nbcnews.to/1OmSB9w
591808931082706944,NBCNews,Hawaii poised to become 1st state to raise smoking age to 21 http://t.co/2VN0DJSKhW http://t.co/7LiPqY4yPT,412,225,http://nbcnews.to/1I6eK71
591801389300461569,NBCNews,Chileans continue to dig out of ash 2 days after volcano's dramatic eruption http://t.co/xQTCur0tQw http://t.co/HBByOp0fbb,88,165,http://nbcnews.to/1dc87ob
591793860398952449,NBCNews,How to keep up with Supreme Court same-sex marriage arguments http://t.co/o2d1N800co http://t.co/kC2RfzeWS2,28,25,http://nbcnews.to/1DtgfHa
591785967050235904,NBCNews,Bruce Jenner opens up about being a transgender woman http://t.co/DFwJUo2DTw http://t.co/PY9gbywSBg,197,115,http://nbcnews.to/1zWM1e4
591778723931803648,NBCNews,What happens when a computer takes on poker pros in Texas Hold 'Em showdown? http://t.co/nO9CVo7n4A http://t.co/Zu9KO0l3nV,18,18,http://nbcnews.to/1Qry0Q7
591771171881910272,NBCNews,"After arrest of notorious Kentucky whiskey gang, woman begs governor to pardon the bourbon http://t.co/KK9zDzvMFr http://t.co/CGqg46lSC2",43,60,http://nbcnews.to/1IRXOj3
591762388153663489,NBCNews,This mom of son with autism got to tell Congress 'what's working' http://t.co/3VGhT3FsX2 http://t.co/JDwCmPmIDl,72,52,http://nbcnews.to/1Grq77r
591754895377735680,NBCNews,How a dad inspired others with photos of 'flying' toddler http://t.co/WVJKRYjW8x http://t.co/sMvPxnGAVy,148,110,http://nbcnews.to/1OQgj9c
591742176868114432,NBCNews,Injuries in Indiana high school stage collapse less serious than initially feared http://t.co/UUQu7NXTbZ http://t.co/30VCTDhUUr,28,32,http://nbcnews.to/1JmNxP9
591722136433238016,NBCNews,GOP 2016 hopefuls return to Iowa to woo social conservatives http://t.co/FgmmWMfwUw http://t.co/ETmaOydaWv,17,23,http://nbcnews.to/1Om1j8e
591716055287988224,NBCNews,Giant Easter Island 'hats' may have been rolled into place http://t.co/gghOBRjwnT http://t.co/i2to44kgNF,59,63,http://nbcnews.to/1OlWeMZ
591710741297811456,NBCNews,"Explosion levels Kentucky bourbon distillery, injures two http://t.co/Kvc2qgg2WA http://t.co/bPRl6mMpBO",30,78,http://nbcnews.to/1db1wKC
591696467133341696,NBCNews,'I love you all madly': Holder says farewell to DOJ http://t.co/ZwGKptiMCx http://t.co/kb04abKgFu,60,65,http://nbcnews.to/1OlIIJq
591693525454061568,NBCNews,"Billions of dollars of real estate at risk to wildfire, experts say http://t.co/Y36tcvAN8O http://t.co/Lwv3taEsva",30,22,http://nbcnews.to/1aYR1br
591690331516751872,NBCNews,Baltimore mayor demands answers on Freddie Gray's death http://t.co/p8UTWsyqXY http://t.co/33qQTYXWBK,34,42,http://nbcnews.to/1OlDYn7
591669323967635456,NBCNews,Watch Live: Eric Holder's last day remarks http://t.co/zSKXNnSfhx http://t.co/MZxQvE7WwP,35,47,http://nbcnews.to/1GrBvmB
591665000017694721,NBCNews,Watch Live: Valdosta State University flag rally http://t.co/FASVOorgZp http://t.co/leB5naBRpx,31,21,http://nbcnews.to/1GpZzDK
591658957485305857,NBCNews,"Urgent action needed for Indiana HIV outbreak, CDC says http://t.co/EPgGjQTuZx http://t.co/7N8uqt21lz",18,49,http://nbcnews.to/1GfMREY
591652888927174656,NBCNewYork,UPDATE: Statue of Liberty evacuated after report of suspicious package: sources http://t.co/5WiyBUkE44 @flyingtigers http://t.co/1QMfbd1Bxm,35,150,http://4.nbcny.com/mQH9jc0
591645634601603072,NBCNews,"British boy, 14, hatched ISIS-inspired beheading plot: Cops http://t.co/Xh2nd3fbJU",23,36,http://nbcnews.to/1GfBih1
591627820792737793,NBCNews,Pepsi plans to ditch aspartame in Diet Pepsi http://t.co/SNHVlIZ5gC http://t.co/BNbJ4RwG6L,251,238,http://nbcnews.to/1DrOC13
591620269812412416,NBCNews,Fake bomb 'promposal' gets Washington state student suspended http://t.co/yx3n25A8IZ http://t.co/LMlvXXNvH8,39,60,http://nbcnews.to/1DrEPYX
591613230507753472,NBCNews,Face-transplant patient: 'Now I accept what I am' http://t.co/3ILMPAti37 http://t.co/ekCDdzpcRB,31,30,http://nbcnews.to/1EyZ2BZ
591611523849707520,NBCNews,Watch Live: Angelina Jolie addresses the U.N. Security Council http://t.co/vPmF0VME3W http://t.co/xWYHG5T69H,117,79,http://nbcnews.to/1EyWZxz
591608898014023681,NBCNews,Germany recognizes Armenian genocide on 100th anniversary http://t.co/ncsogrtIQ0 http://t.co/uLQwXh95GS,207,329,http://nbcnews.to/1HzVJt8
591605356322762752,NBCNews,Here's why your boss is pumped about the Apple Watch http://t.co/ioAxsQzo8X http://t.co/U5kv6P58bR,41,57,http://nbcnews.to/1OOrhfs
591602561565745152,NBCNews,First Read: GOP presidential hopefuls mostly silent on drone mistake http://t.co/L0oUvFz6fU http://t.co/vyJw2npGo6,18,29,http://nbcnews.to/1aY6OY8
591590334934683648,NBCNews,Comcast drops $45 billion bid for Time Warner Cable http://t.co/78gNE6Bnsf http://t.co/8tbmL0bHn3,43,64,http://nbcnews.to/1I49nFu
591588156597805057,NBCNews,Four daring Latinos ready for Red Bull Cliff Diving World Series http://t.co/dT2roETeT8 http://t.co/eIxRyE1eXA,22,32,http://nbcnews.to/1DGZx69
591586260789153792,NBCNews,"Freddie Gray, who was fatally injured in police custody, didn't have seat belt on: cops  http://t.co/YlTA5l4T6t http://t.co/yrT0WY6il9",21,58,http://nbcnews.to/1OkiuXN
591585043685965824,NBCNews,Whiskey gang arrests prompt clemency pleas — for the bourbon  http://t.co/YIpw6WOqES http://t.co/kKq8xI2CzH,22,44,http://nbcnews.to/1d8Rc5Y
591583792172834816,NBCNews,"Stage collapses during high school musical performance in Indiana, injuring more than dozen  http://t.co/QtmdvttO6x http://t.co/xlGDKbcG6Z",42,58,http://nbcnews.to/1OkhSkK
591580168306712576,NBCNews,"Native Americans quit Adam Sandler movie to protest racially charged jokes, stereotyping  http://t.co/jPVZjd3C2c http://t.co/IlaXx5aSUK",44,72,http://nbcnews.to/1EmKy67
591576410227105792,NBCNews,Eric Harris shooting: Colleagues questioned Tulsa deputy's behavior in 2008 http://t.co/M5cqbM8GSC http://t.co/oEvMdB3Fiy,15,35,http://nbcnews.to/1OO4al2
591576209861009408,NBCNews,"Sawyer Sweeten, who grew up on hit TV show 'Everybody Loves Raymond,' has committed suicide  http://t.co/eJRPOcUE6R http://t.co/LnZTk1fdsL",66,143,http://nbcnews.to/1GpVi5X
591574704353374208,NBCNews,Will the royal birth boost the U.K.'s economy? http://t.co/WMqSg3Jyu0 http://t.co/9N7stexRfy,68,34,http://nbcnews.to/1JkdYF8
591570474326478848,NBCNews,Italian police say they busted a terror network that financed operations in Pakistan  http://t.co/cQ89Hv6kU2 http://t.co/FskrHZ3FTl,44,73,http://nbcnews.to/1aXOEFO
591566953107615744,NBCNews,#Knowitall Friday: The day's top six news stories: http://t.co/DXEyQf2hKy http://t.co/3Xfvl4yKYo,22,28,http://nbcnews.to/1HvUTix
591556824018608129,NBCNews,"Sex offender in Utah stole school bus and tried to pick up child, cops say http://t.co/ta8gEisvhx http://t.co/Pvp5WplDWW",22,85,http://nbcnews.to/1GeEZnc
591547511816507392,NBCNews,Threat of tornadoes and large hail intensifies for South and Plains http://t.co/b02FhauZHN http://t.co/mhhf3JJnZL,34,50,http://nbcnews.to/1HvBqOY
591546228036521984,NBCNews,U.S. government's use of drone strikes under pressure after Warren Weinstein's death http://t.co/GoZbH9WIjn http://t.co/PYo47AIrrY,13,33,http://nbcnews.to/1Emsf0O
591529361750286336,NBCNews,Vet's wife says insurance snafu nixed critical operation  http://t.co/RJeksUd9yg http://t.co/7tfcaQ4wlo,10,13,http://nbcnews.to/1d8m9aq
591519848661970946,NBCNews,Major Indian jewelry chain pulls Aishwarya Rai Bachchan ad amid allegations of racism  http://t.co/lTc5dxdriZ http://t.co/DJqH879tcD,18,26,http://nbcnews.to/1zTA0G8
591515474288050176,NBCNews,Too little too late? Europe to triple funds for migrant rescues in Mediterranean http://t.co/ygy6LEtUMV http://t.co/GHqJVdm9MM,28,38,http://nbcnews.to/1PtgB8a
591499808969363457,NBCNews,JUST IN: Italian police say they are carrying out a 'vast anti-terrorism' operation http://t.co/wFTlLMbprL,24,69,http://nbcnews.to/1Dq4OA1
591498028797702144,NBCNews,Fossils suggest modern humans may have caused Neanderthals to go extinct  http://t.co/X7wVqZZgWt http://t.co/IV5ZMaViNG,49,58,http://nbcnews.to/1OjPhMr
591496737828704256,NBCNews,'Everybody Loves Raymond' actor Sawyer Sweeten commits suicide at 19 http://t.co/FyN5kPTcbC http://t.co/r3ehd8BJll,55,112,http://nbcnews.to/1DWQ3qE
591485581223337985,NBCNews,Invisibility cloak makes social anxiety disappear http://t.co/rcaI7u7bs7 http://t.co/iHhalilzP4,40,28,http://nbcnews.to/1yVebeo
591453117893451776,NBCNews,"WATCH: Indiana high school stage collapses, injuring a dozen are hurt, one critically http://t.co/oJ9CrXHcPc http://t.co/uvUgR70q2f",42,61,http://nbcnews.to/1El0Psb
591447670834798592,NBCNews,No Fish Tale: Specimen in lab freezer turns out to be rare pocket shark http://t.co/NIqAB6UXbB http://t.co/R2B9uS8SiA,41,34,http://nbcnews.to/1yVeyFB
591445673981169664,NBCNews,Department of Defense releases first new cyber strategy since 2011 http://t.co/Y8xH9Cnh7W,26,31,http://nbcnews.to/1aWM17a
591433024056655872,NBCInvestigates,"Drone attack that killed American hostage was ""signature strike"" based on behavior, not positive IDs of targets. http://t.co/dWAzCgFvzT",20,26,http://www.nbcnews.com/news/us-news/warren-weinstein-adam-gadahn-killed-u-s-operation-n346861
591428369830584321,NBCNews,'F--- This Court': Woman files bleep-filled tirade against judge http://t.co/WA6LqBgOyw http://t.co/UhyOjLUpq7,37,37,http://nbcnews.to/1DppkAx
591422197077512192,NBCNews,Watch what it looks like when two Nobel Peace Prize winners party http://t.co/ERSUWtkcLJ http://t.co/n8SmhBSfEs,96,62,http://nbcnews.to/1aWD8ux
591421583094374401,NBCNews,Transgender teen Chase Culpepper wins right to wear makeup in South Carolina DMV photo http://t.co/zJXr0YoWV8 http://t.co/20bMujoG0f,174,78,http://nbcnews.to/1Hu3QJo
591418751595188226,NBCNews,"Woman stole dying NYC fashion exec's identity, withdrew thousands, police say http://t.co/z5poL0CVv4  via @NBCNewYork http://t.co/nWkOrVmEIG",37,54,http://nbcnews.to/1Hu3rXb
591412571472846849,NBCNews,Chinese gene-editing experiment creeps out scientists http://t.co/2MG44C0xNr http://t.co/CrDu4UqocT,57,103,http://nbcnews.to/1JiCp5V
591403394050433024,NBCNews,ICYMI: Watch stunning timelapse of Chile's Calbuco volcano erupting for first time in 40 years http://t.co/YYSo63DrQN http://t.co/W8VPDXUsTk,106,136,http://nbcnews.to/1yYPAFC
591401619046146048,NBCNews,Crooks try bold scam impersonating U.S. consumer watchdog  http://t.co/8QZOqdAUfr http://t.co/DTUO8UXqKo,18,28,http://nbcnews.to/1GnJqib
591398398487564288,NBCNews,Model for Norman Rockwell's 'Rosie the Riveter' dies at 92 http://t.co/AlLQxrQreY http://t.co/KXjlBDhxYw,217,226,http://nbcnews.to/1I1xnt0
591390556116365312,NBCNews,Native American actors walk off set of Adam Sandler movie over racist jokes http://t.co/KOiMQ015VS http://t.co/Ggz21LFD8Z,94,169,http://nbcnews.to/1HtDyXw
591379647805415424,NBCNews,Boston Marathon bomber Dzhokhar Tsarnaev's family arrives in U.S. amid penalty phase http://t.co/hvf4lqmIn4,15,32,http://nbcnews.to/1GnxBbP
591370913528082432,NBCNews,"Minnesota declares bird flu emergency, offers Tamiflu to workers handling dead birds http://t.co/uDQ3JbY51F http://t.co/HNqOjV0ETJ",30,77,http://nbcnews.to/1yYu9EW
591368062449901569,NBCNews,Americans are drinking more than they were 10 years ago — a lot more http://t.co/MUDYxN0XbT http://t.co/GhZjRYcEju,136,178,http://nbcnews.to/1DoPnYL
591358723207102464,NBCNews,Crooks try bold scam impersonating the FTC http://t.co/hDAvq3loZX http://t.co/QXkaHpqu6N,22,27,http://nbcnews.to/1byZUd7
591353577110667265,NBCNews,"Severe thunderstorms, tornadoes and large hail threaten Plains and South http://t.co/9IMjjRfVWq http://t.co/BqQegbPPu5",51,58,http://nbcnews.to/1Gnhivs
591349584913399808,NBCNews,Dr. Oz responds to critics: 'It's not a medical show' http://t.co/Dz8LoAJod3 http://t.co/g2zDobMVuL,38,37,http://nbcnews.to/1zRH1ay
591344196713377792,NBCNews,Only 1 of 6 al Qaeda-linked Americans killed by drone on purpose http://t.co/IHJOFUkfvy http://t.co/YGKcJ1bDw9,26,37,http://nbcnews.to/1Dhk80s
591329771402895360,NBCNews,Comcast may drop Time Warner deal on Friday http://t.co/i702wTmwLx,25,46,http://nbcnews.to/1byOBSe
591329550702784513,NBCNews,Watch stunning time-lapse video of volcano erupting in Chile http://t.co/A7DrRqHDsO http://t.co/43uxVnsxQO,156,170,http://nbcnews.to/1HwZDmK
591326175626047489,NBCNews,Watch Patriots react to Obama's 'Deflategate' joke during White House visit http://t.co/gGapJDFOpj http://t.co/HMsoyRafd3,50,52,http://nbcnews.to/1OLsQuD
591322451285520385,NBCNews,"Ex-CIA Director David Petraeus gets probation and $100,000 fine for leaking military secrets http://t.co/fRZgpuVvTg http://t.co/XaRNd88wK6",44,110,http://nbcnews.to/1GmPGGN
591316036324106241,NBCNews,Sidewalk 'opened up like a trapdoor' to swallow London woman http://t.co/9DgIRm1lzV,13,24,http://nbcnews.to/1QoSlWi
591310749450035201,NBCNews,Where should you stash your retirement savings? 3 ideas: http://t.co/hUeVdhVPiD http://t.co/Tg0lWBa6LS,31,35,http://nbcnews.to/1JyvEtb
591308129473847296,NBCNews,Watch as applause breaks out in Senate after Loretta Lynch confirmed as attorney general http://t.co/3QCMU8QeG2 http://t.co/OZJrjPRwyW,88,96,http://nbcnews.to/1HsdSdS
591304587115638784,NBCNews,WATCH LIVE: Obama welcomes Super Bowl champs New England Patriots to White House http://t.co/uQd7ZVr4kz http://t.co/wmw8HlzXYo,31,36,http://nbcnews.to/1Jhj9pc
591304410690650112,NBCNews,Cesar Chavez to get military honors funeral on 22nd anniversary of his death http://t.co/wiUHytalrh http://t.co/cNEFXDMa9X,92,105,http://nbcnews.to/1EiAL0Q
591301883458953218,NBCNews,Boston bombing trial jurors hear graphic testimony about human toll http://t.co/tFS99u7zE8 http://t.co/R33dIjWHg7,15,25,http://nbcnews.to/1yTAAJ4
591301796708151296,NBCNews,JUST IN: Senate confirms Loretta Lynch as U.S. attorney general http://t.co/QJbk7kr1YB http://t.co/47iCPq4EHB,563,973,http://nbcnews.to/1GmSEhs
591298125077307392,NBCNews,"11 striking images of Alaska's Dalton Highway, one of the most isolated roads in the U.S. http://t.co/FIlRka7KHC http://t.co/4WqF5zQJRg",45,42,http://nbcnews.to/1OhYiFQ
591291407702327297,NBCNews,These cybercrooks are available for hire by the hour http://t.co/DZCXQUbjER http://t.co/4P7EeqL5Vn,17,22,http://nbcnews.to/1yXsUWr
591286785067655168,NBCNews,Latest details on U.S. drone strikes that inadvertently killed American and Italian hostages: http://t.co/tMSAhDyoxc http://t.co/KBAso854vO,17,43,http://nbcnews.to/1DnoZym
591284260864204802,NBCNews,Nearly 1 million bicycles recalled after riders injured http://t.co/Ql3KfI0jmP http://t.co/MTWSkdbwuE,33,82,http://nbcnews.to/1QoxT7H
591280521470160896,NBCNews,Michael Brown's family files wrongful-death suit against city of Ferguson and Darren Wilson http://t.co/lQYRA2Auez http://t.co/9h2q7qkSk5,43,51,http://nbcnews.to/1OhMfIx
591276743065018368,NBCNews,Ex-CIA Director David Petraeus to be sentenced for leaking classified material http://t.co/oKIfqReAVI http://t.co/0QelaiXQVr,55,69,http://nbcnews.to/1Ei62kD
591272971643265026,NBCNews,Notorious American al Qaeda leader Adam Gadahn killed in U.S. drone strike http://t.co/ozukCLZ8cf http://t.co/3k0Wsgom7T,129,133,http://nbcnews.to/1PoZBjk
591270081843372032,NBCNews,Watch Robert Downey Jr. abruptly walk out of TV interview http://t.co/BnQfXvze1q http://t.co/F7DsiYN78e,64,51,http://nbcnews.to/1zQxoce
591268424602492928,NBCNews,Inkster police chief resigns following video of cop beating man during traffic stop http://t.co/cKiJkxOhz6 http://t.co/iKJQZDNIzb,32,119,http://nbcnews.to/1HrufY5
591263340938326016,NBCNews,WATCH LIVE: Family of Michael Brown announces wrongful death suit against City of Ferguson http://t.co/nvl6kWHghL http://t.co/HGk89pyD3m,38,48,http://nbcnews.to/1HwnWkJ
591261603514949632,NBCNews,"Who was Warren Weinstein, the American al Qaeda hostage killed in U.S. drone strike? http://t.co/0DIMHfmL1q http://t.co/pPByjxOdIM",17,36,http://nbcnews.to/1aVbAWg
591257563037097985,NBCNews,Iranian convoy headed toward Yemen turns back after standoff with U.S. ships http://t.co/NVZ5xvi8qg http://t.co/cq0LDLaq3d,141,256,http://nbcnews.to/1EhyyCT
591254262484709376,NBCNews,Why today isn't a good day for the Clinton campaign http://t.co/beOlHPwf2l http://t.co/adnEc8Issn,33,46,http://nbcnews.to/1yT2y7y
591245780876447744,NBCNews,MORE: American aid worker Warren Weinstein was 1 of 2 al Qaeda hostages killed in U.S. strike http://t.co/zjJQ37s1k5 http://t.co/OBNalH9tD8,22,67,http://nbcnews.to/1FgHJV3
591244831671906304,NBCNightlyNews,Pres. Obama: 'We will identify the lessons that can be learned from this tragedy and any changes that should be made' http://t.co/LzdJcEtBFq,34,43,
591244724876509184,NBCNews,"Obama: ""I profoundly regret what happened"" http://t.co/tjFna1KEmd",45,63,
591239107155730433,NBCNews,COMING UP: Obama to deliver statement. Watch live here: http://t.co/TjSorKyR3o,9,38,http://nbcnews.to/1GlHRBl
591238580909056000,NBCNews,BREAKING: American and Italian hostages held by al Qaeda accidentally killed in U.S. counter-terrorism operation http://t.co/H33lM1K8Et,33,176,http://nbcnews.to/1IMjm0d
591223876539015168,NBCNews,.@RobertDowneyJr walks out of awkward TV interview http://t.co/IhrkmA5FtJ http://t.co/7CqRT2Qen5,89,57,http://nbcnews.to/1DDVkA5
591222047046508545,NBCNews,Secret Service took over a year to replace broken alarm system at George H.W. Bush's home http://t.co/4lHznq7Mrh http://t.co/bSCUDhSwLD,30,33,http://nbcnews.to/1Ev28XG
591212531089330176,NBCNews,California bill may reshape vaccination laws across nation http://t.co/gkw9BCCjxP http://t.co/d5askO1KhC,22,44,http://nbcnews.to/1Euvlll
591211272840019968,NBCNews,Five things to know about AG nominee Loretta Lynch http://t.co/q0smAVxmsf http://t.co/McOJVNfCzC,23,46,http://nbcnews.to/1DDRUNM
591206253201850368,NBCNews,Embryonic twin discovered in woman's brain during surgery http://t.co/PPv53cMBwK http://t.co/Zxvb0nCtiQ,74,113,http://nbcnews.to/1GlfYvV
591203876742766592,NBCNews,China warns U.S. of rising N. Korea nuke threat: report http://t.co/aPhrl8Mg15 http://t.co/LiZQLDm5rO,42,81,http://nbcnews.to/1HqaOPA
591202593872945153,NBCNews,Twister threat ahead as storms send hail down on Texas http://t.co/7iYBHsFA7o http://t.co/uYsshYIkCv,41,58,http://nbcnews.to/1FgcKbM
591196164793487360,NBCNews,Rand Paul's son cited for DUI in Kentucky http://t.co/jBd3YuxAey http://t.co/KLmTMVwYrG,44,48,http://nbcnews.to/1Hv3C30
591192595071705088,NBCNews,Absolutely stunning! More pics from the #Calbuco eruption here: http://t.co/Bnxs8oSf6Q http://t.co/Au3fYdI2Gr,225,292,http://nbcnews.to/1Dg8tip
591183460716404736,NBCNews,.@RobertDowneyJr walks out of awkward TV interview http://t.co/YHhRj30VfO http://t.co/bhlHMCovkn,76,40,http://nbcnews.to/1aUjijx
591175513206607873,NBCNews,"Two injured as extreme turbulence forces flight to divert, via @NBCNewYork http://t.co/jGBvPu2HDs http://t.co/KPDzESm4NQ",21,40,http://nbcnews.to/1Pn7ENM
591174577113452544,NBCNews,California bill may reshape vaccination laws across nation http://t.co/qEg0uPrn1e http://t.co/6LAaAi81UT,30,46,http://nbcnews.to/1G9Y0Hn
591174227375616001,NBCNews,Five things to know about AG nominee Loretta Lynch http://t.co/6dpvhjlZJ5 http://t.co/ZvyPoB7JmW,21,25,http://nbcnews.to/1aUcvGH
591172096711122944,NBCNews,Five terror attacks foiled since Charlie Hebdo massacre: French PM http://t.co/eneOfdvPxm http://t.co/WLbpowp08C,19,31,http://nbcnews.to/1JfRMMe
591171271540506624,NBCNews,Twister threat ahead as storms send hail down on Texas http://t.co/3WSpbTHMsD http://t.co/EFw3TXpy9w,36,45,http://nbcnews.to/1K7HxY7
591169670465658880,NBCNews,"Russia is boosting air defenses inside Ukraine, U.S. says http://t.co/RBztJkEJCz http://t.co/o5OLLNsMy7",25,59,http://nbcnews.to/1JwNEUR
591156231168991232,NBCNews,Five nursing students killed in Georgia crash http://t.co/y9MD9BgwD4 http://t.co/XH31qpApbk,21,81,http://nbcnews.to/1Fg4AQu
591155252264599552,NBCNews,Rand Paul's son cited for DUI in Kentucky http://t.co/iyuCi3hbB6 http://t.co/3UEyB8ijSL,28,42,http://nbcnews.to/1JwHgwU
591154758611771392,NBCNews,"Five coaches who may replace Thunder's Brooks, via @NBCSports http://t.co/p9buoWA4Lw http://t.co/lDgXO6NJDU",14,15,http://nbcnews.to/1d35Njc
591149509729775616,NBCDFW,ICYMI: A Shetland pony was seen racing down I-35W in Fort Worth: http://t.co/p8nhNbmuU6 http://t.co/SmLJbhwmas,60,56,http://on.nbcdfw.com/AbVCCU6
591149465710518273,NBCNews,VIDEO: Tears of joy as Mexican teen forced to the U.S. is reunited with family http://t.co/oC47HzyYjw http://t.co/KPoitmxu66,30,25,http://nbcnews.to/1DlfQ9z
591149115305811968,NBCNews,Civil rights icon Cesar Chavez to get military honors funeral http://t.co/8V7sKnPDd0,19,21,http://nbcnews.to/1GljWVg
591143448956252160,NBCNews,Embryonic twin discovered in woman's brain during surgery http://t.co/oOE6OslGqV http://t.co/MjeWuspGNs,69,102,http://nbcnews.to/1JwBP14
591140135493836800,NBCNews,Mexican teen forcibly sent to U.S. is allowed home http://t.co/fHLiOfetgA http://t.co/2UZmHFZNqw,29,22,http://nbcnews.to/1d2WLmk
591111987888840704,NBCNews,"Michael Brown's family to file wrongful death lawsuit against Ferguson, lawyers say http://t.co/yfVQrSkJWa http://t.co/tDfm2SY0Ti",75,85,http://nbcnews.to/1Jf5ejy
591096790126092288,NBCNews,Goodbye Dials: These Zeiss DLSR camera lenses Have Displays Built In http://t.co/UiTYNf74Ip http://t.co/FwJ0PXSGn6,57,47,http://nbcnews.to/1HuwXL1
591094724053880832,NBCNews,"Your DNA may help decide whether you smell tasty to a mosquito, new study finds http://t.co/1SmT3J15an http://t.co/n54waV8GtB",86,100,http://nbcnews.to/1GkmRe8
591048069896138755,NBCNews,Five of six officers present just before Freddie Gray's death give statements to investigators http://t.co/JjcKNRbTNz http://t.co/5asRns0EdU,30,52,http://nbcnews.to/1JvYPgB
591038615133806592,NBCNews,PHOTOS: Calbuco volcano spews giant tower of ash in Chile http://t.co/tXTeYMkm9o http://t.co/eX6FXXarGH,237,343,http://nbcnews.to/1DjOqRk
591034015429328896,NBCNews,Russia cuts back on space spending amid economic woes http://t.co/B8PreDgM1u http://t.co/J3n36TLYV2,35,36,http://nbcnews.to/1Je0SJy
591031831593619456,NBCNews,Google launches wireless service that lets customers pay only for data they use http://t.co/8JMFZOBQQR http://t.co/9Bpszdq4xn,109,109,http://nbcnews.to/1HuslV5
591026520132550656,NBCNews,"Beekeepers remove massive 90-pound hive with some 80,000 bees from tree near Florida home http://t.co/gL5bi9XrUQ http://t.co/vIWVGgkYJp",125,174,http://nbcnews.to/1PkIkrF
591017585099071490,NBCNews,U.S. motorists aren't charged up about battery cars http://t.co/CIEuxXrTMM http://t.co/UeYd4UEz8N,21,29,http://nbcnews.to/1Ql60O1
591014234684792833,NBCNews,2016 presidential candidate Sen. Rand Paul's son cited for DUI after hitting parked car  http://t.co/K87gpz8BkY http://t.co/NqyubZrTWj,100,125,http://nbcnews.to/1yU4nBq
591014097786957825,NBCNews,New drug that matches Ebola strain that ravaged West Africa even cures monkeys http://t.co/NGHX01DKio,51,58,http://nbcnews.to/1Ff92PA
591007054095056896,NBCNews,"Kim Kardashian and Kanye West's proposal video leak lawsuit can proceed, court rules http://t.co/K2AyAZ26dk http://t.co/bJLKnwvDAi",25,16,http://nbcnews.to/1OfyrhS
590993616291631107,NBCNews,Ex-police chief says race wasn't reason for mass resignations after black mayor elected http://t.co/dFZ1kmkuru http://t.co/M8lD2KteJp,30,53,http://nbcnews.to/1zNuh4F
590987550816399360,NBCNews,Boston bombing trial jurors shown video of Dzhokhar Tsarnaev flipping off camera in cell http://t.co/qDXa8BZ0zS http://t.co/B0DRAjoT0u,37,41,http://nbcnews.to/1zNr70W
590980613827649536,LACaldwellDC,"Have you signed up for The Lid yet? @NBCPolitics end of day wrap on all things 2016. If not, you should: http://t.co/Iua3IdBBGq",7,6,http://nbcnews.to/1yR6Koj
590979223382294528,NBCNews,President Reagan shooter John Hinckley Jr. found love and now he wants to go live with his mom http://t.co/o3sQLiOGLZ http://t.co/nRbRmdf8of,32,31,http://nbcnews.to/1JvlGJf
