dt,title,href,newstxt
2015-02-16 05:20:10,"What we know about the bank hacking ring - and who's behind it - Feb. 16, 2015 ",http://money.cnn.com/2015/02/16/technology/bank-hack-kaspersky/index.html,"It looks like a few Russian hackers have just pulled off the biggest bank heist ever.
The numbers are shocking: hundreds of millions of dollars were stolen from 100 banks in 30 countries. The exact amount is unknown at this point. On top of that, the banks could lose possibly hundreds of millions more in related costs. And it all went mostly unnoticed until sometime last year.
On Monday, Russian cybersecurity firm Kaspersky released its report painting a startling picture of a worldwide operation that infiltrated major banks and turned ATMs into cash-spewing zombies.
What did they hit?
These hackers mostly attacked banks in Russia, but they also went after financial institutions in the United States, Germany, China and Ukraine, according to Kaspersky. The company declined to name specific banks, citing ongoing client relationships.
Kaspersky managing director Christopher Doggett said researchers managed to discover as much as they did by hacking into the hackers' computer servers.
""All of the cybercrime we've seen up until this point has been to a different level,"" he said.
What did they get?
Hackers managed to steal the money in all sorts of creative ways, Doggett said. They managed to take $7.3 million by reprogramming a single bank's ATMs. Another bank lost $10 million from its hacked online platform alone.
Then there's sensitive consumer data. The hackers were also deep enough in the computer systems at banks to gain information about their customers. For instance, hackers had full access to all email accounts at several Russian banks, according to Kaspersky.
Hackers also managed to obtain the secret keys that ATMs use to make sure your PIN is valid, Kaspersky said. It's unclear what they could do with such information.
How did they do it?
Hackers used botnets -- fleets of spam-spewing slave computers -- to send out wave after wave of malware-laced emails.
Bank employees who opened them inadvertently let hackers sneak into computers. The criminals eventually gained complete control of the systems using employee credentials.
With that authority, hackers opened accounts in different places and moved money around at will. Kaspersky notes that, in some cases, they used the interbank network SWIFT (Society for Worldwide Interbank Financial Telecommunication) to quickly shift funds from one place to another.
By having full access to email exchanges, hackers also became intimately familiar with banks' anti-fraud measures. They also learned how to avoid setting off alarms.
For example, they limited theft at any single bank to $10 million to avoid triggering a full-blown analysis, Kaspersky's report said.
Then there's this painful realization: One bank could have avoided getting hacked in a particular way if its employees had just applied the usual Microsoft update, Doggett said.
Who is behind this
Kaspersky researchers traced this attack back to hackers in Russia, China and several spots in Eastern Europe, Doggett said. The report described them as criminals -- not a nation state -- and noted that they mainly targeted Russian-speaking banks with malware-laced emails in Russian.
But one Dutch Internet security firm, Fox IT, claims this attack bears all the hallmarks of a small group of Russian hackers that attacked Russian banks in a similar fashion last year. They used the same malware to break into bank computers, reprogram ATMs and hack into the payment systems at a dozen American retailers.
But Kaspersky said it's too early to tell if both hacking groups are the same.
CNN's Laurie Segall contributed to this report.

Related: Hackers stole from 100 banks and rigged ATMs to spew cash
Related: Twitter CEO injured while skiing
Related: Confessions of dating app war stories"
2015-02-15 04:51:02,"Michele Ferrero: Billionaire Nutella founder dies at 89 - Feb. 15, 2015 ",http://money.cnn.com/2015/02/15/news/nutella-ferrero/index.html,"Michele Ferrero, the founder and patriarch of the Italian Nutella and Ferrero Rocher empire, died on Saturday, Valentine's Day.
He was 89, the company said in a statement. Multiple European news outlets said that for months he had been battling illness.
Italian President Sergio Mattarella called Ferrero ""entrepreneur bred"" and praised his ""innovative products"" and ""hard work.""
""We are proud of you. Thank you Michele,"" the company, Ferrero, posted to its website.
He was ""the richest candyman on the planet,"" according to Forbes, which put his wealth at $23.4 billion.
Ferrero's father, Pietro, turned the family pastry shop into a production facility back in the 1940s. Because of World War II, chocolate was rationed, so he mixed in hazelnuts to produce more product. The spread now known as Nutella was once six times less expensive than chocolate, according to the company.
The company soon became known for its distinctive products, like the namesake confections wrapped in gold foil.
It now produces tons upon tons of Nutella -- every year, an amount that weighs as much as the Empire State Building.
Ferrero products came to the United States in 1969. The first arrival was the Tic Tac mint. The company also produces Kinder chocolates.
The company is family-owned and run by Ferrero's son Giovanni.
Related: Is this the world's most expensive chocolate
Related: Hershey buys a beef jerky company"
2015-01-21 11:42:06,"Windows 10: Microsoft unveils new operating system - Jan. 21, 2015 ",http://money.cnn.com/2015/01/21/technology/windows-10/index.html,"Microsoft has lifted the curtain much higher on Windows 10, showing off a whole slew of new features that will be coming to PCs and phones later this year.
At its Redmond, Washington, headquarters on Wednesday, Microsoft (MSFT, Tech30) detailed how its new operating system will work across desktops, laptops, tablets, smartphones -- oh, and it's going to use holograms.
Microsoft understands that Windows 8 wasn't well-received by customers, and most of its updates to Windows 10 reflect that. It offers a much more familiar experience to Windows 7 users who never made the jump to Windows 8. But it also brings some innovations to the PC that tablet and smartphone users have become accustomed to. And by adding holographic representations to Windows 10, Microsoft is hoping to take Windows to a world beyond screens.
""Today really is a monumental day for Windows,"" said Terry Myerson, head of Microsoft's operating systems unit. ""Windows 10 is so much more than the latest version of Windows. Windows 10 changes the rules of the game.""
Like a smartphone or tablet upgrade, Microsoft's new operating system will be available as a free update for anyone using Windows 8.1. That's a big deal for Microsoft, which makes a tremendous amount of money on Windows sales.
Windows 10 is Microsoft's first major operating system upgrade since Windows 8 was introduced in 2012. Windows runs on more than 91% of the world's computers, according to NetMarketShare.
Live blog: Get up-to-the-minute details about Windows 10
Holograms. By far the coolest part of Microsoft's presentation was ""Windows Holographic,"" Microsoft's attempt to immerse its customers into a computerized world. Windows 10 has been built to integrate holographic representations of its software. With the companion HoloLens glasses, Windows 10 users can interact with holograms all around them.
HoloLens comes with a holographic processing chip that understands your gestures, voice and where you're looking. It can map the world around you and display holograms that appear to be in thin air or on objects that surround you.
With Windows 10's HoloStudio app, Microsoft lets users create 3-D objects with their voices and gestures (like pinches and flicks) and then print them on a 3-D printer.
Cortana. Microsoft's version of Siri will be part of Windows 10. By using voice commands, Cortana can show your notifications, stock information, sports news, and other functions typical of smartphone voice assistants.
But you can also say ""Hey, Cortana, show me PowerPoint slides about the charity auction"" or ""show me photos from December,"" and it will quickly run the search query.
No more Internet Explorer. Microsoft introduced a new, stripped-down browser that has been codenamed ""Project Spartan."" The new browser will ship with Windows 10, and it will function similarly to Chrome and Firefox.
The Spartan browser supports pen interactions, so people can mark up websites with their fingers or styluses and share them. Wit also features a reading mode and Cortana integration.
Spartan will be built on a different software platform from IE and the two are not compatible. That means Microsoft will continue to also ship IE with Windows to ensure that corporate apps continue to function properly.
Related: Internet Explorer must die
Return of the Start menu. After being removed from Windows 8, Microsoft announced that the Start Menu will make a full comeback in Windows 10.
The new Windows 10 Start menu includes a new personalizable space for favorite apps, programs and websites. It can be viewed as a full-screen Windows 8-like display of tiles or a more familiar Windows 7-like drawer of apps.
Continuum. The biggest Windows 8 headache that Windows 10 is expected to cure is the way the operating system manages its separate ""desktop"" and ""tablet"" modes. At its event, Microsoft introduced a new Windows 10 design interface called ""Continuum.""
Windows 10 sticks to desktop mode when it recognizes a mouse and keyboard and tablet mode when there is no keyboard and mouse. But hybrid devices, such as the Microsoft Surface, will be able to transition seamlessly between the two modes. Pull off the keyboard, and you'll enter tablet mode. Snap the keyboard back on, and you're back in desktop mode.
One Windows for all your devices. There are currently three different versions of Windows: Windows 8.1, Windows RT for tablets and Windows Phone. Last year, CEO Satya Nadella said Microsoft planned to scaling back.
Windows RT and Windows Phone are just becoming Windows 10. Windows 10 phones will be able to live-sync with Windows 10 PCs, and the apps will function similarly across different devices. They'll still be incompatible with most traditional Windows software, but they'll be able to run all of the apps from the Microsoft store.
Xbox. Microsoft said the new Xbox app for Windows 10 will let gamers stream and play Xbox games on their PCs. They can also play games from the Steam video game network and save and share game-play clips.
A new look for Windows. Microsoft said that Windows Store apps and regular desktop programs will both run in traditional windows in Windows 10. The programs can be resized and minimized from the bar at the top.
Windows 10 will feature something Mac users have enjoyed for years: the ability to create new desktops and quickly switch between them.
The new ""Snap"" feature will allow Windows 10 users to work on up to four apps at once on the same screen. Snap has been around since Windows Vista, but Microsoft redesigned it for Windows 10 to include a new quadrant layout.
And a new button on the task bar will take you straight to a single screen that displays all your open apps and files."
2015-01-27 10:38:48,"CNN and other media brands come to Snapchat - Jan. 27, 2015 ",http://money.cnn.com/2015/01/27/media/snapchat-discover-media-deals/index.html,"CNN and other major media companies are setting up shop inside Snapchat, the fast-growing messaging app that has big aspirations to showcase news stories and entertainment.
On Tuesday, Snapchat announced a new ""Discover"" section of its app and deals with almost a dozen different publishers that will program channels within it.
Stories within the Discover section will be viewable for 24 hours -- a whole lot longer than the usual blink-and-you-miss it Snapchat message.
CNN's channel will include five news stories a day, selected by CNN editors and producers.
""You'll be surprised by the amount of context we can include in the snaps,"" said Samantha Barry, head of social news for CNN. ""They are visually-led with great images and videos, but when you swipe up, you will get great CNN context with more images, text and background.""
The other publishers working with Snapchat include ESPN, National Geographic, Vice, Cosmo, Comedy Central, the Food Network, MTV, People, Yahoo News, and the Daily Mail. Some will promote news stories while others will publicize TV shows and entertainment content.
They all want more or less the same thing: to establish themselves on a new social network and experiment with something that is said to have more than 100 million monthly users.
""We're always seeking out new audiences and advertisers, and it's more important than ever to tailor content to suit the platform,"" Andrew Morse, senior vice president and general manager of CNN Digital, said in a statement.
The publishers also want to explore a new form of advertising. CNN, for instance, has sold an exclusive sponsorship for its Snapchat channel to BMW North America, according to a spokeswoman for CNN's parent company Turner Broadcasting.
Snapchat shares in the ad revenue that publishers earn from the snaps.
Snapchat has been working on the Discover feature for many months, and it's been something of an open secret in the industry. It's a crucial launch for the company as it strives to prove, like Facebook and Twitter before it, that it can make money through its communications platform.
Now the startup will have to persuade its users to try out its media partner's channels.
In an introductory blog post, Snapchat differentiated itself from competitors by saying ""this is not social media.""
""Social media companies tell us what to read based on what's most recent or most popular. We see it differently. We count on editors and artists, not clicks and shares, to determine what's important,"" it said.
The media partners were quick to praise the idea: Daily Mail North America CEO Jon Steinberg said ""I think the notion of channels and 'snaps' as news makes Discover something truly different than what anyone's seen on a social platform to date.""
Barry said that for CNN, ""there's a huge opportunity for us to reach new, younger audiences on Snapchat.""
""Let's assume that TV audiences are in their 50s, desktop audience are in the 40s, and mobile is maybe 10 years younger than that,"" she said. ""Being on Snapchat helps us reach every decade -- we are going to reach those people in their 20s andÂ younger on this platform.""
Barry dismissed the notion that young people are uninterested in hard news, calling it ""a myth that has been recycled every generation.""
""We just need to understand how different generations and demographics find, engage and share news,"" she said.
She said the expectation is that some consumers will discover what CNN is covering through Snapchat, then seek more information through CNN's television channels and web sites."
2015-02-06 11:13:43,"Comcast calls customer 'Super B----' on bill - Feb. 6, 2015 ",http://money.cnn.com/2015/02/06/news/companies/comcast-customer-super-bitch/index.html,"Mary Bauer just wanted to watch the Hallmark channel.
Instead the 63 year-old from Illinois got a bill in the mail addressed to Super B---- Bauer.
That's after months of battling with Comcast (CCV) to get her cable service fixed so she could watch her favorite channel.
""I said, wait, I need to get my glasses on because I don't believe what I'm seeing,"" Bauer told CNNMoney. ""And there it was: Super B---- Bauer. So I've had it with Comcast.""
Bauer had been having trouble with her cable service since last April and she had called Comcast customer service ""hundreds of times."" In fact, technicians came to her home on about 39 occasions and it was eventually fixed.
On top of this, Bauer said she didn't receive her bill in November. When it arrived, she found that her rate had jumped by $50. She called to complain and was told that her two-year contract (which included the Hallmark channel) had expired and the channel was now part of a more expensive package.
So, she agreed to pay the higher rate. When Bauer finally got the bill Wednesday, it was addressed to Super B---- Bauer.
Related: Comcast vows to fix customer service
This is not a first for Comcast. Last month, the company sent a bill to Ricardo Brown addressed to A--hole Brown after he canceled his cable service.
Bauer said she told a friend who works for a local television station about the offensive name on her bill. The friend passed the tip on and the station immediately contacted Bauer about the story.
However, it turns out that that station is owned by Comcast and the story was killed.

Bauer (pictured above) got in touch with another local station. The story was set to air at 9 pm, she said. Just a minute or so before the broadcast, Bauer said she got a call from an apologetic Comcast manager.
The company also sent a statement to CNNMoney: ""We are continuing to investigate this thoroughly, and have reached out to our customer to apologize and try to make it right.""
But that hasn't changed Bauer's views on the company.
""Comcast is just the most disingenuous company on the entire planet,"" she said. ""I've been totally frustrated with them for a very long time.""
Related: Comcast vows to fix our customer service
Comcast has among the worst customer service rankings in the nation, according to the American Customer Satisfaction Index, topping only Time Warner Cable (TWC), a rival it is in the process of purchasing.
In September, a Comcast executive wrote on a company blog that it will take years before it can ""honestly say that a great customer experience is something we're known for."""
2015-01-20 06:18:28,"How you can already get money for community college - Jan. 20, 2015 ",http://money.cnn.com/2015/01/20/pf/college/free-college-tuition/index.html,"President Obama wants to make community college free -- but don't hold your breath.
Yes, his announcement went viral earlier this month, but this kind of change requires congressional action and Republicans now control both the House and Senate. Even if Congress acts, states could opt out of participating altogether.
For now, students need to come up with about $3,300 for a year at the average two-year college. And that only covers tuition and fees. Other expenses could ring up an additional $13,000, according to The College Board. Instead of waiting for Washington to make a change, here are other ways to foot the bill.
Pell Grants: The federal government gives out grants of up to $5,730 to about 9 million students a year. They can be used for tuition, fees, books and living expenses. It's based on financial need, and those making less than $60,000 typically qualify for at least some award, said Robert Kelchen, a professor of higher education at Seton Hall University. Students must submit the FAFSA form in order to be eligible.
Related: Obama wants community college to be free
Scholarships: Check the college's financial aid office, but don't forget about local groups that may offer awards based on special talents or interests. Some are merit-based, but others can be based on need, so be sure to fill out the FAFSA form early. Some states and colleges have a finite amount of money to dole out, and it's allocated on a first-come, first-serve basis each year.
Related: Colleges with the best bang for your buck
Think about a teaching career: You can get up to $4,000 a year from the federal government for pursuing a teaching degree. But you must agree to teach in a high-need field in a low-income area for at least four years after graduating, or you have to pay the money back.
Tax credit: Every student is eligible for a tax refund each year. Students making less than $80,000 are eligible for a maximum of $2,500. Of course, you still have to pay for tuition upfront before the credit comes your way.
Related: Nearly 8 out of 10 U.S. taxpayers get refunds
Move to Tennessee or Chicago: There are already programs here that help cover the cost of community college, similar to the one proposed by President Obama. The state of Tennessee will cover the cost of tuition at a community college or technical school that's not already covered by Pell Grants and other state scholarships.
Chicago will similarly cover the remaining cost of tuition, fees and books. Students who earn a 3.0 GPA in high school, place into college-level math and English courses, and are accepted into one of the City Colleges of Chicago are eligible.
Related: Why Chicago is mandating coding education
Ask your employer: Some companies, big and small, offer discounts on college tuition, but they often dictate which school is eligible. Starbucks (SBUX) offers some money to workers who take classes at Arizona State University's online program, and Wal-Mart (WMT) gives a discount to those taking classes at an online school called American Public University. Home Depot (HD) supports employees pursuing a degree at any accredited college, university or technical school.
Related: 5 hourly jobs that will help pay your tuition"
