dt,title,href,newstxt
2015-02-15 09:34:48,"Here's what to really fear about the stock market - Feb. 15, 2015 ",http://money.cnn.com/2015/02/15/investing/stocks-markets-investing-bubble/index.html,"Six years into the bull market in stocks and there's no shortage of scary things on investors' worry list.
From Vladimir Putin and Greece to the dramatic plunge in oil prices, something is bound to trip up the stock market, right? After all, the good times on Wall Street can't last forever.
But the key to knowing where stocks are going next is focusing on the real risks to the market, not the irrational ones.
Fear a bubble in bonds, not stocks: Yes, stocks are up over 200% since the 2009 lows. And yes, the Dow is once again trading above 18,000 and the S&P 500 just hit a new record.
But stocks are barely positive on the year. Valuations look a bit lofty, but not insanely high. There are good reasons for stocks to be up: The U.S. economy is humming along, the jobs market is finally looking strong and corporate profits continue to smash records.

Related: Greed is back! Stocks at all-time highs
It's much tougher to justify what's going on in the bond market. The yield on the 10-year Treasury isn't far from an all-time low. That usually happens during times of market stress, not when stocks are soaring.
It's even stranger abroad. The yield on 10-year bonds from Portugal -- a country rumored to be on its way out of the eurozone not long ago -- tumbled to a record low of 2.3% last week. That's down from a whopping 16% in 2012.
Yields have actually tumbled into negative territory in Belgium, Denmark, France, Japan, the Netherlands and Switzerland. Think about that. Investors are basically willing to lose money when they buy these government bonds. And even some corporate bonds, too.
Given the low levels of liquidity in the bond market, it's scary to think about what happens when the bond bubble eventually pops.

Related: So much for the bond bubble bursting
Fear reluctant consumers, not tumbling oil prices: The crash in crude prices has spooked investors worried about how it'll impact corporate profits and what it says about the health of the global economy.
While those are valid concerns, there is mounting evidence the plunge in oil prices is mostly being caused by too much supply, not a sharp decline in demand. And while energy profits are shrinking big time, the consensus is that cheap oil is a net positive for the U.S. economy.
What's really needed is for American consumers to feel confident enough to spend the estimated $750 they're saving on gas this year, not just save it or pay down debt. That's critical because consumer spending accounts for two-thirds of the U.S. economy.
Yet retail sales in January crept up just 0.2% from December, even after excluding auto and gasoline sales. Spending actually decreased on items like furniture, clothing and sporting goods.
That needs to change for the economy to kick into a higher gear.
Related: The stock market needs American spending
Fear the Fed doesn't raise rates, not a June hike: After six years of emergency care from the Federal Reserve, the U.S. economy finally looks healthy enough to stand on its own two feet.
No, it's not in perfect shape. Inflation is still running well below the Fed's 2% target. Wage growth remains a sore point for American workers.
But it would be scarier for investors if the Fed doesn't ultimately raise rates later this year. It would raise questions about whether the central bank has boxed itself into a corner with low rates and leave Fed Chair Janet Yellen and her committee with fewer tools to respond to future shocks.
If the Fed waits too long to raise rates it also risks inflating another asset bubble just like 10 years ago when cheap credit fueled the housing bubble.
Related: Making money as the Fed hikes won't be easy
Fear Europe's future, not the current Greek drama: Investors freaked out earlier this year when Greece elected the anti-austerity Syriza party. The stock market in Athens plummeted and Alan Greenspan predicted the euro's demise as talks over a revamped Greek bailout stumbled.
But the real fear shouldn't be about Greece. It does seem likely the new government will eventually reach a deal with Greece's creditors.
The bigger question mark is whether leaders in Europe will get their act together fix the continent's sleepy economy for the long run.
Not only must the European Central Bank carry out its promise to stimulate the economy through bond purchases, but national leaders have to do their part, too. They need to push through politically painful economic reforms to drive future growth.
Related: Europe is a mess. Should Americans buy now?
Bottom line: Most experts still believe the U.S. stock market will rise in 2015. But with the major averages at or near record highs, it's hard to blame investors for closely scrutinizing the health of the global economy before jumping in to buy more stocks."
2015-03-06 12:01:22,"Germany quotas: New 30% rule for women on boards - Mar. 6, 2015 ",http://money.cnn.com/2015/03/06/news/women-boards-germany-30/index.html,"Germany has just made a radical move to promote gender equality in the boardroom.
The German parliament passed a new law Friday requiring the country's biggest companies to appoint women to 30% of the seats on their non-executive boards from 2016. The plan is to increase the quota to 50% from 2018.
The new rules apply to about 100 of Germany's biggest listed companies, where shareholder and employee representatives make up the supervisory board.
A number of big German companies, including Adidas (ADDYY) and financial services firm Allianz (AZSEY), already meet the 30% quota. However, many others lag behind, including Volkswagen (VLKAY), which only has 15% female representation on its board.
Thousands more smaller German companies are also required to set binding targets this year for increasing the number of women on their supervisory boards and executive committees.
The new quotas will also apply to senior leadership positions in the public sector.
Related: Best and worst countries for women on corporate boards
Catalyst, a group that lobbies for women in business, says research shows that companies with diverse boards attract more talented employees, are more innovative, and have greater financial success than companies where men dominate.
However, many people are opposed to fixing binding quotas for women, arguing that unqualified people may be given positions in order to satisfy the rules.
Other critics argue that the German law doesn't do enough to tackle the gender imbalance on top management teams, where the real power lies. A supervisory board provides general oversight and appoints top executives, but is not involved in setting strategy or daily corporate affairs.
Currently, Norway has the best record for women on boards, according to Catalyst. In 2003, the country passed a law requiring at least 40% of corporate board members to be female. At present, nearly 36% of board members are women.
The situation is very different in Japan, which is known for having a low rate of female participation in the workforce. Women in Japan hold about 3% of all board seats at major companies.
--CNNMoney's Mark Thompson contributed to this report."
2015-02-26 10:51:53,"FCC adopts historic Internet rules - Feb. 26, 2015 ",http://money.cnn.com/2015/02/26/technology/fcc-rules-net-neutrality/index.html,"The FCC has passed a historic measure to more strictly regulate the Internet.
The new rules, based on the principles of ""net neutrality,"" act to provide equal opportunity for Internet speeds and access to websites.
The central question was whether network owners -- like Comcast (CMCSA) or Time Warner Cable (TWC) -- can discriminate what runs on their cables. The FCC's answer on Thursday was: No.
The Democratic-led commission approved 3-to-2, split along party lines, to assert extra government authority over the Internet.
Now for the wild claims on both sides: ""We saved the Internet!"" or ""We've destroyed it with government bureaucracy!""
Don't believe the hype. Take a deep breath. It's a long, tricky road ahead.
The FCC rules won't be official until maybe summertime. Then major telecom companies will challenge new rules in court. A judge might put the rules on hold. The next president, if Republican, could let this fizzle away.
That's why, in the near term, nothing changes. No, Netflix won't suddenly stream any faster. No, AT&T and Comcast won't abruptly stop laying down high-speed fiber cables in your neighborhood as retaliation. And yes, Netflix can still cut deals with broadband companies for faster access to a network.
So what just happened, exactly? The FCC just granted itself the power to defeat a raging, fire-breathing monster: the monopolistic network owners who can kill Internet freedom by blocking websites -- or by creating an Internet fast lane for the privileged, few, rich tech companies that can pay for it.
But this monster is actually a phantom menace. Sure, in the past, telecoms have been bullies. Verizon blocked Google Wallet. AT&T blocked video chatting apps. Comcast slowed down file-sharing services like BitTorrent. Rural telephone provider Madison River blocked Vonage's over-the-Internet phone calls. However, the FCC used existing rules to fix those problems.
The new rules essentially maintain the status quo. The Internet sure feels free today. It'll feel the same way tomorrow.
That's why some worry about how the FCC just ensured net neutrality. To enforce fairness rules, the agency will regulate network owners by scooping them up under Title II of the 1934 Telecommunications Act, a specific set of regulations that apply to phone companies. Telecoms say the rules don't match the services they provide. They don't trust the FCC's promise that it will apply only a tiny fraction of those rules and won't regulate rates and increase taxes.
""Assurances like these don't tend to last very long,"" warned Republican FCC Commissioner Ajit Pai. ""Expect ... regulation to ratchet up as time goes on.""
Meanwhile, Tom Wheeler, the FCC chairman who ditched his original dialed-back plan for this one, assured this isn't a government power grab.
""This is no more a plan to regulate the Internet than the First Amendment is a plan to regulate free speech,"" he said. ""They both stand for the same concept: openness, expression and an absence of gatekeepers.""
How did we start caring about this? Credit comedian John Oliver, who got enough viewers of his HBO show that a record 4 million Americans sent comments to the FCC.
He framed it from the point of view of the average person dealing with their Internet service provider. Plans are expensive, service is inexplicably spotty and you have little choice. Clearly, the network owners are the bad guys.
During Thursday's hearing, the testimony of those who spoke in favor of the FCC's new rules all took that populist tone. Etsy CEO Chad Dickerson thanked the FCC for ""protecting the Internet as an engine for economic opportunity."" Celebrated technologist Sir Tim Berners-Lee said this ensures modern entrepreneurs the same opportunity he had when he created the World Wide Web 26 years ago.
After the vote, President Obama issued this statement via Twitter: ""Today's FCC decision will protect innovation and create a level playing field for the next generation of entrepreneurs.""
But wait, there's a third option. As this fight makes its way through the courts, Congress has the opportunity to stand up and write rules that work too.
After all, both network owners and the websites that flow data through them have a point. Outright blocking and anti-competitive behavior is unfair and should be illegal. On the other hand, for technical reasons, network owners need to manage traffic. Your video stream needs to move faster than your email for your experience to feel smooth.
That's why critics call the Title II approach -- what the FCC did today -- a blunt instrument. But it's not clear that it's as wonderful -- or terrible -- as everyone says.
Rob Atkinson, president of the Information Technology and Innovation Foundation, a technology policy think tank, laments how the conversation has spiraled out of control.
""This has become a debate about a false choice: letting carriers do whatever the heck they want and overly burdensome regulations,"" Atkinson said.

Related: What does net neutrality mean for you?
Related: Expect a legal fight from AT&T over net neutrality
Related: 4 bad things Internet companies can't do anymore -- if the FCC gets its way"
2015-03-02 07:08:57,"Too much Facebook leads to envy and depression - Mar. 2, 2015 ",http://money.cnn.com/2015/03/02/technology/facebook-envy/index.html,"Constantly checking Facebook to see what your friends are doing could lead to some serious depression.
A recent study conducted by researchers at Nanyang Technological University, Bradley University and the University of Missouri Columbia found that heavy Facebook (FB, Tech30) users can experience envy -- which can ultimately lead to extreme sadness.
The researchers surveyed 736 college students and found that, basically, if you quietly stalk your friends on Facebook and then realize that your life doesn't measure up to theirs, you feel bad about yourself.
""If Facebook is used to see how well an acquaintance is doing financially or how happy an old friend is in his relationship -- things that cause envy among users -- use of the site can lead to feelings of depression,"" said Margaret Duffy, a professor at the University of Missouri School of Journalism.
This isn't just a college phenomenon. I am nearing middle age and I can relate.
Facebook is a huge part of my life. Like most Facebook users, I have the app on my phone. I check it at work. I check it at home. I check it when I am out. If I am in a subway station with Wi-Fi, I check it there too.
I am up to date on all my friends, their kids and whatever they are reading at that moment. Unfortunately, it's an addiction that I can't quit.
Facebook has allowed me a little window into my friends' lives back home. They have babies -- well some of them have teenagers. They have lovely homes. And the dinners -- oh the dinners they serve! There are food presentations that look like something out of a Martha Stewart magazine. I watch all the videos of their kids saying the darndest things. I click on their pictures of vacations in exotic places.
I have come to the conclusion that Facebook is a lifestyle magazine featuring my friends, who are doing it better than me.
I peruse Facebook from computer on my coffee table, because I am not grown up enough to buy a desk for myself. My coffee table is my all-purpose table. I eat there too -- usually hunks of cheese with a knife and no crackers. That's right no crackers, because I am too lazy to run out to the bodega.
My only consolation is sometimes my friends confuse ""there,"" ""their"" and ""they're"" in their posts about their lovely vacations and darling children. Then suddenly, I feel a little bit better about myself.
Related: The most ridiculous things people do to their company iPhones
Related: Mark Zuckerberg says Happy New Year in Mandarin"
2015-02-20 07:54:56,"No dogs allowed: San Francisco's pet housing crisis - Feb. 20, 2015 ",http://money.cnn.com/2015/02/20/real_estate/pets-san-francisco/index.html,"The housing crunch in San Francisco isn't just forcing out lower income renters, it's forcing out Fido, too.
According to San Francisco animal welfare nonprofit SF SPCA, there's been a surge in owners abandoning their pets due to an inability to find pet-friendly housing.
Over the last year, one in four people who left pets with the organization cited problems finding pet-friendly housing. The organization started tracking the numbers this year after staff noticed that housing issues were becoming an increasingly common problem, according to spokesperson Krista Maloney.
An influx of highly-paid tech workers in recent years have pushed out many low- and middle-income renters and driven rents higher. With limited space to build on and tight regulations, the short supply of housing in the city has only made matters worse.
Competition for each apartment is so fierce that landlords can afford to be more selective about tenants, said Mark Campana, president of Anchor Realty, which does not allow pets in any of its roughly 1,000 units.
Related: 10 least affordable rental markets
""Now with the market moving with great speed and with vacant units in high demand, an owner doesn't have the incentive to be pet-friendly,"" said Campana.
Michael Harrington, president of Pacific Union Property Management, said that while some landlords may be flexible about allowing small dogs, they know they can always find another tenant without an animal.
""We're definitely in what I would call a landlord's market,"" said Harrington.
Just because a unit is advertised as pet-friendly doesn't mean it will go to a pet owner, said Dr. Emily Weiss, vice president of research and development at ASPCA.
That might explain why data from online rental listing company, Lovely, showed that the percentage of listings that said they allowed ""some pets"" actually grew from 34% to 39% between 2012 and 2014.
Pet-friendly options also tend to be more out of reach for low-income renters, said Weiss. According to a recent analysis of listings by HotPads, pet-friendly units in San Francisco cost an average of 12% more than those that don't allow pets. That's compared to a national average of 3.5% in major metro areas, the company found. And that doesn't include pet deposits or additional ""pet rent,"" which may be required on top of normal rent.
San Francisco even lags behind New York City, where the share of dog-friendly apartments is almost three times higher and just over half of all landlords allow ""some pets,"" according to Lovely. Yet, pet ownership in the city has long faced the same challenges that the SPCA is seeing in San Francisco, said Sandra DeFeo, executive director of the Humane Society of New York.
""People with more means tend to find places that will accept them with pets,"" she said.
Jackie Tom, president of leasing company RentalsinSF, said it was hard enough finding an apartment that would accept her Great Dane 15 years ago. Today, the market is even more stressful and more expensive for pet owners, she said.
""There are a lot of wonderful pet owners and not enough affordable housing for them,"" said Tom, who manages 35 pet-friendly units in the city. ""They can keep their pets, but there is a price.""
Related: 'Why I have a roommate at my age'
Eric Andresen, president of the San Francisco Apartment Association and Viking Services Corp., which manages about 2,300 housing units in the area, said he would be surprised if the housing crunch really made the city less pet-friendly overall.
He notes that many residents have learned to skirt landlords' pet restrictions by claiming their pets as assistance animals, abusing laws meant to help people with disabilities. The problem has become so widespread in recent years that Andresen recommends landlords simply allow pets so they have some control over the animals in their buildings.
""Then at least you can protect yourself with a pet deposit,"" said Andresen. ""And it certainly puts your relationship with your tenant in a more cooperative place."""
2015-02-22 10:05:44,"The Oscars red carpet rule that helps ABC - Feb. 22, 2015 ",http://money.cnn.com/2015/02/22/media/oscars-red-carpet-tv-rules/index.html,"Every Oscars night, at exactly 7:30 p.m. Eastern time, E! cuts away from the red carpet at the Academy Awards, and other channels end their coverage altogether.
Why?
It's part of the deal between the Academy of Motion Picture Arts and Sciences and ABC, the official broadcaster of the academy's annual awards show. ABC is the only channel allowed to be live from the red carpet between 7:30 and 8:30 p.m.
Most viewers don't know about the deal, and that's why there are surprised (and perturbed) tweets right after the 7:30 mark every year. (Here's an example from last year.)
But it seems to have the desired effect -- that is, steering viewers to ABC, first for the fashion sightings and celebrity interviews, and then for the actual awards show.
ABC has televised the Oscars every year since 1976. Its deal with the academy was going to expire in 2014, but the two sides renewed it three years early, in 2011, and now it's set to run through 2020.
Related: Why the 'best' picture doesn't always win
The deal allows ABC's rivals to have spots along the red carpet and to broadcast and stream live interviews. CNN, the owner of this website, airs a red carpet special starting at 6 p.m. Eastern. E! and a newbie entertainment channel, Pop TV, also have multiple hours of live coverage.
But the live coverage has to stop at 7:30. (CNN and Pop TV sign off at that time; E! keeps going, but only shows videotape and photos from the red carpet, no live pictures.)
What's in the $160,000 Oscars gift bag
In an amusing twist, the other networks can keep interviewing stars on the carpet -- but they can't show the interviews until after 8:30.
The carpet area actually closes at 8 p.m. But ABC's exclusive window of time extends until 8:30 because that's when its special pre-show ends and the awards show begins.
""Oscar's Red Carpet Live,"" as the ABC special is called, scored 27.6 million viewers for the 8 to 8:30 p.m. portion last year, and the awards averaged 43.7 million.
ABC declined to comment on the terms of the deal.
Related: Does the 'Oscar bounce' actually exist?"
2015-03-02 04:13:33,"$2 gas is gone -- prices have climbed for 5 weeks in a row - Mar. 2, 2015 ",http://money.cnn.com/2015/03/02/news/economy/gas-price-increases/index.html,"Gone are the days of $2 gas -- at least for now. Prices at the pump have climbed steadily for five weeks in a row.
The national average for a gallon of regular gas jumped nearly 40 cents a gallon in that period, to $2.43 a gallon, according to AAA.
That's the longest streak of increases in about two years, pushing average price back above $2 a gallon in all 50 states. In January, more than half of U.S. gas stations were selling gas for less than $2, and the national average stood at $2.03 a gallon.
Despite the price increase, drivers are still saving money at the pump. Prices are currently 90 cents a gallon below where they were in September 2014, and the U.S. Energy Information Administration forecasts that the typical American household will save $750 on gas this year.
In January, before prices bottomed out, a gallon of gas was selling for less than the cost of the crude used to make it, according to Tom Kloza, chief oil analyst for the Oil Price Information Service, which tracks prices on behalf of AAA.
Related: What's gas cost in your state?
Those low prices prompted refiners to cut back on production, Kloza said. He expects prices to rise through March as refiners prepare to switch to more expensive summer blends of gasoline.
But crude prices are still very low. Weakening economies in Europe and Asia, as well as more fuel efficient vehicles, have all cut worldwide demand for crude. An increase in U.S. oil production, which made the nation the world's largest source of oil last summer, has also pushed prices down, as has OPEC's refusal to cut production. A strong dollar is also pushing prices lower.
Related: Scared OPEC members want meeting but Saudis call the shots
One factor that has not affected prices, according to Kloza, is a refinery strike by the United Steelworkers union. Management has kept these refineries up and running despite the strike, so it's had little impact on gasoline production and prices.
Kloza expects prices to top out at about $2.50 to $2.70 a gallon, before turning lower once again. By this summer or early this fall, he predicted, gas will be back below $2 in many areas.
Related: Warren Buffett ditched Big Oil. Dumb move?
"
