dt,title,href,newstxt
2015-02-09 11:53:40,"Will Brian Williams return? - Feb. 9, 2015 ",http://money.cnn.com/2015/02/09/media/brian-williams-future/index.html,"By announcing a leave of absence for ""several days,"" Brian Williams started a ticking clock that will end with his return to the ""NBC Nightly News"" anchor chair. Unless he doesn't return.
A growing number of people inside NBC believe he won't be able to return, but others are more optimistic.
The television news world -- simultaneously close-knit and cutthroat -- is preoccupied by the story. I have never seen anything quite like it.
Some are gleeful about what's going on, but many others are saddened by it. Many at NBC News are scared.
Fundamentally the network now faces a wretched business calculation: Is Williams -- the No. 1 news anchor in the United States -- too damaged to continue in the job? And are NBC's ratings and profits better off with him or without him?
To be clear, this is not what I'm asking. This is what NBC News officials are asking. In fact, they'd be derelict not to be asking.
The president of NBC News is Deborah Turness. Her boss is Pat Fili-Krushel, the chair of the NBCUniversal News Group, which also includes MSNBC and CNBC. Fili-Krushel reports to NBCUniversal CEO Steve Burke.
The trio of executives have said nothing publicly since Friday, when Turness confirmed that an internal fact-checking investigation was underway.
But this crisis is taking up all of their time. Politico reported that Burke held a meeting at his home on Sunday about it.
On Monday, the preliminary Nielsen ratings for last week's ""Nightly News"" came in, and they suggested further trouble.
Williams had been beating his main competitor, ABC's David Muir, all week, including Thursday, the day after Williams apologized on-air.
But on Friday, once the scandal had become a bigger national news story, Muir won by more than 300,000 viewers ages 25 to 54, the key demographic, and almost 500,000 total viewers.
Such a dramatic day-to-day swing is highly unusual in network news.
So will NBC executives make a decision about Williams' future ""based on the entirety of his career and not only one or two or three mistakes,"" as MSNBC's Joe Scarborough put it on Monday?
Or are the mistakes -- some are calling them lies -- and the resulting ratings trouble enough to end his career?
I've been talking to players on all sides and at all rungs of the industry's ladder, from anchors and presidents to associate producers. Everyone has an opinion, some more cynical than others. Everyone agrees Williams and NBC News have been hurt by his embellishments. Williams agrees too -- that's why he profusely apologized to his colleagues on Friday, and is said to be eager to speak more. Here's where people disagree:

Some say Williams has been telling tall tales for years, and it's finally caught up with him.
They say NBC has to replace him right away, the sooner the better, to stem the proverbial bleeding.
They think there's no way viewers will take him seriously anymore, not after #BrianWilliamsMisremembers became a trending topic.
Is there some schadenfreude and television back-stabbing going on here? Sure there is. Pains at NBC could pretty quickly translate to gains at ABC and CBS, its two big rivals in network news.
And as anyone in his position would, Williams has lots of detractors, just like he has lots of fans.
But the scrutiny is legitimate. It's rooted in something real, not just in wishful thinking from NBC's competitors.
Related: What we know about the controversy
Maureen Dowd of The New York Times wrote on Sunday: ""NBC executives were warned a year ago that Brian Williams was constantly inflating his biography.""
David Carr, also of The Times, wrote on Monday, ""Those of us who worked the Hurricane Katrina coverage rolled our eyes at some of the stories Mr. Williams told of the mayhem there.""
While NBC conducts its own internal fact-checking exercise, journalists from many other news outlets are looking for other discrepancies in Williams' past reports.
Some television critics have even started to call for Williams' resignation.
""There is no way to contain the damage. No way to continue. No way out,"" Newsday's Verne Gay wrote, adding, ""It's all over but the press release.""
One of my sources at NBC, who called Williams ""too big to fail"" on Thursday, took that back over the weekend and acknowledged it's now possible that he may be forced out.

Others say Williams is in trouble, but NBC should stand by him and let him regain trust.
These people -- including some at other networks -- are disturbed by the trial-by-Twitter that has enveloped Williams. They hope he can stage a comeback.
""I feel sad about Brian Williams,"" former CNN host Larry King tweeted on Sunday night.
Here's an important point: some TV anchors and executives are wondering what would happen if others' resumes and talk-show appearances were scrutinized the same way.
There's lots of talk about second chances and the benefit of the doubt.
MSNBC's Willie Geist said Monday that viewers ""have every right if they don't want to watch him anymore, that's their right. But... I think we should look at the totality of the man"" as well as the current controversy about misstatements.
That sentiment can be found all over the ""Nightly News"" Facebook page, too. ""Not watching until Brian is back,"" wrote one commenter. ""Tuning out until NBC grows a spine and backs Brian,"" wrote another. Some of these fans say they're tired of ""witch-hunts.""

So what's going to happen? No one knows.
On my CNN program ""Reliable Sources,"" I asked two veteran TV journalists -- Jeff Greenfield and Frank Sesno -- if Williams will return to the chair, and their answers were refreshingly blunt.
""We don't know,"" Sesno said. ""It depends where this investigation leads. It's just too much up in the air right now.""
Indeed, whether NBC has the stomach for all of this is an open question. The network has invested tens of millions of dollars in Williams.
It just renewed his contract last December -- he's set to be the ""Nightly News"" anchor for almost the rest of the decade. Before this scandal, his newscast was No. 1 in the ratings among both total viewers and 25- to 54-year-olds (although not as firmly No. 1 as it's been in the past).
But the current controversy now gets added to a long list of other challenges for the news division.
Burke, the NBCUniversal CEO, must have cringed at this Politico headline on Friday: ""The decline and fall of NBC News.""
Burke reports to Brian Roberts, the CEO of NBC's parent company Comcast (CCV). Roberts has a lot on his plate, including a pending merger with Time Warner Cable (TWC). I've known him to be the type of guy who hates distractions and controversies. He appreciates NBC News but he doesn't want it to embarrass him or his company.
Right now, this is embarrassing."
2015-02-03 11:11:02,"Croatia wipes out debts for 60,000 people - Feb. 3, 2015 ",http://money.cnn.com/2015/02/03/pf/debt-forgiveness-croatia/index.html,"Imagine meeting a fairy godmother that made all your debt disappear. (Bippity boppity boop!)
This fairy-tale scenario is set to become a reality for about 60,000 low-income Croatians who have been struggling to pay their bills.
The Croatian government, acting in place of a fairy godmother, has launched a program called ""Fresh Start"" that will cancel the debt owed by some of the poorest people in the country.
The state, alongside a number of banks, telecom operators, electricity companies, local governments and other firms, have collectively agreed to forgive debt worth up to 60,000 Croatian kuna ($8,830) per individual.
Croatia's economy is in the midst of a prolonged recession, with gross domestic product declining every quarter since the end of 2011.
This measure is expected to boost consumer confidence and spending.
Related: Aussie chocolate bars are getting smaller
The program is designed specifically for households that made less than 2,500 kuna ($370) over the last three months and meet other financial criteria.
""This is for the bottom layer of debtors where there is clearly no chance that they will ever repay the debts that they have,"" said Otilia Dhand, a political analyst at Teneo Intelligence.
The government noted that it has never had a debt forgiveness program of this magnitude, but said this is a one-off initiative.
Dhand says the move was not a surprise since the government has recently lost support in the polls. She said this will give the government a popularity boost ahead of parliamentary elections, which are expected by the end of February 2016.
The International Monetary Fund has recommended a laundry list of reforms and overhauls to get the Croatian economy back on track. In November, it said it supported the idea of writing off debt for distressed households."
2015-02-05 11:22:03,"Illegal ways people are nabbing bigger tax credits - Feb. 5, 2015 ",http://money.cnn.com/2015/02/05/pf/taxes/tax-credit/index.html,"Most people who want to cheat on their taxes will do anything they can to understate their income. After all, the more you make, the more you'll likely to owe.
But there's at least one scam where an unscrupulous tax preparer will try to inflate a clients' income, the IRS said.
Here's why: Some people make too little to owe any federal income taxes, but may still qualify for a refund by claiming certain refundable credits, like the Earned Income Tax Credit (EITC).
To make sure their client gets the maximum amount, some tax preparers will report that they earned more than they actually did.
For instance, a couple with two kids who earned between $13,650 and $23,300 in 2014 wouldn't owe any federal income taxes but could get a maximum of $5,460 from the EITC, said Mark Luscombe, principal federal tax analyst for tax publisher Wolters Kluwer, CCH.
But if they earned less than $13,650, they wouldn't get that maximum refund amount, Luscombe said.
Related: Beware promises of 'outlandish' refunds
So by falsely inflating their income to, say, $14,000, they could qualify for the full $5,460.
Another credit where it may be possible to carry out this type of scam is the refundable portion of the Child Tax Credit, Luscombe said. That refundable portion is also tied to earned income and is intended to help offset the cost of raising children for the lowest income families.
What does the tax preparer get out of the deception? A bigger fee. Typically such preparers will take their fee out of the refund.
And the bigger the refund, the bigger the potential fee.
But if they're caught, the low-income couple will be on the hook. Everyone is legally responsible for what's on their tax return, regardless of who prepared it. Ramifications include having to repay the erroneous refund, including interest and penalties, the IRS said."
2015-02-25 05:27:46,"What does net neutrality mean for you? - Feb. 25, 2015 ",http://money.cnn.com/2015/02/25/technology/net-neutrality-fcc/index.html,"On Thursday, the FCC approved new rules that -- depending on which side you believe -- either ensure a fair Internet or smother it with unnecessary regulation.
The FCC's vote allows it to assert extra authority over the Internet to establish net neutrality. It's like equal opportunity for Internet speeds and access to websites. No unfair fast/slow lanes. No blocking of legal services on your phone, computer or tablet.
But hold off on celebrating or gasping in despair.
In reality, the world won't look any different on Friday -- or anytime soon. The biggest hopes and fears about regulators won't materialize. Netflix won't suddenly stream any faster for you. AT&T (T, Tech30) and Comcast (CMCSA) won't abruptly stop laying down high-speed fiber cables and investing in their networks as retaliation. And Netflix can still cut deals with broadband companies for faster access to a network.
Instead, the FCC rules won't be official until maybe summertime, and major telecom companies will challenge them in court. A long fight will follow that might stretch all the way until the next presidential administration.
And if a Republican wins the 2016 presidential election, then this could all fizzle away, and we're back at square one: a country without strong net neutrality rules.
Experts on both sides of this heated debate see this as a long fight that started long ago and isn't ending anytime soon.
Still, it's worth a quick recap over the two vastly different versions of this debate.
The pro-FCC regulation side demands strong net neutrality rules. AOL (AOL, Tech30), Facebook (FB, Tech30), Netflix (NFLX, Tech30), Twitter (TWTR, Tech30), Vimeo and every other major Internet company is on this list.
They create the content you read and watch online, and they don't want to face discrimination by network owners who can threaten to charge higher fees or slow them down.
To them, FCC Chairman Tom Wheeler's proposed rules sound promising. For example, Verizon can't block Google Wallet on your smartphone, like it did in 2011. Your phone carrier can't block tethering apps, which turn your phone into an Internet hotspot for your laptop or tablet. AT&T can't block video chatting apps like FaceTime or Google Hangouts. And Comcast can't slow down file-sharing websites, like it did to BitTorrent a few years ago.
The anti-FCC regulation side doesn't want additional rules, because the situations cited above were already resolved with the existing rules. AT&T, Comcast, Time Warner Cable (TWC), Verizon (VZ, Tech30) and other Internet service providers are on this side.
They own the networks and fear price controls. Fearing a bad business environment, AT&T has threatened to pause investment in its infrastructure.
Their big gripe with the FCC is that the agency will regulate Internet providers by scooping them up under Title II of the 1934 Telecommunications Act, a specific set of regulations that apply to phone companies. Telecoms say the rules don't match the services they provide. They don't trust the FCC's promise that it will apply only a tiny fraction of those rules.
So, for now, forget all this talk about the freedom of the Internet. This is going to be a long, boring fight about whether the FCC has the authority to regulate the Internet the way it wants to.
As Robert M. McDowell, a former FCC commissioner turned telecom lawyer in Washington, D.C. notes: ""The Internet has thrived in the absence of net neutrality rules, thank you very much.""
Republicans in Congress tried and failed to block the FCC from voting on the new regulations. But Congress itself is largely to blame for the new regulations. The only reason the FCC is getting creative with the rules is because the old ones don't work well with our new world of Internet-enabled mobile devices and data-heavy video streaming websites.
Congress could, theoretically, step in and establish rules about Internet fairness. Even the anti-regulation folks are for that.
But given the poisonous atmosphere on Capitol Hill ""it's not a practical alternative"" right now, said Former FCC Commissioner Michael Copps, a net neutrality supporter now with the populist advocacy group Common Cause.

Related: You want the best flight deal? Google it
Related: Apple ordered to pay $533 million in iTunes patent lawsuit
Related: 15 startups. One Silicon Valley bed and breakfast."
2015-02-10 07:59:35,"Brian Williams suspended for 6 months - Feb. 10, 2015 ",http://money.cnn.com/2015/02/10/media/brian-williams-nbc-suspended/index.html,"""NBC Nightly News"" anchor Brian Williams is being suspended for six months without pay following revelations that he exaggerated tales from an Iraq War mission in 2003.
Tuesday night's announcement capped an extraordinary and painful six-day period for the network. Television veterans could recall nothing quite like it: a network benching the face of its news division to penalize him for what the CEO of NBCUniversal, Steve Burke, called ""inexcusable"" actions.
There is a widespread belief among rank-and-file NBC staffers that he may never actually return to the anchor chair he has held since 2004.
And if he does return, he'll return in a diminished capacity.
Related: Read NBC's statement about the suspension
Meanwhile, NBC's investigative unit is continuing to fact-check Williams' past reports, and could come up with more damaging revelations.
Still, Burke said in a statement, ""He deserves a second chance and we are rooting for him. Brian has shared his deep remorse with me and he is committed to winning back everyone's trust.""
Eight hours earlier, Williams visited Burke at the apartment Burke has on Central Park West in Manhattan. There, Tuesday evening's announcement began to take shape.
NBC News president Deborah Turness informed staffers of the network's suspension decision at a 7:15 p.m. meeting, held minutes after Williams' fill-in, Lester Holt, finished anchoring Tuesday's ""NBC Nightly News.""
""The suspension will be without pay and is effective immediately,"" Turness wrote in a memo.
Holt will continue to substitute-anchor the ""Nightly News."" An NBC source said Williams' name would likely be removed from the newscast's graphics later this week.
One rival executive speculated that NBC, by suspending Williams, was simply ""buying time for more negotiations"" that might lead to the anchor's exit.
Others, however, said it was quite possible he would stay put.
Within NBC News, shock about the announcement gave way to sadness and a general agreement that the news division is in the midst of its toughest period since the early 1990s, when journalistic lapses like a staged car accident for ""Dateline"" spurred soul-searching and management changes.
""I feel like I have just witnessed a sudden death,"" one longtime NBC News staffer said on condition of anonymity.
One NBC anchor called it ""humiliating for this whole network.""
Williams was, at least until last week, the single most popular news anchor in the United States. He reached about 10 million viewers a night. Just in December, NBC signed him to a new contract.
Several rival executives, speaking anonymously, said there was no joy to be had in Williams' befalling. ""Inside Edition"" host Deborah Norville said much the same thing on ""CNN Tonight.""
""There is no delight to be taken in this,"" Norville said, calling the blow to Williams' credibility ""also a blow for journalism.""
Related: Who is Lester Holt
For NBC News, the rolling calamity began last month when Williams paid tribute on his newscast to a soldier who had provided security to the anchor and his NBC crew in the desert on that day in 2003.
""The story actually started with a terrible moment a dozen years back during the invasion of Iraq when the helicopter we were traveling in was forced down after being hit by an R.P.G,"" Williams said on-air. ""Our traveling NBC News team was rescued, surrounded and kept alive by an armor mechanized platoon from the U.S. Army 3rd Infantry.""
Related: How Brian Williams' Iraq story changed
After a video of the segment was posted by the network on Facebook, several soldiers called out Williams for stretching the truth.
Williams, it turned out, had not been on the helicopter that was hit by an R.P.G.
Williams apologized last Wednesday, both on Facebook and on ""Nightly News,"" but what he said raised more questions than answers, and the controversy swelled over the next three days.
As skepticism mounted over Williams' claims about other reporting assignments -- namely his coverage of Hurricane Katrina in 2005 -- NBC News said Friday that it would conduct an internal investigation into the disputed accounts. Williams was once again in the anchor chair that night.
Related: Cronkite biographer on Brian Williams
But on Saturday, Williams said he had become ""too much a part of the news"" and that he planned to step aside from the newscast for ""the next several days."" Williams hunkered down even more on Sunday, canceling a scheduled appearance on the ""Late Show with David Letterman.""
By Monday, his attorney was in crisis meetings at 30 Rockefeller Center, where Williams' posters -- celebrating his first-place status in the nightly news wars -- hang on the walls.
Those meetings continued on Tuesday and ended with the suspension announcement.
On NBC's cable news channel MSNBC, Rachel Maddow covered the breaking news and told her viewers that ""NBC News will not make anyone available to discuss this story with us on the air.""
Over on Fox News, there were messages of support for Williams. Senior political analyst Brit Hume, a friend of Williams, told Megyn Kelly he hopes the embattled anchor pulls through this.
""I really like the guy, and I feel terrible for him tonight,"" Hume said.
""I think you speak for a lot of us,"" Kelly said.
The scribe who broke the news of Williams' recanted Iraq story last week said he wasn't celebrating the suspension.
""I don't get any satisfaction from seeing Brian Williams suspended,"" Stars and Stripes reporter Travis Tritten wrote on Twitter. ""Like the vets I spoke with, I just wanted to set the record straight."""
